edid-decode "/sys/class/drm/card0-HDMI-A-1/edid"

EDID (hex):
00ffffffffffff004c2d1c0f53415430
021d0103805021782a0275ae5043a926
0e5054bfef80714f810081c081809500
a9c0b3000101e77c70a0d0a029503020
3a001d4d3100001a000000fd0032641e
9837000a202020202020000000fc0043
33344a3739780a2020202020000000ff
0048544a4d3130303334370a202001e4
020324f147901f041303125a23090707
8301000067030c001000803c67d85dc4
016e80009d6770a0d0a0225030203a00
1d4d3100001a4ed470a0d0a046503020
3a001d4d3100001a565e00a0a0a02950
302035001d4d3100001a023a80187138
2d40582c450000000000001e584d00b8
a1381440f82c45001d4d3100001e00ab

edid-decode (hex):

00 ff ff ff ff ff ff 00 4c 2d 1c 0f 53 41 54 30
02 1d 01 03 80 50 21 78 2a 02 75 ae 50 43 a9 26
0e 50 54 bf ef 80 71 4f 81 00 81 c0 81 80 95 00
a9 c0 b3 00 01 01 e7 7c 70 a0 d0 a0 29 50 30 20
3a 00 1d 4d 31 00 00 1a 00 00 00 fd 00 32 64 1e
98 37 00 0a 20 20 20 20 20 20 00 00 00 fc 00 43
33 34 4a 37 39 78 0a 20 20 20 20 20 00 00 00 ff
00 48 54 4a 4d 31 30 30 33 34 37 0a 20 20 01 e4

02 03 24 f1 47 90 1f 04 13 03 12 5a 23 09 07 07
83 01 00 00 67 03 0c 00 10 00 80 3c 67 d8 5d c4
01 6e 80 00 9d 67 70 a0 d0 a0 22 50 30 20 3a 00
1d 4d 31 00 00 1a 4e d4 70 a0 d0 a0 46 50 30 20
3a 00 1d 4d 31 00 00 1a 56 5e 00 a0 a0 a0 29 50
30 20 35 00 1d 4d 31 00 00 1a 02 3a 80 18 71 38
2d 40 58 2c 45 00 00 00 00 00 00 1e 58 4d 00 b8
a1 38 14 40 f8 2c 45 00 1d 4d 31 00 00 1e 00 ab

----------------

Block 0, Base EDID:
  EDID Structure Version & Revision: 1.3
  Vendor & Product Identification:
    Manufacturer: SAM
    Model: 3868
    Serial Number: 810828115
    Made in: week 2 of 2019
  Basic Display Parameters & Features:
    Digital display
    Maximum image size: 80 cm x 33 cm
    Gamma: 2.20
    DPMS levels: Off
    RGB color display
    First detailed timing is the preferred timing
  Color Characteristics:
    Red  : 0.6796, 0.3125
    Green: 0.2617, 0.6621
    Blue : 0.1494, 0.0576
    White: 0.3134, 0.3291
  Established Timings I & II:
    IBM     :   720x400    70.082 Hz   9:5    31.467 kHz  28.320 MHz
    DMT 0x04:   640x480    59.940 Hz   4:3    31.469 kHz  25.175 MHz
    Apple   :   640x480    66.667 Hz   4:3    35.000 kHz  30.240 MHz
    DMT 0x05:   640x480    72.809 Hz   4:3    37.861 kHz  31.500 MHz
    DMT 0x06:   640x480    75.000 Hz   4:3    37.500 kHz  31.500 MHz
    DMT 0x08:   800x600    56.250 Hz   4:3    35.156 kHz  36.000 MHz
    DMT 0x09:   800x600    60.317 Hz   4:3    37.879 kHz  40.000 MHz
    DMT 0x0a:   800x600    72.188 Hz   4:3    48.077 kHz  50.000 MHz
    DMT 0x0b:   800x600    75.000 Hz   4:3    46.875 kHz  49.500 MHz
    Apple   :   832x624    74.551 Hz   4:3    49.726 kHz  57.284 MHz
    DMT 0x10:  1024x768    60.004 Hz   4:3    48.363 kHz  65.000 MHz
    DMT 0x11:  1024x768    70.069 Hz   4:3    56.476 kHz  75.000 MHz
    DMT 0x12:  1024x768    75.029 Hz   4:3    60.023 kHz  78.750 MHz
    DMT 0x24:  1280x1024   75.025 Hz   5:4    79.976 kHz 135.000 MHz
    Apple   :  1152x870    75.062 Hz 192:145  68.681 kHz 100.000 MHz
  Standard Timings:
    DMT 0x15:  1152x864    75.000 Hz   4:3    67.500 kHz 108.000 MHz
    DMT 0x1c:  1280x800    59.810 Hz  16:10   49.702 kHz  83.500 MHz
    DMT 0x55:  1280x720    60.000 Hz  16:9    45.000 kHz  74.250 MHz
    DMT 0x23:  1280x1024   60.020 Hz   5:4    63.981 kHz 108.000 MHz
    DMT 0x2f:  1440x900    59.887 Hz  16:10   55.935 kHz 106.500 MHz
    DMT 0x53:  1600x900    60.000 Hz  16:9    60.000 kHz 108.000 MHz (RB)
    DMT 0x3a:  1680x1050   59.954 Hz  16:10   65.290 kHz 146.250 MHz
  Detailed Timing Descriptors:
    DTD 1:  3440x1440   59.973 Hz  43:18   88.819 kHz 319.750 MHz (797 mm x 333 mm)
                 Hfront   48 Hsync  32 Hback  80 Hpol P
                 Vfront    3 Vsync  10 Vback  28 Vpol N
  Display Range Limits:
    Monitor ranges (GTF): 50-100 Hz V, 30-152 kHz H, max dotclock 550 MHz
    Display Product Name: 'C34J79x'
    Display Product Serial Number: 'HTJM100347'
  Extension blocks: 1
Checksum: 0xe4

----------------

Block 1, CTA-861 Extension Block:
  Revision: 3
  Underscans IT Video Formats by default
  Basic audio support
  Supports YCbCr 4:4:4
  Supports YCbCr 4:2:2
  Native detailed modes: 1
  Video Data Block:
    VIC  16:  1920x1080   60.000 Hz  16:9    67.500 kHz 148.500 MHz (native)
    VIC  31:  1920x1080   50.000 Hz  16:9    56.250 kHz 148.500 MHz
    VIC   4:  1280x720    60.000 Hz  16:9    45.000 kHz  74.250 MHz
    VIC  19:  1280x720    50.000 Hz  16:9    37.500 kHz  74.250 MHz
    VIC   3:   720x480    59.940 Hz  16:9    31.469 kHz  27.000 MHz
    VIC  18:   720x576    50.000 Hz  16:9    31.250 kHz  27.000 MHz
    VIC  90:  2560x1080   60.000 Hz  64:27   66.000 kHz 198.000 MHz
  Audio Data Block:
    Linear PCM:
      Max channels: 2
      Supported sample rates (kHz): 48 44.1 32
      Supported sample sizes (bits): 24 20 16
  Speaker Allocation Data Block:
    FL/FR - Front Left/Right
  Vendor-Specific Data Block (HDMI), OUI 00-0C-03:
    Source physical address: 1.0.0.0
    Supports_AI
    Maximum TMDS clock: 300 MHz
  Vendor-Specific Data Block (HDMI Forum), OUI C4-5D-D8:
    Version: 1
    Maximum TMDS Character Rate: 550 MHz
    SCDC Present
  Detailed Timing Descriptors:
    DTD 2:  3440x1440   49.987 Hz  43:18   73.681 kHz 265.250 MHz (797 mm x 333 mm)
                 Hfront   48 Hsync  32 Hback  80 Hpol P
                 Vfront    3 Vsync  10 Vback  21 Vpol N
    DTD 3:  3440x1440   99.982 Hz  43:18  150.972 kHz 543.500 MHz (797 mm x 333 mm)
                 Hfront   48 Hsync  32 Hback  80 Hpol P
                 Vfront    3 Vsync  10 Vback  57 Vpol N
    DTD 4:  2560x1440   59.951 Hz  16:9    88.787 kHz 241.500 MHz (797 mm x 333 mm)
                 Hfront   48 Hsync  32 Hback  80 Hpol P
                 Vfront    3 Vsync   5 Vback  33 Vpol N
    DTD 5:  1920x1080   60.000 Hz  16:9    67.500 kHz 148.500 MHz
                 Hfront   88 Hsync  44 Hback 148 Hpol P
                 Vfront    4 Vsync   5 Vback  36 Vpol P
    DTD 6:  2560x1080   60.000 Hz  64:27   66.000 kHz 198.000 MHz (797 mm x 333 mm)
                 Hfront  248 Hsync  44 Hback 148 Hpol P
                 Vfront    4 Vsync   5 Vback  11 Vpol P
Checksum: 0xab


edid-decode "/sys/class/drm/card0-eDP-1/edid"

EDID (hex):
00ffffffffffff0006af9d4200000000
111c0104a5261678029675a356529c27
0c505400000001010101010101010101
010101010101403880b470383e401010
3e007ed710000018403880b470385c41
10103e007ed710000018000000fe0041
554f0a202020202020202020000000fe
004231373348414e30342e32200a00e6

edid-decode (hex):

00 ff ff ff ff ff ff 00 06 af 9d 42 00 00 00 00
11 1c 01 04 a5 26 16 78 02 96 75 a3 56 52 9c 27
0c 50 54 00 00 00 01 01 01 01 01 01 01 01 01 01
01 01 01 01 01 01 40 38 80 b4 70 38 3e 40 10 10
3e 00 7e d7 10 00 00 18 40 38 80 b4 70 38 5c 41
10 10 3e 00 7e d7 10 00 00 18 00 00 00 fe 00 41
55 4f 0a 20 20 20 20 20 20 20 20 20 00 00 00 fe
00 42 31 37 33 48 41 4e 30 34 2e 32 20 0a 00 e6

----------------

Block 0, Base EDID:
  EDID Structure Version & Revision: 1.4
  Vendor & Product Identification:
    Manufacturer: AUO
    Model: 17053
    Made in: week 17 of 2018
  Basic Display Parameters & Features:
    Digital display
    Bits per primary color channel: 8
    DisplayPort interface
    Maximum image size: 38 cm x 22 cm
    Gamma: 2.20
    Supported color formats: RGB 4:4:4
    First detailed timing includes the native pixel format and preferred refresh rate
  Color Characteristics:
    Red  : 0.6386, 0.3369
    Green: 0.3212, 0.6113
    Blue : 0.1533, 0.0498
    White: 0.3134, 0.3291
  Established Timings I & II: none
  Standard Timings: none
  Detailed Timing Descriptors:
    DTD 1:  1920x1080   60.045 Hz  16:9    68.571 kHz 144.000 MHz (382 mm x 215 mm)
                 Hfront   16 Hsync  16 Hback 148 Hpol N
                 Vfront    3 Vsync  14 Vback  45 Vpol N
    DTD 2:  1920x1080   48.019 Hz  16:9    68.571 kHz 144.000 MHz (382 mm x 215 mm)
                 Hfront   16 Hsync  16 Hback 148 Hpol N
                 Vfront    3 Vsync  14 Vback 331 Vpol N
    Alphanumeric Data String: 'AUO'
    Alphanumeric Data String: 'B173HAN04.2 '
Checksum: 0xe6


