
T:  Bus=01 Lev=00 Prnt=00 Port=00 Cnt=00 Dev#=  1 Spd=480 MxCh=16
D:  Ver= 2.00 Cls=09(hub  ) Sub=00 Prot=01 MxPS=64 #Cfgs=  1
P:  Vendor=1d6b ProdID=0002 Rev=05.10
S:  Manufacturer=Linux 5.10.0-7-amd64 xhci-hcd
S:  Product=xHCI Host Controller
S:  SerialNumber=...
C:  #Ifs= 1 Cfg#= 1 Atr=e0 MxPwr=0mA
I:  If#=0x0 Alt= 0 #EPs= 1 Cls=09(hub  ) Sub=00 Prot=00 Driver=hub

T:  Bus=01 Lev=01 Prnt=01 Port=00 Cnt=01 Dev#=  2 Spd=480 MxCh= 4
D:  Ver= 2.00 Cls=09(hub  ) Sub=00 Prot=01 MxPS=64 #Cfgs=  1
P:  Vendor=05e3 ProdID=0608 Rev=85.37
S:  Product=USB2.0 Hub
C:  #Ifs= 1 Cfg#= 1 Atr=e0 MxPwr=100mA
I:  If#=0x0 Alt= 0 #EPs= 1 Cls=09(hub  ) Sub=00 Prot=00 Driver=hub

T:  Bus=01 Lev=02 Prnt=02 Port=00 Cnt=01 Dev#=  3 Spd=12  MxCh= 0
D:  Ver= 2.00 Cls=00(>ifc ) Sub=00 Prot=00 MxPS=64 #Cfgs=  1
P:  Vendor=046d ProdID=c08b Rev=27.02
S:  Manufacturer=Logitech
S:  Product=G502 HERO Gaming Mouse
S:  SerialNumber=12969F6BE1D1770B3E2DBAE43438ABE4
C:  #Ifs= 2 Cfg#= 1 Atr=a0 MxPwr=300mA
I:  If#=0x0 Alt= 0 #EPs= 1 Cls=03(HID  ) Sub=01 Prot=02 Driver=usbhid
I:  If#=0x1 Alt= 0 #EPs= 1 Cls=03(HID  ) Sub=00 Prot=00 Driver=usbhid

T:  Bus=01 Lev=02 Prnt=02 Port=01 Cnt=02 Dev#=  4 Spd=12  MxCh= 0
D:  Ver= 2.00 Cls=00(>ifc ) Sub=00 Prot=00 MxPS=64 #Cfgs=  1
P:  Vendor=0951 ProdID=16b7 Rev=02.17
S:  Manufacturer=Kingston
S:  Product=HyperX Alloy FPS Mechanical Gaming Keyboard
C:  #Ifs= 3 Cfg#= 1 Atr=a0 MxPwr=500mA
I:  If#=0x0 Alt= 0 #EPs= 1 Cls=03(HID  ) Sub=01 Prot=01 Driver=usbhid
I:  If#=0x1 Alt= 0 #EPs= 1 Cls=03(HID  ) Sub=01 Prot=02 Driver=usbhid
I:  If#=0x2 Alt= 0 #EPs= 1 Cls=03(HID  ) Sub=01 Prot=00 Driver=usbhid

T:  Bus=02 Lev=00 Prnt=00 Port=00 Cnt=00 Dev#=  1 Spd=10000 MxCh= 8
D:  Ver= 3.10 Cls=09(hub  ) Sub=00 Prot=03 MxPS= 9 #Cfgs=  1
P:  Vendor=1d6b ProdID=0003 Rev=05.10
S:  Manufacturer=Linux 5.10.0-7-amd64 xhci-hcd
S:  Product=xHCI Host Controller
S:  SerialNumber=...
C:  #Ifs= 1 Cfg#= 1 Atr=e0 MxPwr=0mA
I:  If#=0x0 Alt= 0 #EPs= 1 Cls=09(hub  ) Sub=00 Prot=00 Driver=hub
