CPU: ID 0x906ea, Processor Type 0x0, Family 0x6, Model 0x9e, Stepping 0xa
Northbridge: 8086:3ec4 (unknown)
Southbridge: 8086:a30d (HM370)
IGD: 8086:3e9b (Intel(R) UHD Graphics 630)
SBREG_BAR = 0xfd000000 (MEM)


============= GPIOS =============

------- GPIO Community 0 -------

PCR Port ID: 0x6e0000

------- GPIO Group GPP_A -------
0x0600: 0x0000001844000703 GPP_A0       RCIN#               
0x0610: 0x0000001944000402 GPP_A1       LAD0                
0x0620: 0x0000001a44000402 GPP_A2       LAD1                
0x0630: 0x0000001b44000402 GPP_A3       LAD2                
0x0640: 0x0000001c44000402 GPP_A4       LAD3                
0x0650: 0x0000001d44000400 GPP_A5       LFRAME#             
0x0660: 0x0000001e44000402 GPP_A6       SERIRQ              
0x0670: 0x0000001f44000702 GPP_A7       PIRQA#              
0x0680: 0x0000002044000700 GPP_A8       CLKRUN#             
0x0690: 0x0000002144000600 GPP_A9       CLKOUT_LPC0         
0x06a0: 0x0000002244000600 GPP_A10      CLKOUT_LPC1         
0x06b0: 0x0000002344000102 GPP_A11      GPIO                
0x06c0: 0x0000002444000102 GPP_A12      GPIO                
0x06d0: 0x0000102544000700 GPP_A13      SUSWARN#/SUSPWRDNACK
0x06e0: 0x0000102644000200 GPP_A14      GPIO                
0x06f0: 0x0000002744000100 GPP_A15      GPIO                
0x0700: 0x0000002844000300 GPP_A16      GPIO                
0x0710: 0x0000002944000300 GPP_A17      GPIO                
0x0720: 0x0000002a44000201 GPP_A18      GPIO                
0x0730: 0x0000002b44000301 GPP_A19      GPIO                
0x0740: 0x0000002c44000300 GPP_A20      GPIO                
0x0750: 0x0000002d44000300 GPP_A21      GPIO                
0x0760: 0x0000002e44000200 GPP_A22      GPIO                
0x0770: 0x0000002f44000300 GPP_A23      GPIO                
0x0780: 0x0000000040000700 ESPI_CLK_LOOPBK ESPI_CLK_LOOPBK     
------- GPIO Group GPP_B -------
0x0790: 0x0000003044000102 GPP_B0       GPIO                
0x07a0: 0x0000003144000200 GPP_B1       GPIO                
0x07b0: 0x0000003244000102 GPP_B2       GPIO                
0x07c0: 0x0000003344000102 GPP_B3       GPIO                
0x07d0: 0x0000003444000201 GPP_B4       GPIO                
0x07e0: 0x0000003584000102 GPP_B5       GPIO                
0x07f0: 0x0000003684000102 GPP_B6       GPIO                
0x0800: 0x0000003784000102 GPP_B7       GPIO                
0x0810: 0x0000003884000102 GPP_B8       GPIO                
0x0820: 0x0000003984000102 GPP_B9       GPIO                
0x0830: 0x0000003a44000700 GPP_B10      SRCCLKREQ5#         
0x0840: 0x0000303b44000102 GPP_B11      GPIO                
0x0850: 0x0000003c44000600 GPP_B12      SLP_S0#             
0x0860: 0x0000003d44000600 GPP_B13      PLTRST#             
0x0870: 0x0000003e44000600 GPP_B14      SPKR                
0x0880: 0x0000003f44000300 GPP_B15      GPIO                
0x0890: 0x0000004044000102 GPP_B16      GPIO                
0x08a0: 0x0000004144000102 GPP_B17      GPIO                
0x08b0: 0x0000004244000500 GPP_B18      GSPI0_MOSI          
0x08c0: 0x0000004344000300 GPP_B19      GPIO                
0x08d0: 0x0000004444000300 GPP_B20      GPIO                
0x08e0: 0x0000004544000300 GPP_B21      GPIO                
0x08f0: 0x0000004644000500 GPP_B22      GSPI1_MOSI          
0x0900: 0x0000004744000900 GPP_B23      PCHHOT#             
0x0910: 0x0000000040000700 GSPI0_CLK_LOOPBK GSPI0_CLK_LOOPBK    
0x0920: 0x0000000040000700 GSPI1_CLK_LOOPBK GSPI1_CLK_LOOPBK    
------- GPIO Community 1 -------

PCR Port ID: 0x6d0000

------- GPIO Group GPP_C -------
0x0600: 0x0000004844000602 GPP_C0       SMBCLK              
0x0610: 0x0000004944000402 GPP_C1       SMBDATA             
0x0620: 0x0000004a44000102 GPP_C2       GPIO                
0x0630: 0x0000004b44000300 GPP_C3       GPIO                
0x0640: 0x0000004c44000300 GPP_C4       GPIO                
0x0650: 0x0000004d44000102 GPP_C5       GPIO                
0x0660: 0x0000004e44000102 GPP_C6       GPIO                
0x0670: 0x0000004f44000102 GPP_C7       GPIO                
0x0680: 0x0000005044000300 GPP_C8       GPIO                
0x0690: 0x0000005144000201 GPP_C9       GPIO                
0x06a0: 0x0000005244000300 GPP_C10      GPIO                
0x06b0: 0x0000005344000300 GPP_C11      GPIO                
0x06c0: 0x0000005444000300 GPP_C12      GPIO                
0x06d0: 0x0000005544000300 GPP_C13      GPIO                
0x06e0: 0x0000005644000300 GPP_C14      GPIO                
0x06f0: 0x0000005744000300 GPP_C15      GPIO                
0x0700: 0x0000005884000402 GPP_C16      I2C0_SDA            
0x0710: 0x0000005984000402 GPP_C17      I2C0_SCL            
0x0720: 0x0000005a44000300 GPP_C18      GPIO                
0x0730: 0x0000005b44000300 GPP_C19      GPIO                
0x0740: 0x0000005c44000502 GPP_C20      UART2_RXD           
0x0750: 0x0000005d44000500 GPP_C21      UART2_TXD           
0x0760: 0x0000005e44000700 GPP_C22      UART2_RTS#          
0x0770: 0x0000005f44000702 GPP_C23      UART2_CTS#          
------- GPIO Group GPP_D -------
0x0780: 0x0000006044000300 GPP_D0       GPIO                
0x0790: 0x0000006144000300 GPP_D1       GPIO                
0x07a0: 0x0000006244000300 GPP_D2       GPIO                
0x07b0: 0x0000006344000300 GPP_D3       GPIO                
0x07c0: 0x0000006444000300 GPP_D4       GPIO                
0x07d0: 0x0000006544000d00 GPP_D5       CNV_RF_RESET#       
0x07e0: 0x0000006644000d00 GPP_D6       MODEM_CLKREQ        
0x07f0: 0x0000006744000300 GPP_D7       GPIO                
0x0800: 0x0000006844000300 GPP_D8       GPIO                
0x0810: 0x0000006944000300 GPP_D9       GPIO                
0x0820: 0x0000006a44000300 GPP_D10      GPIO                
0x0830: 0x0000006b44000300 GPP_D11      GPIO                
0x0840: 0x0000006c44000300 GPP_D12      GPIO                
0x0850: 0x0000006d44000300 GPP_D13      GPIO                
0x0860: 0x0000006e44000300 GPP_D14      GPIO                
0x0870: 0x0000006f44000300 GPP_D15      GPIO                
0x0880: 0x0000007044000300 GPP_D16      GPIO                
0x0890: 0x0000007144000700 GPP_D17      DMIC_CLK1           
0x08a0: 0x0000007244000700 GPP_D18      DMIC_DATA1          
0x08b0: 0x0000007344000700 GPP_D19      DMIC_CLK0           
0x08c0: 0x0000007444000700 GPP_D20      DMIC_DATA0          
0x08d0: 0x0000007544000300 GPP_D21      GPIO                
0x08e0: 0x0000007644000300 GPP_D22      GPIO                
0x08f0: 0x0000007744000300 GPP_D23      GPIO                
------- GPIO Group GPP_G -------
0x0900: 0x0000006c44000100 GPP_G0       GPIO                
0x0910: 0x0000006d44000100 GPP_G1       GPIO                
0x0920: 0x0000006e44000102 GPP_G2       GPIO                
0x0930: 0x0000306f44000102 GPP_G3       GPIO                
0x0940: 0x0000007044000300 GPP_G4       GPIO                
0x0950: 0x0000007144000300 GPP_G5       GPIO                
0x0960: 0x0000007244000300 GPP_G6       GPIO                
0x0970: 0x0000007344000300 GPP_G7       GPIO                
------- GPIO Group AZA -------
0x0980: 0x00003c0040000700 HDA_BCLK     HDA_BCLK            
0x0990: 0x00003c0040000700 HDA_RST_B    HDA_RST#            
0x09a0: 0x00003c0040000700 HDA_SYNC     HDA_SYNC            
0x09b0: 0x00003c0040000700 HDA_SDO      HDA_SDO             
0x09c0: 0x00003c0040000700 HDA_SDI0     HDA_SDI0            
0x09d0: 0x00003c0040000700 HDA_SDI1     HDA_SDI1            
0x09e0: 0x0000000040000300 I2S1_SFRM    GPIO                
0x09f0: 0x0000000040000300 I2S1_TXD     GPIO                
------- GPIO Group VGPIO_0 -------
0x0a00: 0x0000000040000200 CNV_BTEN     GPIO                
0x0a10: 0x0000000040000000 CNV_GNEN     GPIO                
0x0a20: 0x0000000040000000 CNV_WFEN     GPIO                
0x0a30: 0x0000000040000003 CNV_WCEN     GPIO                
0x0a40: 0x0000007444000102 vCNV_GNSS_HOST_WAKE_B GPIO                
0x0a50: 0x0000007544000000 vSD3_CD_B    GPIO                
0x0a60: 0x0000007644000000 CNV_BT_HOST_WAKE_B GPIO                
0x0a70: 0x0000000040000003 CNV_BT_IF_SELECT GPIO                
0x0a80: 0x0000000040000402 vCNV_BT_UART_TXD ISH UART0           
0x0a90: 0x0000000040000400 vCNV_BT_UART_RXD ISH UART0           
0x0aa0: 0x0000000040000400 vCNV_BT_UART_CTS_B ISH UART0           
0x0ab0: 0x0000000040000402 vCNV_BT_UART_RTS_B ISH UART0           
0x0ac0: 0x0000000040000402 vCNV_MFUART1_TXD ISH UART0           
0x0ad0: 0x0000000040000400 vCNV_MFUART1_RXD ISH UART0           
0x0ae0: 0x0000000040000400 vCNV_MFUART1_CTS_B ISH UART0           
0x0af0: 0x0000000040000402 vCNV_MFUART1_RTS_B ISH UART0           
0x0b00: 0x0000000040000402 vCNV_GNSS_UART_TXD n/a                 
0x0b10: 0x0000000040000400 vCNV_GNSS_UART_RXD n/a                 
0x0b20: 0x0000000040000400 vCNV_GNSS_UART_CTS_B n/a                 
0x0b30: 0x0000000040000402 vCNV_GNSS_UART_RTS_B n/a                 
0x0b40: 0x0000000040000402 vUART0_TXD   mapped              
0x0b50: 0x0000000040000400 vUART0_RXD   mapped              
0x0b60: 0x0000000040000400 vUART0_CTS_B mapped              
0x0b70: 0x0000000040000402 vUART0_RTS_B mapped              
0x0b80: 0x0000000040000402 vISH_UART0_TXD mapped              
0x0b90: 0x0000000040000400 vISH_UART0_RXD mapped              
0x0ba0: 0x0000000040000400 vISH_UART0_CTS_B mapped              
0x0bb0: 0x0000000040000402 vISH_UART0_RTS_B mapped              
0x0bc0: 0x0000000040000402 vISH_UART1_TXD mapped              
0x0bd0: 0x0000000040000400 vISH_UART1_RXD mapped              
0x0be0: 0x0000000040000400 vISH_UART1_CTS_B mapped              
0x0bf0: 0x0000000040000402 vISH_UART1_RTS_B mapped              
------- GPIO Group VGPIO_1 -------
0x0c00: 0x0000000040000400 vCNV_BT_I2S_BCLK SSP0                
0x0c10: 0x0000000040000400 vCNV_BT_I2S_WS_SYNC SSP0                
0x0c20: 0x0000000040000400 vCNV_BT_I2S_SDO SSP0                
0x0c30: 0x0000000040000400 vCNV_BT_I2S_SDI SSP0                
0x0c40: 0x0000000040000400 vSSP2_SCLK   mapped              
0x0c50: 0x0000000040000400 vSSP2_SFRM   mapped              
0x0c60: 0x0000000040000400 vSSP2_TXD    mapped              
0x0c70: 0x0000000040000400 vSSP2_RXD    n/a                 
------- GPIO Community 2 -------

PCR Port ID: 0x6c0000

------- GPIO Group GPD -------
0x0600: 0x0000006044000502 GPD0         BATLOW#             
0x0610: 0x00003c6144000502 GPD1         ACPRESENT           
0x0620: 0x00003c6204000102 GPD2         GPIO                
0x0630: 0x0000306344000502 GPD3         PRWBTN#             
0x0640: 0x0000006444000600 GPD4         SLP_S3#             
0x0650: 0x0000006544000600 GPD5         SLP_S4#             
0x0660: 0x0000006644000601 GPD6         SLP_A#              
0x0670: 0x0000006704000300 GPD7         GPIO                
0x0680: 0x0000006844000600 GPD8         SUSCLK              
0x0690: 0x0000006904000102 GPD9         GPIO                
0x06a0: 0x0000006a04000700 GPD10        SLP_S5#             
0x06b0: 0x0000006b04000200 GPD11        GPIO                
0x06c0: 0x0000000000000700 SLP_LAN_B    SLP_LAN#            
0x06d0: 0x0000000000000700 SLP_SUS_B    SLP_SUS#            
0x06e0: 0x0000000000000702 WAKE_B       WAKE#               
0x06f0: 0x0000000000000700 DRAM_RESET_B DRAM_RESET#         
------- GPIO Community 3 -------

PCR Port ID: 0x6b0000

------- GPIO Group GPP_K -------
0x0600: 0x0000001844000300 GPP_K0       GPIO                
0x0610: 0x0000001944000300 GPP_K1       GPIO                
0x0620: 0x0000001a44000300 GPP_K2       GPIO                
0x0630: 0x0000301b80880102 GPP_K3       GPIO                
0x0640: 0x0000001c44000300 GPP_K4       GPIO                
0x0650: 0x0000001d44000300 GPP_K5       GPIO                
0x0660: 0x0000301e40880102 GPP_K6       GPIO                
0x0670: 0x0000001f44000300 GPP_K7       GPIO                
0x0680: 0x0000002044000102 GPP_K8       GPIO                
0x0690: 0x0000002144000102 GPP_K9       GPIO                
0x06a0: 0x0000002244000102 GPP_K10      GPIO                
0x06b0: 0x0000002344000102 GPP_K11      GPIO                
0x06c0: 0x0000002444000300 GPP_K12      GPIO                
0x06d0: 0x0000002544000300 GPP_K13      GPIO                
0x06e0: 0x0000002644000300 GPP_K14      GPIO                
0x06f0: 0x0000002744000300 GPP_K15      GPIO                
0x0700: 0x0000002844000300 GPP_K16      GPIO                
0x0710: 0x0000002944000300 GPP_K17      GPIO                
0x0720: 0x0000002a44000300 GPP_K18      GPIO                
0x0730: 0x0000302b42000102 GPP_K19      GPIO                
0x0740: 0x0000002c44000103 GPP_K20      GPIO                
0x0750: 0x0000002d44000100 GPP_K21      GPIO                
0x0760: 0x0000002e80000102 GPP_K22      GPIO                
0x0770: 0x0000002f44000700 GPP_K23      IMGCLKOUT1          
------- GPIO Group GPP_H -------
0x0780: 0x0000004844000702 GPP_H0       SRCCLKREQ6#         
0x0790: 0x0000004984000300 GPP_H1       GPIO                
0x07a0: 0x0000004a44000700 GPP_H2       SRCCLKREQ8#         
0x07b0: 0x0000004b84000300 GPP_H3       GPIO                
0x07c0: 0x0000004c44000702 GPP_H4       SRCCLKREQ10#        
0x07d0: 0x0000004d44000702 GPP_H5       SRCCLKREQ11#        
0x07e0: 0x0000004e84000300 GPP_H6       GPIO                
0x07f0: 0x0000004f84000300 GPP_H7       GPIO                
0x0800: 0x0000005084000300 GPP_H8       GPIO                
0x0810: 0x0000005184000300 GPP_H9       GPIO                
0x0820: 0x0000005244000102 GPP_H10      GPIO                
0x0830: 0x0000005344000102 GPP_H11      GPIO                
0x0840: 0x0000005444000102 GPP_H12      GPIO                
0x0850: 0x0000005544000102 GPP_H13      GPIO                
0x0860: 0x0000005644000102 GPP_H14      GPIO                
0x0870: 0x0000005744000102 GPP_H15      GPIO                
0x0880: 0x0000005844000102 GPP_H16      GPIO                
0x0890: 0x0000005944000102 GPP_H17      GPIO                
0x08a0: 0x0000005a44000102 GPP_H18      GPIO                
0x08b0: 0x0000005b44000102 GPP_H19      GPIO                
0x08c0: 0x0000005c44000102 GPP_H20      GPIO                
0x08d0: 0x0000005d44000102 GPP_H21      GPIO                
0x08e0: 0x0000005e44000102 GPP_H22      GPIO                
0x08f0: 0x0000005f44000102 GPP_H23      GPIO                
------- GPIO Group GPP_E -------
0x0900: 0x0000001844000102 GPP_E0       GPIO                
0x0910: 0x0000001944000502 GPP_E1       SATAXPCIE1          
0x0920: 0x0000001a44000102 GPP_E2       GPIO                
0x0930: 0x0000001b44000103 GPP_E3       GPIO                
0x0940: 0x0000301c44000102 GPP_E4       GPIO                
0x0950: 0x0000301d44000102 GPP_E5       GPIO                
0x0960: 0x0000001e44000300 GPP_E6       GPIO                
0x0970: 0x0000301f40800102 GPP_E7       GPIO                
0x0980: 0x0000002044000700 GPP_E8       SATALED#            
0x0990: 0x0000002144000300 GPP_E9       GPIO                
0x09a0: 0x0000002244000300 GPP_E10      GPIO                
0x09b0: 0x0000002344000300 GPP_E11      GPIO                
0x09c0: 0x0000002444000300 GPP_E12      GPIO                
------- GPIO Group GPP_F -------
0x09d0: 0x0000003044000300 GPP_F0       GPIO                
0x09e0: 0x0000003144000300 GPP_F1       GPIO                
0x09f0: 0x0000003244000300 GPP_F2       GPIO                
0x0a00: 0x0000003344000300 GPP_F3       GPIO                
0x0a10: 0x0000003444000300 GPP_F4       GPIO                
0x0a20: 0x0000003544000102 GPP_F5       GPIO                
0x0a30: 0x0000003644000102 GPP_F6       GPIO                
0x0a40: 0x0000003744000300 GPP_F7       GPIO                
0x0a50: 0x0000003844000300 GPP_F8       GPIO                
0x0a60: 0x0000003944000300 GPP_F9       GPIO                
0x0a70: 0x0000003a44000300 GPP_F10      GPIO                
0x0a80: 0x0000003b44000300 GPP_F11      GPIO                
0x0a90: 0x0000003c44000300 GPP_F12      GPIO                
0x0aa0: 0x0000003d44000300 GPP_F13      GPIO                
0x0ab0: 0x0000303e44000100 GPP_F14      GPIO                
0x0ac0: 0x0000003f44000300 GPP_F15      GPIO                
0x0ad0: 0x0000004044000300 GPP_F16      GPIO                
0x0ae0: 0x0000004144000300 GPP_F17      GPIO                
0x0af0: 0x0000004244000300 GPP_F18      GPIO                
0x0b00: 0x0000004344000600 GPP_F19      eDP_VDDEN           
0x0b10: 0x0000004444000600 GPP_F20      eDP_BKLTEN          
0x0b20: 0x0000004544000600 GPP_F21      eDP_BKLTCTL         
0x0b30: 0x0000004684000201 GPP_F22      GPIO                
0x0b40: 0x0000004744000201 GPP_F23      GPIO                
------- GPIO Group SPI -------
0x0b50: 0x00003c0040000700 SPI0_IO_2    SPI0_IO_2           
0x0b60: 0x00003c0040000700 SPI0_IO_3    SPI0_IO_3           
0x0b70: 0x00003c0040000700 SPI0_MISO    SPI0_MISO           
0x0b80: 0x00003c0040000700 SPI0_MOSI    SPI0_MOSI           
0x0b90: 0x00003c0040000700 SPI0_CS2_B   SPI0_CS2#           
0x0ba0: 0x00003c0040000700 SPI0_CS0_B   SPI0_CS0#           
0x0bb0: 0x00003c0040000700 SPI0_CS1_B   SPI0_CS1#           
0x0bc0: 0x00003c0040000700 SPI0_CLK     SPI0_CLK            
0x0bd0: 0x0000000040000700 SPI0_CLK_LOOPBK SPI0_CLK_LOOPBK     
------- GPIO Community 4 -------

PCR Port ID: 0x6a0000

------- GPIO Group CPU -------
0x0600: 0x00003c0040000700 HDACPU_SDI   HDACPU_SDI          
0x0610: 0x00003c0040000700 HDACPU_SDO   HDACPU_SDO          
0x0620: 0x00003c0040000700 HDACPU_SCLK  HDACPU_SCLK         
0x0630: 0x0000000040000700 PM_SYNC      PM_SYNC             
0x0640: 0x0000000040000700 PECI         PECI                
0x0650: 0x0000000040000700 CPUPWRGD     CPUPWRG#            
0x0660: 0x0000000040000702 THRMTRIP_B   THRMTRIP#           
0x0670: 0x0000000040000700 PLTRST_CPU_B PLTRST_CPU#         
0x0680: 0x0000000040000700 PM_DOWN      PM_DOWN             
0x0690: 0x0000100040000700 TRIGGER_IN   TRIGGER_IN          
0x06a0: 0x0000100040000700 TRIGGER_OUT  TRIGGER_OUT         
------- GPIO Group JTAG -------
0x06b0: 0x00003c0040000700 PCH_TDO      PCH_TDO             
0x06c0: 0x00003c0040000700 PCH_JTAGX    PCH_JTAGX           
0x06d0: 0x00003c0040000700 PROC_PRDY_B  PROC_RDY#           
0x06e0: 0x00003c0040000702 PROC_PREQ_B  PROC_REQ#           
0x06f0: 0x00003c0040000700 CPU_TRST_B   CPU_TRST#           
0x0700: 0x00003c0040000700 PCH_TDI      PCH_TDI             
0x0710: 0x00003c0040000700 PCH_TMS      PCH_TMS             
0x0720: 0x00003c0040000700 PCH_TCK      PCH_TCK             
0x0730: 0x00003c0040000700 ITP_PMODE    ITP_PMODE           
------- GPIO Group GPP_I -------
0x0740: 0x0000003044000102 GPP_I0       GPIO                
0x0750: 0x0000003184000502 GPP_I1       DDPB_HPD1           
0x0760: 0x0000003244000502 GPP_I2       DDPB_HPD2           
0x0770: 0x0000003346880100 GPP_I3       GPIO                
0x0780: 0x0000003444000500 GPP_I4       EDP_HPD             
0x0790: 0x0000003544000102 GPP_I5       GPIO                
0x07a0: 0x0000003644000102 GPP_I6       GPIO                
0x07b0: 0x0000003744000500 GPP_I7       DDPC_CTRLCLK        
0x07c0: 0x0000003844000502 GPP_I8       DDPC_CTRLDATA       
0x07d0: 0x0000003944000102 GPP_I9       GPIO                
0x07e0: 0x0000003a44000102 GPP_I10      GPIO                
0x07f0: 0x0000003b44000100 GPP_I11      GPIO                
0x0800: 0x0000003c44000102 GPP_I12      GPIO                
0x0810: 0x0000003d44000102 GPP_I13      GPIO                
0x0820: 0x0000003e44000102 GPP_I14      GPIO                
0x0830: 0x0000000040000702 SYS_PWROK    SYS_PWROK           
0x0840: 0x0000000040000702 SYS_RESET_B  SYS_RESET#          
0x0850: 0x0000000040000700 CL_RST_B     CL_RST#             
------- GPIO Group GPP_J -------
0x0860: 0x0000002544000500 GPP_J0       CNV_PA_BLANKING     
0x0870: 0x0000002644000201 GPP_J1       GPIO                
0x0880: 0x0000002744000300 GPP_J2       GPIO                
0x0890: 0x0000002844000300 GPP_J3       GPIO                
0x08a0: 0x0000002944000500 GPP_J4       CNV_BRI_DT          
0x08b0: 0x0000302a44000502 GPP_J5       CNV_BRI_RSP         
0x08c0: 0x0000002b44000700 GPP_J6       CNV_RGI_DT          
0x08d0: 0x0000302c44000502 GPP_J7       CNV_RGI_RSP         
0x08e0: 0x0000002d44000500 GPP_J8       CNV_MFUART2_RXD     
0x08f0: 0x0000002e44000500 GPP_J9       CNV_MFUART2_TXD     
0x0900: 0x0000002f44000300 GPP_J10      GPIO                
0x0910: 0x0000003044000300 GPP_J11      GPIO                



============= RCBA ==============

Error: Dumping RCBA on this southbridge is not (yet) supported.



========== ACPI/PMC =========

Error: Dumping PMBASE on this southbridge is not (yet) supported.



========== LPC/eSPI =========

Error: Dumping LPC/eSPI on this southbridge is not (yet) supported.



============= MCHBAR ============

Error: Dumping MCHBAR on this northbridge is not (yet) supported.



============= EPBAR =============

Error: Dumping EPBAR on this northbridge is not (yet) supported.



============= DMIBAR ============

Error: Dumping DMIBAR on this northbridge is not (yet) supported.


========= PCIEXBAR ========

Error: Dumping PCIEXBAR on this northbridge is not (yet) supported.



===================== SHARED MSRs (All Cores) =====================
 MSR 0x00000017 = 0x00140000:0x00000000 (IA32_PLATFORM_ID)
 MSR 0x00000080 = 0x00000000:0x00000000 (MSR_TRACE_HUB_STH_ACPIBAR_BASE)
 MSR 0x000000CE = 0x0008083B:0xF1011A00 (MSR_PLATFORM_INFO)
 MSR 0x00000198 = 0x00002131:0x00002200 (IA32_PERF_STATUS)
 MSR 0x000001A2 = 0x00000000:0x0D640080 (MSR_TEMPERATURE_TARGET)
 MSR 0x000001AD = 0x00002829:0x2A2B2C2D (MSR_TURBO_RATIO_LIMIT)
 MSR 0x00000284 = 0x00000000:0x00000000 (IA32_MC4_CTL2)
 MSR 0x000002F4 = 0x00000000:0x99F00000 (MSR_UNCORE_PRMRR_PHYS_BASE)
 MSR 0x000002F5 = 0x0000007F:0xFFF00C00 (MSR_UNCORE_PRMRR_PHYS_MASK)
 MSR 0x00000394 = 0x00000000:0x00000000 (MSR_UNC_PERF_FIXED_CTRL)
 MSR 0x00000395 = 0x00000000:0x00000000 (MSR_UNC_PERF_FIXED_CTR)
 MSR 0x0000060A = 0x00000000:0x0000884E (MSR_PKGC3_IRTL)
 MSR 0x0000060B = 0x00000000:0x00008000 (MSR_PKGC6_IRTL)
 MSR 0x0000060D = 0x00000001:0xCDABB8B2 (MSR_PKG_C2_RESIDENCY)
 MSR 0x00000610 = 0x00428270:0x00DD8168 (MSR_PKG_POWER_LIMIT)
 MSR 0x00000614 = 0x00000000:0x00000168 (MSR_PKG_POWER_INFO)
 MSR 0x00000620 = 0x00000000:0x0000082A (MSR_RING_RATIO_LIMIT)
 MSR 0x00000638 = 0x00000000:0x00000000 (MSR_PP0_POWER_LIMIT)
 MSR 0x0000064F = 0x00000000:0x38020002 (MSR_CORE_PERF_LIMIT_REASONS)
 MSR 0x00000652 = 0x00000000:0x00000002 (MSR_PKG_HDC_CONFIG)
 MSR 0x0000065C = 0x000083F0:0x00DD83F0 (MSR_PLATFORM_POWER_LIMIT)
 MSR 0x000006B0 = 0x00000000:0x00000000 (MSR_GRAPHICS_PERF_LIMIT_REASONS)
 MSR 0x000006B1 = 0x00000000:0x01000100 (MSR_RING_PERF_LIMIT_REASONS)
 MSR 0x00000770 = 0x00000000:0x00000001 (IA32_PM_ENABLE)
 MSR 0x00000DB0 = 0x00000000:0x00000000 (IA32_PKG_HDC_CTL)
 MSR 0x000003B0 = 0x00000000:0x00000000 (MSR_UNC_ARB_PERFCTR0)
 MSR 0x000003B1 = 0x00000000:0x00000000 (MSR_UNC_ARB_PERFCTR1)
 MSR 0x000003B2 = 0x00000000:0x00000000 (MSR_UNC_ARB_PERFEVTSEL0)
 MSR 0x000003B3 = 0x00000000:0x00000000 (MSR_UNC_ARB_PERFEVTSEL1)
 MSR 0x00000700 = 0x00000000:0x00000000 (MSR_UNC_CBO_0_PERFCTR0)
 MSR 0x00000701 = 0x00000000:0x00000000 (MSR_UNC_CBO_0_PERFCTR1)
 MSR 0x00000706 = 0x00000000:0x00000000 (MSR_UNC_CBO_0_PERFEVTSEL0)
 MSR 0x00000707 = 0x00000000:0x00000000 (MSR_UNC_CBO_0_PERFEVTSEL1)
 MSR 0x00000710 = 0x00000000:0x00000000 (MSR_UNC_CBO_1_PERFCTR0)
 MSR 0x00000711 = 0x00000000:0x00000000 (MSR_UNC_CBO_1_PERFCTR1)
 MSR 0x00000716 = 0x00000000:0x00000000 (MSR_UNC_CBO_1_PERFEVTSEL0)
 MSR 0x00000717 = 0x00000000:0x00000000 (MSR_UNC_CBO_1_PERFEVTSEL1)
 MSR 0x00000720 = 0x00000000:0x00000000 (MSR_UNC_CBO_2_PERFCTR0)
 MSR 0x00000721 = 0x00000000:0x00000000 (MSR_UNC_CBO_2_PERFCTR1)
 MSR 0x00000726 = 0x00000000:0x00000000 (MSR_UNC_CBO_2_PERFEVTSEL0)
 MSR 0x00000727 = 0x00000000:0x00000000 (MSR_UNC_CBO_2_PERFEVTSEL1)
 MSR 0x00000730 = 0x00000000:0x00000000 (MSR_UNC_CBO_3_PERFCTR0)
 MSR 0x00000731 = 0x00000000:0x00000000 (MSR_UNC_CBO_3_PERFCTR1)
 MSR 0x00000736 = 0x00000000:0x00000000 (MSR_UNC_CBO_3_PERFEVTSEL0)
 MSR 0x00000737 = 0x00000000:0x00000000 (MSR_UNC_CBO_3_PERFEVTSEL1)
 MSR 0x00000E01 = 0x00000000:0x2000001F (MSR_UNC_PERF_GLOBAL_CTRL)
 MSR 0x00000E02 = 0x00000000:0x00000000 (MSR_UNC_PERF_GLOBAL_STATUS)

====================== UNIQUE MSRs  (core 0) ======================
 MSR 0x00000000 = 0x00000000:0x00000FFF (IA32_P5_MC_ADDR)
 MSR 0x00000001 = 0x00000000:0x00000000 (IA32_P5_MC_TYPE)
 MSR 0x00000006 = 0x00000000:0x00000040 (IA32_MONITOR_FILTER_SIZE)
 MSR 0x00000010 = 0x00000285:0x546A37F0 (IA32_TIME_STAMP_COUNTER)
 MSR 0x0000001B = 0x00000000:0xFEE00D00 (IA32_APIC_BASE)
 MSR 0x00000034 = 0x00000000:0x0000066C (MSR_SMI_COUNT)
 MSR 0x0000003A = 0x00000000:0x00020005 (IA32_FEATURE_CONTROL)
 MSR 0x0000008B = 0x000000DE:0x00000000 (IA32_BIOS_SIGN_ID)
 MSR 0x000000C1 = 0x00000000:0x00000000 (IA32_PMC0)
 MSR 0x000000C2 = 0x00000000:0x00000000 (IA32_PMC1)
 MSR 0x000000C3 = 0x00000000:0x00000000 (IA32_PMC2)
 MSR 0x000000C4 = 0x00000000:0x0000FFFF (IA32_PMC3)
 MSR 0x000000E2 = 0x00000000:0x1C008007 (MSR_PKG_CST_CONFIG_CONTROL)
 MSR 0x000000E4 = 0x00000000:0x00051814 (MSR_PMG_IO_CAPTURE_BASE)
 MSR 0x000000E7 = 0x00000084:0x8EA6A919 (IA32_MPERF)
 MSR 0x000000E8 = 0x0000008A:0xEA79D2A9 (IA32_APERF)
 MSR 0x000000FE = 0x00000000:0x00001D0A (IA32_MTRRCAP)
 MSR 0x0000013C = 0x00000000:0x00000001 (MSR_FEATURE_CONFIG)
 MSR 0x00000174 = 0x00000000:0x00000010 (IA32_SYSENTER_CS)
 MSR 0x00000175 = 0xFFFFFE00:0x00003000 (IA32_SYSENTER_ESP)
 MSR 0x00000176 = 0xFFFFFFFF:0x8B201580 (IA32_SYSENTER_EIP)
 MSR 0x00000179 = 0x00000000:0x00000C0C (IA32_MCG_CAP)
 MSR 0x0000017A = 0x00000000:0x00000000 (IA32_MCG_STATUS)
 MSR 0x00000186 = 0x00000000:0x00000000 (IA32_PERFEVTSEL0)
 MSR 0x00000187 = 0x00000000:0x00000000 (IA32_PERFEVTSEL1)
 MSR 0x00000188 = 0x00000000:0x00000000 (IA32_PERFEVTSEL2)
 MSR 0x00000189 = 0x00000000:0x00000000 (IA32_PERFEVTSEL3)
 MSR 0x00000199 = 0x00000000:0x00000800 (IA32_PERF_CTL)
 MSR 0x0000019A = 0x00000000:0x00000000 (IA32_CLOCK_MODULATION)
 MSR 0x0000019B = 0x00000000:0x00000013 (IA32_THERM_INTERRUPT)
 MSR 0x0000019C = 0x00000000:0x881E0802 (IA32_THERM_STATUS)
 MSR 0x000001A0 = 0x00000000:0x00850089 (IA32_MISC_ENABLE)
 MSR 0x000001A4 = 0x00000000:0x00000000 (IA32_MISC_FEATURE_CONTROL)
 MSR 0x000001A6 = 0x00000000:0x00000000 (MSR_OFFCORE_RSP_0)
 MSR 0x000001A7 = 0x00000000:0x00000000 (MSR_OFFCORE_RSP_1)
 MSR 0x000001C8 = 0x00000000:0x00000000 (MSR_LBR_SELECT)
 MSR 0x000001C9 = 0x00000000:0x00000000 (MSR_LASTBRANCH_TOS)
 MSR 0x000001D9 = 0x00000000:0x00000000 (IA32_DEBUGCTL)
 MSR 0x000001DD = 0x00000000:0x00000000 (MSR_LER_FROM_LIP)
 MSR 0x000001DE = 0x00000000:0x00000000 (MSR_LER_TO_LIP)
 MSR 0x000001F2 = 0x00000000:0x9A000006 (IA32_SMRR_PHYSBASE)
 MSR 0x000001F3 = 0x00000000:0xFF000800 (IA32_SMRR_PHYSMASK)
 MSR 0x000001F4 = 0x00000000:0x99F00006 (MSR_PRMRR_PHYS_BASE)
 MSR 0x000001F5 = 0x0000007F:0xFFF00C00 (MSR_PRMRR_PHYS_MASK)
 MSR 0x000001FB = 0x00000000:0x000000E1 (MSR_PRMRR_VALID_CONFIG)
 MSR 0x000001FC = 0x00000000:0x002C005D (MSR_POWER_CTL)
 MSR 0x00000200 = 0x00000000:0xC0000000 (IA32_MTRR_PHYSBASE0)
 MSR 0x00000201 = 0x0000007F:0xC0000800 (IA32_MTRR_PHYSBASE0)
 MSR 0x00000202 = 0x00000000:0xA0000000 (IA32_MTRR_PHYSBASE1)
 MSR 0x00000203 = 0x0000007F:0xE0000800 (IA32_MTRR_PHYSBASE1)
 MSR 0x00000204 = 0x00000000:0x9C000000 (IA32_MTRR_PHYSBASE2)
 MSR 0x00000205 = 0x0000007F:0xFC000800 (IA32_MTRR_PHYSBASE2)
 MSR 0x00000206 = 0x00000000:0x9B000000 (IA32_MTRR_PHYSBASE3)
 MSR 0x00000207 = 0x0000007F:0xFF000800 (IA32_MTRR_PHYSBASE3)
 MSR 0x00000208 = 0x00000020:0x00000000 (IA32_MTRR_PHYSBASE4)
 MSR 0x00000209 = 0x00000060:0x00000800 (IA32_MTRR_PHYSBASE4)
 MSR 0x0000020A = 0x00000010:0x00000000 (IA32_MTRR_PHYSBASE5)
 MSR 0x0000020B = 0x00000070:0x00000800 (IA32_MTRR_PHYSBASE5)
 MSR 0x0000020C = 0x00000040:0x00000000 (IA32_MTRR_PHYSBASE6)
 MSR 0x0000020D = 0x00000040:0x00000800 (IA32_MTRR_PHYSBASE6)
 MSR 0x0000020E = 0x00000004:0x00000006 (IA32_MTRR_PHYSBASE7)
 MSR 0x0000020F = 0x00000000:0x00000000 (IA32_MTRR_PHYSBASE7)
 MSR 0x00000210 = 0x00000008:0x00000006 (IA32_MTRR_PHYSBASE8)
 MSR 0x00000211 = 0x00000000:0x00000000 (IA32_MTRR_PHYSBASE8)
 MSR 0x00000212 = 0x00000000:0x00000000 (IA32_MTRR_PHYSBASE9)
 MSR 0x00000213 = 0x00000000:0x00000000 (IA32_MTRR_PHYSBASE9)
 MSR 0x00000250 = 0x06060606:0x06060606 (IA32_MTRR_FIX64K_00000)
 MSR 0x00000258 = 0x06060606:0x06060606 (IA32_MTRR_FIX16K_80000)
 MSR 0x00000259 = 0x00000000:0x00000000 (IA32_MTRR_FIX16K_A0000)
 MSR 0x00000268 = 0x05050505:0x05050505 (IA32_MTRR_FIX4K_C0000)
 MSR 0x00000269 = 0x05050505:0x05050505 (IA32_MTRR_FIX4K_C8000)
 MSR 0x0000026A = 0x05050505:0x05050505 (IA32_MTRR_FIX4K_D0000)
 MSR 0x0000026B = 0x05050505:0x05050505 (IA32_MTRR_FIX4K_D8000)
 MSR 0x0000026C = 0x05050505:0x05050505 (IA32_MTRR_FIX4K_E0000)
 MSR 0x0000026D = 0x05050505:0x05050505 (IA32_MTRR_FIX4K_E8000)
 MSR 0x0000026E = 0x05050505:0x05050505 (IA32_MTRR_FIX4K_F0000)
 MSR 0x0000026F = 0x05050505:0x05050505 (IA32_MTRR_FIX4K_F8000)
 MSR 0x00000277 = 0x04070506:0x00070106 (IA32_PAT)
 MSR 0x00000280 = 0x00000000:0x40000001 (IA32_MC0_CTL2)
 MSR 0x00000281 = 0x00000000:0x40000001 (IA32_MC1_CTL2)
 MSR 0x00000282 = 0x00000000:0x40000001 (IA32_MC2_CTL2)
 MSR 0x00000283 = 0x00000000:0x40000001 (IA32_MC3_CTL2)
 MSR 0x000002FF = 0x00000000:0x00000C06 (IA32_MTRR_DEF_TYPE)
 MSR 0x00000309 = 0x00000000:0x00000000 (IA32_FIXED_CTR0)
 MSR 0x0000030A = 0x0000FFFA:0x8B6ECF0D (IA32_FIXED_CTR1)
 MSR 0x0000030B = 0x00000000:0x00000000 (IA32_FIXED_CTR2)
 MSR 0x00000345 = 0x00000000:0x000033C5 (IA32_PERF_CAPABILITIES)
 MSR 0x0000038D = 0x00000000:0x000000B0 (IA32_FIXED_CTR_CTRL)
 MSR 0x0000038E = 0x00000000:0x00000000 (IA32_PERF_GLOBAL_STATUS)
 MSR 0x0000038F = 0x00000007:0x0000000F (IA32_PERF_GLOBAL_CTRL)
 MSR 0x00000390 = 0x00000000:0x00000000 (IA32_PERF_GLOBAL_STATUS_RESET)
 MSR 0x00000391 = 0x00000000:0x00000000 (IA32_PERF_GLOBAL_STATUS_SET)
 MSR 0x000003F1 = 0x00000000:0x00000000 (MSR_PEBS_ENABLE)
 MSR 0x000003F6 = 0x00000000:0x0000FFFF (MSR_PEBS_LD_LAT)
 MSR 0x000003F7 = 0x00000000:0x00000800 (MSR_PEBS_FRONTEND)
 MSR 0x000003FC = 0x00000002:0x406CB894 (MSR_CORE_C3_RESIDENCY)
 MSR 0x000003FD = 0x0000001D:0x6E36FE36 (MSR_CORE_C6_RESIDENCY)
 MSR 0x000003FE = 0x00000196:0x68D0EC48 (MSR_CORE_C7_RESIDENCY)
 MSR 0x00000400 = 0x00000000:0x00000FFF (IA32_MC0_CTL)
 MSR 0x00000401 = 0x00000000:0x00000000 (IA32_MC0_STATUS)
 MSR 0x00000402 = 0x00000000:0x00000000 (IA32_MC0_ADDR)
 MSR 0x00000403 = 0x00000000:0x00000000 (IA32_MC0_MISC)
 MSR 0x00000404 = 0x00000000:0x0000000F (IA32_MC1_CTL)
 MSR 0x00000405 = 0x00000000:0x00000000 (IA32_MC1_STATUS)
 MSR 0x00000406 = 0x00000000:0x00000000 (IA32_MC1_ADDR)
 MSR 0x00000407 = 0x00000000:0x00000000 (IA32_MC1_MISC)
 MSR 0x00000408 = 0x00000000:0x0000000F (IA32_MC2_CTL)
 MSR 0x00000409 = 0x00000000:0x00000000 (IA32_MC2_STATUS)
 MSR 0x0000040A = 0x00000000:0x00000000 (IA32_MC2_ADDR)
 MSR 0x0000040C = 0x00000000:0x0000001F (IA32_MC3_CTL)
 MSR 0x0000040D = 0x00000000:0x00000000 (IA32_MC3_STATUS)
 MSR 0x0000040E = 0x00000000:0x00000000 (IA32_MC3_ADDR)
 MSR 0x00000410 = 0x00000000:0x0000003F (IA32_MC4_CTL)
 MSR 0x00000411 = 0x00000000:0x00000000 (IA32_MC4_STATUS)
 MSR 0x00000480 = 0x00DA0400:0x00000004 (IA32_VMX_BASIC)
 MSR 0x00000481 = 0x0000007F:0x00000016 (IA32_VMX_PINBASED_CTLS)
 MSR 0x00000482 = 0xFFF9FFFE:0x0401E172 (IA32_VMX_PROCBASED_CTLS)
 MSR 0x00000483 = 0x01FFFFFF:0x00036DFF (IA32_VMX_EXIT_CTLS)
 MSR 0x00000484 = 0x0003FFFF:0x000011FF (IA32_VMX_ENTRY_CTLS)
 MSR 0x00000485 = 0x00000000:0x7004C1E7 (IA32_VMX_MISC)
 MSR 0x00000486 = 0x00000000:0x80000021 (IA32_VMX_CR0_FIXED0)
 MSR 0x00000487 = 0x00000000:0xFFFFFFFF (IA32_VMX_CR0_FIXED1)
 MSR 0x00000488 = 0x00000000:0x00002000 (IA32_VMX_CR4_FIXED0)
 MSR 0x00000489 = 0x00000000:0x003727FF (IA32_VMX_CR4_FIXED1)
 MSR 0x0000048A = 0x00000000:0x0000002E (IA32_VMX_VMCS_ENUM)
 MSR 0x0000048B = 0x005FBCFF:0x00000000 (IA32_VMX_PROCBASED_CTLS2)
 MSR 0x0000048C = 0x00000F01:0x06734141 (IA32_VMX_EPT_VPID_ENUM)
 MSR 0x0000048D = 0x0000007F:0x00000016 (IA32_VMX_TRUE_PINBASED_CTLS)
 MSR 0x0000048E = 0xFFF9FFFE:0x04006172 (IA32_VMX_TRUE_PROCBASED_CTLS)
 MSR 0x0000048F = 0x01FFFFFF:0x00036DFB (IA32_VMX_TRUE_EXIT_CTLS)
 MSR 0x00000490 = 0x0003FFFF:0x000011FB (IA32_VMX_TRUE_ENTRY_CTLS)
 MSR 0x000004C1 = 0x00000000:0x00000000 (IA32_A_PMC0)
 MSR 0x000004C2 = 0x00000000:0x00000000 (IA32_A_PMC1)
 MSR 0x000004C3 = 0x00000000:0x00000000 (IA32_A_PMC2)
 MSR 0x000004C4 = 0x00000000:0x0000FFFF (IA32_A_PMC3)
 MSR 0x00000500 = 0x0000000E:0x00000000 (IA32_SGX_SVN_STATUS)
 MSR 0x00000560 = 0x00000000:0x00000000 (IA32_RTIT_OUTPUT_BASE)
 MSR 0x00000561 = 0x00000000:0x0000007F (IA32_RTIT_OUTPUT_MASK_PTRS)
 MSR 0x00000570 = 0x00000000:0x00000000 (IA32_RTIT_CTL)
 MSR 0x00000571 = 0x00000000:0x00000000 (IA32_RTIT_STATUS)
 MSR 0x00000572 = 0x00000000:0x00000000 (IA32_RTIT_CR3_MATCH)
 MSR 0x00000580 = 0x00000000:0x00000000 (IA32_RTIT_ADDR0_A)
 MSR 0x00000581 = 0x00000000:0x00000000 (IA32_RTIT_ADDR0_B)
 MSR 0x00000582 = 0x00000000:0x00000000 (IA32_RTIT_ADDR1_A)
 MSR 0x00000583 = 0x00000000:0x00000000 (IA32_RTIT_ADDR1_B)
 MSR 0x00000600 = 0xFFFFFE00:0x00015000 (IA32_DS_AREA)
 MSR 0x0000064E = 0x00000084:0x39195A4A (MSR_PPERF)
 MSR 0x00000653 = 0x00000000:0x00000000 (MSR_CORE_HDC_RESIDENCY)
 MSR 0x00000690 = 0x00000000:0x00000000 (MSR_LASTBRANCH_16_FROM_IP)
 MSR 0x00000691 = 0x00000000:0x00000000 (MSR_LASTBRANCH_17_FROM_IP)
 MSR 0x00000692 = 0x00000000:0x00000000 (MSR_LASTBRANCH_18_FROM_IP)
 MSR 0x00000693 = 0x00000000:0x00000000 (MSR_LASTBRANCH_19_FROM_IP)
 MSR 0x00000694 = 0x00000000:0x00000000 (MSR_LASTBRANCH_20_FROM_IP)
 MSR 0x00000695 = 0x00000000:0x00000000 (MSR_LASTBRANCH_21_FROM_IP)
 MSR 0x00000696 = 0x00000000:0x00000000 (MSR_LASTBRANCH_22_FROM_IP)
 MSR 0x00000697 = 0x00000000:0x00000000 (MSR_LASTBRANCH_23_FROM_IP)
 MSR 0x00000698 = 0x00000000:0x00000000 (MSR_LASTBRANCH_24_FROM_IP)
 MSR 0x00000699 = 0x00000000:0x00000000 (MSR_LASTBRANCH_25_FROM_IP)
 MSR 0x0000069A = 0x00000000:0x00000000 (MSR_LASTBRANCH_26_FROM_IP)
 MSR 0x0000069B = 0x00000000:0x00000000 (MSR_LASTBRANCH_27_FROM_IP)
 MSR 0x0000069C = 0x00000000:0x00000000 (MSR_LASTBRANCH_28_FROM_IP)
 MSR 0x0000069D = 0x00000000:0x00000000 (MSR_LASTBRANCH_29_FROM_IP)
 MSR 0x0000069E = 0x00000000:0x00000000 (MSR_LASTBRANCH_30_FROM_IP)
 MSR 0x0000069F = 0x00000000:0x00000000 (MSR_LASTBRANCH_31_FROM_IP)
 MSR 0x000006D0 = 0x00000000:0x00000000 (MSR_LASTBRANCH_16_TO_IP)
 MSR 0x000006D1 = 0x00000000:0x00000000 (MSR_LASTBRANCH_17_TO_IP)
 MSR 0x000006D2 = 0x00000000:0x00000000 (MSR_LASTBRANCH_18_TO_IP)
 MSR 0x000006D3 = 0x00000000:0x00000000 (MSR_LASTBRANCH_19_TO_IP)
 MSR 0x000006D4 = 0x00000000:0x00000000 (MSR_LASTBRANCH_20_TO_IP)
 MSR 0x000006D5 = 0x00000000:0x00000000 (MSR_LASTBRANCH_21_TO_IP)
 MSR 0x000006D6 = 0x00000000:0x00000000 (MSR_LASTBRANCH_22_TO_IP)
 MSR 0x000006D7 = 0x00000000:0x00000000 (MSR_LASTBRANCH_23_TO_IP)
 MSR 0x000006D8 = 0x00000000:0x00000000 (MSR_LASTBRANCH_24_TO_IP)
 MSR 0x000006D9 = 0x00000000:0x00000000 (MSR_LASTBRANCH_25_TO_IP)
 MSR 0x000006DA = 0x00000000:0x00000000 (MSR_LASTBRANCH_26_TO_IP)
 MSR 0x000006DB = 0x00000000:0x00000000 (MSR_LASTBRANCH_27_TO_IP)
 MSR 0x000006DC = 0x00000000:0x00000000 (MSR_LASTBRANCH_28_TO_IP)
 MSR 0x000006DD = 0x00000000:0x00000000 (MSR_LASTBRANCH_29_TO_IP)
 MSR 0x000006DE = 0x00000000:0x00000000 (MSR_LASTBRANCH_30_TO_IP)
 MSR 0x000006DF = 0x00000000:0x00000000 (MSR_LASTBRANCH_31_TO_IP)
 MSR 0x000006E0 = 0x00000285:0x54C04B76 (IA32_TSC_DEADLINE)
 MSR 0x00000771 = 0x00000000:0x010A1A2D (IA32_HWP_CAPABILITIES)
 MSR 0x00000773 = 0x00000000:0x00000000 (IA32_HWP_INTERRUPT)
 MSR 0x00000774 = 0x00000000:0x80002D08 (IA32_HWP_REQUEST)
 MSR 0x00000777 = 0x00000000:0x00000000 (IA32_HWP_STATUS)
 MSR 0x00000D90 = 0x00000000:0x00000000 (IA32_BNDCFGS)
 MSR 0x00000DA0 = 0x00000000:0x00000000 (IA32_XSS)
 MSR 0x00000DB1 = 0x00000000:0x00000001 (IA32_PM_CTL1)
 MSR 0x00000DB2 = 0x00000000:0x00000000 (IA32_THREAD_STALL)
 MSR 0x00000DC0 = 0x00000000:0x00000000 (IA32_LBR_INFO_0)
 MSR 0x00000DC1 = 0x00000000:0x00000000 (IA32_LBR_INFO_1)
 MSR 0x00000DC2 = 0x00000000:0x00000000 (IA32_LBR_INFO_2)
 MSR 0x00000DC3 = 0x00000000:0x00000000 (IA32_LBR_INFO_3)
 MSR 0x00000DC4 = 0x00000000:0x00000000 (IA32_LBR_INFO_4)
 MSR 0x00000DC5 = 0x00000000:0x00000000 (IA32_LBR_INFO_5)
 MSR 0x00000DC6 = 0x00000000:0x00000000 (IA32_LBR_INFO_6)
 MSR 0x00000DC7 = 0x00000000:0x00000000 (IA32_LBR_INFO_7)
 MSR 0x00000DC8 = 0x00000000:0x00000000 (IA32_LBR_INFO_8)
 MSR 0x00000DC9 = 0x00000000:0x00000000 (IA32_LBR_INFO_9)
 MSR 0x00000DCA = 0x00000000:0x00000000 (IA32_LBR_INFO_10)
 MSR 0x00000DCB = 0x00000000:0x00000000 (IA32_LBR_INFO_11)
 MSR 0x00000DCC = 0x00000000:0x00000000 (IA32_LBR_INFO_12)
 MSR 0x00000DCD = 0x00000000:0x00000000 (IA32_LBR_INFO_13)
 MSR 0x00000DCE = 0x00000000:0x00000000 (IA32_LBR_INFO_14)
 MSR 0x00000DCF = 0x00000000:0x00000000 (IA32_LBR_INFO_15)
 MSR 0x00000DD0 = 0x00000000:0x00000000 (IA32_LBR_INFO_16)
 MSR 0x00000DD1 = 0x00000000:0x00000000 (IA32_LBR_INFO_17)
 MSR 0x00000DD2 = 0x00000000:0x00000000 (IA32_LBR_INFO_18)
 MSR 0x00000DD3 = 0x00000000:0x00000000 (IA32_LBR_INFO_19)
 MSR 0x00000DD4 = 0x00000000:0x00000000 (IA32_LBR_INFO_20)
 MSR 0x00000DD5 = 0x00000000:0x00000000 (IA32_LBR_INFO_21)
 MSR 0x00000DD6 = 0x00000000:0x00000000 (IA32_LBR_INFO_22)
 MSR 0x00000DD7 = 0x00000000:0x00000000 (IA32_LBR_INFO_23)
 MSR 0x00000DD8 = 0x00000000:0x00000000 (IA32_LBR_INFO_24)
 MSR 0x00000DD9 = 0x00000000:0x00000000 (IA32_LBR_INFO_25)
 MSR 0x00000DDA = 0x00000000:0x00000000 (IA32_LBR_INFO_26)
 MSR 0x00000DDB = 0x00000000:0x00000000 (IA32_LBR_INFO_27)
 MSR 0x00000DDC = 0x00000000:0x00000000 (IA32_LBR_INFO_28)
 MSR 0x00000DDD = 0x00000000:0x00000000 (IA32_LBR_INFO_29)
 MSR 0x00000DDE = 0x00000000:0x00000000 (IA32_LBR_INFO_30)
 MSR 0x00000DDF = 0x00000000:0x00000000 (IA32_LBR_INFO_31)

====================== UNIQUE MSRs  (core 1) ======================
 MSR 0x00000000 = 0x00000000:0x00000FFF (IA32_P5_MC_ADDR)
 MSR 0x00000001 = 0x00000000:0x00000000 (IA32_P5_MC_TYPE)
 MSR 0x00000006 = 0x00000000:0x00000040 (IA32_MONITOR_FILTER_SIZE)
 MSR 0x00000010 = 0x00000285:0x5486DC36 (IA32_TIME_STAMP_COUNTER)
 MSR 0x0000001B = 0x00000000:0xFEE00C00 (IA32_APIC_BASE)
 MSR 0x00000034 = 0x00000000:0x0000066C (MSR_SMI_COUNT)
 MSR 0x0000003A = 0x00000000:0x00020005 (IA32_FEATURE_CONTROL)
 MSR 0x0000008B = 0x000000DE:0x00000000 (IA32_BIOS_SIGN_ID)
 MSR 0x000000C1 = 0x00000000:0x00000000 (IA32_PMC0)
 MSR 0x000000C2 = 0x00000000:0x00000000 (IA32_PMC1)
 MSR 0x000000C3 = 0x00000000:0x00000000 (IA32_PMC2)
 MSR 0x000000C4 = 0x00000000:0x00000000 (IA32_PMC3)
 MSR 0x000000E2 = 0x00000000:0x1C008007 (MSR_PKG_CST_CONFIG_CONTROL)
 MSR 0x000000E4 = 0x00000000:0x00051814 (MSR_PMG_IO_CAPTURE_BASE)
 MSR 0x000000E7 = 0x0000003F:0x10D1A18B (IA32_MPERF)
 MSR 0x000000E8 = 0x00000049:0x1F3F23E9 (IA32_APERF)
 MSR 0x000000FE = 0x00000000:0x00001D0A (IA32_MTRRCAP)
 MSR 0x0000013C = 0x00000000:0x00000001 (MSR_FEATURE_CONFIG)
 MSR 0x00000174 = 0x00000000:0x00000010 (IA32_SYSENTER_CS)
 MSR 0x00000175 = 0xFFFFFE00:0x00038000 (IA32_SYSENTER_ESP)
 MSR 0x00000176 = 0xFFFFFFFF:0x8B201580 (IA32_SYSENTER_EIP)
 MSR 0x00000179 = 0x00000000:0x00000C0C (IA32_MCG_CAP)
 MSR 0x0000017A = 0x00000000:0x00000000 (IA32_MCG_STATUS)
 MSR 0x00000186 = 0x00000000:0x00000000 (IA32_PERFEVTSEL0)
 MSR 0x00000187 = 0x00000000:0x00000000 (IA32_PERFEVTSEL1)
 MSR 0x00000188 = 0x00000000:0x00000000 (IA32_PERFEVTSEL2)
 MSR 0x00000189 = 0x00000000:0x00000000 (IA32_PERFEVTSEL3)
 MSR 0x00000199 = 0x00000000:0x00000800 (IA32_PERF_CTL)
 MSR 0x0000019A = 0x00000000:0x00000000 (IA32_CLOCK_MODULATION)
 MSR 0x0000019B = 0x00000000:0x00000013 (IA32_THERM_INTERRUPT)
 MSR 0x0000019C = 0x00000000:0x880C0803 (IA32_THERM_STATUS)
 MSR 0x000001A0 = 0x00000000:0x00850089 (IA32_MISC_ENABLE)
 MSR 0x000001A4 = 0x00000000:0x00000000 (IA32_MISC_FEATURE_CONTROL)
 MSR 0x000001A6 = 0x00000000:0x00000000 (MSR_OFFCORE_RSP_0)
 MSR 0x000001A7 = 0x00000000:0x00000000 (MSR_OFFCORE_RSP_1)
 MSR 0x000001C8 = 0x00000000:0x00000000 (MSR_LBR_SELECT)
 MSR 0x000001C9 = 0x00000000:0x00000000 (MSR_LASTBRANCH_TOS)
 MSR 0x000001D9 = 0x00000000:0x00000000 (IA32_DEBUGCTL)
 MSR 0x000001DD = 0x00000000:0x00000000 (MSR_LER_FROM_LIP)
 MSR 0x000001DE = 0x00000000:0x00000000 (MSR_LER_TO_LIP)
 MSR 0x000001F2 = 0x00000000:0x9A000006 (IA32_SMRR_PHYSBASE)
 MSR 0x000001F3 = 0x00000000:0xFF000800 (IA32_SMRR_PHYSMASK)
 MSR 0x000001F4 = 0x00000000:0x99F00006 (MSR_PRMRR_PHYS_BASE)
 MSR 0x000001F5 = 0x0000007F:0xFFF00C00 (MSR_PRMRR_PHYS_MASK)
 MSR 0x000001FB = 0x00000000:0x000000E1 (MSR_PRMRR_VALID_CONFIG)
 MSR 0x000001FC = 0x00000000:0x002C005D (MSR_POWER_CTL)
 MSR 0x00000200 = 0x00000000:0xC0000000 (IA32_MTRR_PHYSBASE0)
 MSR 0x00000201 = 0x0000007F:0xC0000800 (IA32_MTRR_PHYSBASE0)
 MSR 0x00000202 = 0x00000000:0xA0000000 (IA32_MTRR_PHYSBASE1)
 MSR 0x00000203 = 0x0000007F:0xE0000800 (IA32_MTRR_PHYSBASE1)
 MSR 0x00000204 = 0x00000000:0x9C000000 (IA32_MTRR_PHYSBASE2)
 MSR 0x00000205 = 0x0000007F:0xFC000800 (IA32_MTRR_PHYSBASE2)
 MSR 0x00000206 = 0x00000000:0x9B000000 (IA32_MTRR_PHYSBASE3)
 MSR 0x00000207 = 0x0000007F:0xFF000800 (IA32_MTRR_PHYSBASE3)
 MSR 0x00000208 = 0x00000020:0x00000000 (IA32_MTRR_PHYSBASE4)
 MSR 0x00000209 = 0x00000060:0x00000800 (IA32_MTRR_PHYSBASE4)
 MSR 0x0000020A = 0x00000010:0x00000000 (IA32_MTRR_PHYSBASE5)
 MSR 0x0000020B = 0x00000070:0x00000800 (IA32_MTRR_PHYSBASE5)
 MSR 0x0000020C = 0x00000040:0x00000000 (IA32_MTRR_PHYSBASE6)
 MSR 0x0000020D = 0x00000040:0x00000800 (IA32_MTRR_PHYSBASE6)
 MSR 0x0000020E = 0x00000004:0x00000006 (IA32_MTRR_PHYSBASE7)
 MSR 0x0000020F = 0x00000000:0x00000000 (IA32_MTRR_PHYSBASE7)
 MSR 0x00000210 = 0x00000008:0x00000006 (IA32_MTRR_PHYSBASE8)
 MSR 0x00000211 = 0x00000000:0x00000000 (IA32_MTRR_PHYSBASE8)
 MSR 0x00000212 = 0x00000000:0x00000000 (IA32_MTRR_PHYSBASE9)
 MSR 0x00000213 = 0x00000000:0x00000000 (IA32_MTRR_PHYSBASE9)
 MSR 0x00000250 = 0x06060606:0x06060606 (IA32_MTRR_FIX64K_00000)
 MSR 0x00000258 = 0x06060606:0x06060606 (IA32_MTRR_FIX16K_80000)
 MSR 0x00000259 = 0x00000000:0x00000000 (IA32_MTRR_FIX16K_A0000)
 MSR 0x00000268 = 0x05050505:0x05050505 (IA32_MTRR_FIX4K_C0000)
 MSR 0x00000269 = 0x05050505:0x05050505 (IA32_MTRR_FIX4K_C8000)
 MSR 0x0000026A = 0x05050505:0x05050505 (IA32_MTRR_FIX4K_D0000)
 MSR 0x0000026B = 0x05050505:0x05050505 (IA32_MTRR_FIX4K_D8000)
 MSR 0x0000026C = 0x05050505:0x05050505 (IA32_MTRR_FIX4K_E0000)
 MSR 0x0000026D = 0x05050505:0x05050505 (IA32_MTRR_FIX4K_E8000)
 MSR 0x0000026E = 0x05050505:0x05050505 (IA32_MTRR_FIX4K_F0000)
 MSR 0x0000026F = 0x05050505:0x05050505 (IA32_MTRR_FIX4K_F8000)
 MSR 0x00000277 = 0x04070506:0x00070106 (IA32_PAT)
 MSR 0x00000280 = 0x00000000:0x40000001 (IA32_MC0_CTL2)
 MSR 0x00000281 = 0x00000000:0x40000001 (IA32_MC1_CTL2)
 MSR 0x00000282 = 0x00000000:0x40000001 (IA32_MC2_CTL2)
 MSR 0x00000283 = 0x00000000:0x40000001 (IA32_MC3_CTL2)
 MSR 0x000002FF = 0x00000000:0x00000C06 (IA32_MTRR_DEF_TYPE)
 MSR 0x00000309 = 0x00000000:0x00000000 (IA32_FIXED_CTR0)
 MSR 0x0000030A = 0x0000FFFA:0xE8D0BA83 (IA32_FIXED_CTR1)
 MSR 0x0000030B = 0x00000000:0x00000000 (IA32_FIXED_CTR2)
 MSR 0x00000345 = 0x00000000:0x000033C5 (IA32_PERF_CAPABILITIES)
 MSR 0x0000038D = 0x00000000:0x000000B0 (IA32_FIXED_CTR_CTRL)
 MSR 0x0000038E = 0x00000000:0x00000000 (IA32_PERF_GLOBAL_STATUS)
 MSR 0x0000038F = 0x00000007:0x0000000F (IA32_PERF_GLOBAL_CTRL)
 MSR 0x00000390 = 0x00000000:0x00000000 (IA32_PERF_GLOBAL_STATUS_RESET)
 MSR 0x00000391 = 0x00000000:0x00000000 (IA32_PERF_GLOBAL_STATUS_SET)
 MSR 0x000003F1 = 0x00000000:0x00000000 (MSR_PEBS_ENABLE)
 MSR 0x000003F6 = 0x00000000:0x0000FFFF (MSR_PEBS_LD_LAT)
 MSR 0x000003F7 = 0x00000000:0x00000800 (MSR_PEBS_FRONTEND)
 MSR 0x000003FC = 0x00000002:0x09C72AF6 (MSR_CORE_C3_RESIDENCY)
 MSR 0x000003FD = 0x00000014:0x4C646364 (MSR_CORE_C6_RESIDENCY)
 MSR 0x000003FE = 0x000001A3:0x1F12376C (MSR_CORE_C7_RESIDENCY)
 MSR 0x00000400 = 0x00000000:0x00000FFF (IA32_MC0_CTL)
 MSR 0x00000401 = 0x00000000:0x00000000 (IA32_MC0_STATUS)
 MSR 0x00000402 = 0x00000000:0x00000000 (IA32_MC0_ADDR)
 MSR 0x00000403 = 0x00000000:0x00000000 (IA32_MC0_MISC)
 MSR 0x00000404 = 0x00000000:0x0000000F (IA32_MC1_CTL)
 MSR 0x00000405 = 0x00000000:0x00000000 (IA32_MC1_STATUS)
 MSR 0x00000406 = 0x00000000:0x00000000 (IA32_MC1_ADDR)
 MSR 0x00000407 = 0x00000000:0x00000000 (IA32_MC1_MISC)
 MSR 0x00000408 = 0x00000000:0x0000000F (IA32_MC2_CTL)
 MSR 0x00000409 = 0x00000000:0x00000000 (IA32_MC2_STATUS)
 MSR 0x0000040A = 0x00000000:0x00000000 (IA32_MC2_ADDR)
 MSR 0x0000040C = 0x00000000:0x0000001F (IA32_MC3_CTL)
 MSR 0x0000040D = 0x00000000:0x00000000 (IA32_MC3_STATUS)
 MSR 0x0000040E = 0x00000000:0x00000000 (IA32_MC3_ADDR)
 MSR 0x00000410 = 0x00000000:0x0000003F (IA32_MC4_CTL)
 MSR 0x00000411 = 0x00000000:0x00000000 (IA32_MC4_STATUS)
 MSR 0x00000480 = 0x00DA0400:0x00000004 (IA32_VMX_BASIC)
 MSR 0x00000481 = 0x0000007F:0x00000016 (IA32_VMX_PINBASED_CTLS)
 MSR 0x00000482 = 0xFFF9FFFE:0x0401E172 (IA32_VMX_PROCBASED_CTLS)
 MSR 0x00000483 = 0x01FFFFFF:0x00036DFF (IA32_VMX_EXIT_CTLS)
 MSR 0x00000484 = 0x0003FFFF:0x000011FF (IA32_VMX_ENTRY_CTLS)
 MSR 0x00000485 = 0x00000000:0x7004C1E7 (IA32_VMX_MISC)
 MSR 0x00000486 = 0x00000000:0x80000021 (IA32_VMX_CR0_FIXED0)
 MSR 0x00000487 = 0x00000000:0xFFFFFFFF (IA32_VMX_CR0_FIXED1)
 MSR 0x00000488 = 0x00000000:0x00002000 (IA32_VMX_CR4_FIXED0)
 MSR 0x00000489 = 0x00000000:0x003727FF (IA32_VMX_CR4_FIXED1)
 MSR 0x0000048A = 0x00000000:0x0000002E (IA32_VMX_VMCS_ENUM)
 MSR 0x0000048B = 0x005FBCFF:0x00000000 (IA32_VMX_PROCBASED_CTLS2)
 MSR 0x0000048C = 0x00000F01:0x06734141 (IA32_VMX_EPT_VPID_ENUM)
 MSR 0x0000048D = 0x0000007F:0x00000016 (IA32_VMX_TRUE_PINBASED_CTLS)
 MSR 0x0000048E = 0xFFF9FFFE:0x04006172 (IA32_VMX_TRUE_PROCBASED_CTLS)
 MSR 0x0000048F = 0x01FFFFFF:0x00036DFB (IA32_VMX_TRUE_EXIT_CTLS)
 MSR 0x00000490 = 0x0003FFFF:0x000011FB (IA32_VMX_TRUE_ENTRY_CTLS)
 MSR 0x000004C1 = 0x00000000:0x00000000 (IA32_A_PMC0)
 MSR 0x000004C2 = 0x00000000:0x00000000 (IA32_A_PMC1)
 MSR 0x000004C3 = 0x00000000:0x00000000 (IA32_A_PMC2)
 MSR 0x000004C4 = 0x00000000:0x00000000 (IA32_A_PMC3)
 MSR 0x00000500 = 0x0000000E:0x00000000 (IA32_SGX_SVN_STATUS)
 MSR 0x00000560 = 0x00000000:0x00000000 (IA32_RTIT_OUTPUT_BASE)
 MSR 0x00000561 = 0x00000000:0x0000007F (IA32_RTIT_OUTPUT_MASK_PTRS)
 MSR 0x00000570 = 0x00000000:0x00000000 (IA32_RTIT_CTL)
 MSR 0x00000571 = 0x00000000:0x00000000 (IA32_RTIT_STATUS)
 MSR 0x00000572 = 0x00000000:0x00000000 (IA32_RTIT_CR3_MATCH)
 MSR 0x00000580 = 0x00000000:0x00000000 (IA32_RTIT_ADDR0_A)
 MSR 0x00000581 = 0x00000000:0x00000000 (IA32_RTIT_ADDR0_B)
 MSR 0x00000582 = 0x00000000:0x00000000 (IA32_RTIT_ADDR1_A)
 MSR 0x00000583 = 0x00000000:0x00000000 (IA32_RTIT_ADDR1_B)
 MSR 0x00000600 = 0xFFFFFE00:0x0004A000 (IA32_DS_AREA)
 MSR 0x0000064E = 0x00000045:0x83C4490C (MSR_PPERF)
 MSR 0x00000653 = 0x00000000:0x00000000 (MSR_CORE_HDC_RESIDENCY)
 MSR 0x00000690 = 0x00000000:0x00000000 (MSR_LASTBRANCH_16_FROM_IP)
 MSR 0x00000691 = 0x00000000:0x00000000 (MSR_LASTBRANCH_17_FROM_IP)
 MSR 0x00000692 = 0x00000000:0x00000000 (MSR_LASTBRANCH_18_FROM_IP)
 MSR 0x00000693 = 0x00000000:0x00000000 (MSR_LASTBRANCH_19_FROM_IP)
 MSR 0x00000694 = 0x00000000:0x00000000 (MSR_LASTBRANCH_20_FROM_IP)
 MSR 0x00000695 = 0x00000000:0x00000000 (MSR_LASTBRANCH_21_FROM_IP)
 MSR 0x00000696 = 0x00000000:0x00000000 (MSR_LASTBRANCH_22_FROM_IP)
 MSR 0x00000697 = 0x00000000:0x00000000 (MSR_LASTBRANCH_23_FROM_IP)
 MSR 0x00000698 = 0x00000000:0x00000000 (MSR_LASTBRANCH_24_FROM_IP)
 MSR 0x00000699 = 0x00000000:0x00000000 (MSR_LASTBRANCH_25_FROM_IP)
 MSR 0x0000069A = 0x00000000:0x00000000 (MSR_LASTBRANCH_26_FROM_IP)
 MSR 0x0000069B = 0x00000000:0x00000000 (MSR_LASTBRANCH_27_FROM_IP)
 MSR 0x0000069C = 0x00000000:0x00000000 (MSR_LASTBRANCH_28_FROM_IP)
 MSR 0x0000069D = 0x00000000:0x00000000 (MSR_LASTBRANCH_29_FROM_IP)
 MSR 0x0000069E = 0x00000000:0x00000000 (MSR_LASTBRANCH_30_FROM_IP)
 MSR 0x0000069F = 0x00000000:0x00000000 (MSR_LASTBRANCH_31_FROM_IP)
 MSR 0x000006D0 = 0x00000000:0x00000000 (MSR_LASTBRANCH_16_TO_IP)
 MSR 0x000006D1 = 0x00000000:0x00000000 (MSR_LASTBRANCH_17_TO_IP)
 MSR 0x000006D2 = 0x00000000:0x00000000 (MSR_LASTBRANCH_18_TO_IP)
 MSR 0x000006D3 = 0x00000000:0x00000000 (MSR_LASTBRANCH_19_TO_IP)
 MSR 0x000006D4 = 0x00000000:0x00000000 (MSR_LASTBRANCH_20_TO_IP)
 MSR 0x000006D5 = 0x00000000:0x00000000 (MSR_LASTBRANCH_21_TO_IP)
 MSR 0x000006D6 = 0x00000000:0x00000000 (MSR_LASTBRANCH_22_TO_IP)
 MSR 0x000006D7 = 0x00000000:0x00000000 (MSR_LASTBRANCH_23_TO_IP)
 MSR 0x000006D8 = 0x00000000:0x00000000 (MSR_LASTBRANCH_24_TO_IP)
 MSR 0x000006D9 = 0x00000000:0x00000000 (MSR_LASTBRANCH_25_TO_IP)
 MSR 0x000006DA = 0x00000000:0x00000000 (MSR_LASTBRANCH_26_TO_IP)
 MSR 0x000006DB = 0x00000000:0x00000000 (MSR_LASTBRANCH_27_TO_IP)
 MSR 0x000006DC = 0x00000000:0x00000000 (MSR_LASTBRANCH_28_TO_IP)
 MSR 0x000006DD = 0x00000000:0x00000000 (MSR_LASTBRANCH_29_TO_IP)
 MSR 0x000006DE = 0x00000000:0x00000000 (MSR_LASTBRANCH_30_TO_IP)
 MSR 0x000006DF = 0x00000000:0x00000000 (MSR_LASTBRANCH_31_TO_IP)
 MSR 0x000006E0 = 0x00000285:0x55111AF6 (IA32_TSC_DEADLINE)
 MSR 0x00000771 = 0x00000000:0x010B1A2D (IA32_HWP_CAPABILITIES)
 MSR 0x00000773 = 0x00000000:0x00000000 (IA32_HWP_INTERRUPT)
 MSR 0x00000774 = 0x00000000:0x80002D08 (IA32_HWP_REQUEST)
 MSR 0x00000777 = 0x00000000:0x00000000 (IA32_HWP_STATUS)
 MSR 0x00000D90 = 0x00000000:0x00000000 (IA32_BNDCFGS)
 MSR 0x00000DA0 = 0x00000000:0x00000000 (IA32_XSS)
 MSR 0x00000DB1 = 0x00000000:0x00000001 (IA32_PM_CTL1)
 MSR 0x00000DB2 = 0x00000000:0x00000000 (IA32_THREAD_STALL)
 MSR 0x00000DC0 = 0x00000000:0x00000000 (IA32_LBR_INFO_0)
 MSR 0x00000DC1 = 0x00000000:0x00000000 (IA32_LBR_INFO_1)
 MSR 0x00000DC2 = 0x00000000:0x00000000 (IA32_LBR_INFO_2)
 MSR 0x00000DC3 = 0x00000000:0x00000000 (IA32_LBR_INFO_3)
 MSR 0x00000DC4 = 0x00000000:0x00000000 (IA32_LBR_INFO_4)
 MSR 0x00000DC5 = 0x00000000:0x00000000 (IA32_LBR_INFO_5)
 MSR 0x00000DC6 = 0x00000000:0x00000000 (IA32_LBR_INFO_6)
 MSR 0x00000DC7 = 0x00000000:0x00000000 (IA32_LBR_INFO_7)
 MSR 0x00000DC8 = 0x00000000:0x00000000 (IA32_LBR_INFO_8)
 MSR 0x00000DC9 = 0x00000000:0x00000000 (IA32_LBR_INFO_9)
 MSR 0x00000DCA = 0x00000000:0x00000000 (IA32_LBR_INFO_10)
 MSR 0x00000DCB = 0x00000000:0x00000000 (IA32_LBR_INFO_11)
 MSR 0x00000DCC = 0x00000000:0x00000000 (IA32_LBR_INFO_12)
 MSR 0x00000DCD = 0x00000000:0x00000000 (IA32_LBR_INFO_13)
 MSR 0x00000DCE = 0x00000000:0x00000000 (IA32_LBR_INFO_14)
 MSR 0x00000DCF = 0x00000000:0x00000000 (IA32_LBR_INFO_15)
 MSR 0x00000DD0 = 0x00000000:0x00000000 (IA32_LBR_INFO_16)
 MSR 0x00000DD1 = 0x00000000:0x00000000 (IA32_LBR_INFO_17)
 MSR 0x00000DD2 = 0x00000000:0x00000000 (IA32_LBR_INFO_18)
 MSR 0x00000DD3 = 0x00000000:0x00000000 (IA32_LBR_INFO_19)
 MSR 0x00000DD4 = 0x00000000:0x00000000 (IA32_LBR_INFO_20)
 MSR 0x00000DD5 = 0x00000000:0x00000000 (IA32_LBR_INFO_21)
 MSR 0x00000DD6 = 0x00000000:0x00000000 (IA32_LBR_INFO_22)
 MSR 0x00000DD7 = 0x00000000:0x00000000 (IA32_LBR_INFO_23)
 MSR 0x00000DD8 = 0x00000000:0x00000000 (IA32_LBR_INFO_24)
 MSR 0x00000DD9 = 0x00000000:0x00000000 (IA32_LBR_INFO_25)
 MSR 0x00000DDA = 0x00000000:0x00000000 (IA32_LBR_INFO_26)
 MSR 0x00000DDB = 0x00000000:0x00000000 (IA32_LBR_INFO_27)
 MSR 0x00000DDC = 0x00000000:0x00000000 (IA32_LBR_INFO_28)
 MSR 0x00000DDD = 0x00000000:0x00000000 (IA32_LBR_INFO_29)
 MSR 0x00000DDE = 0x00000000:0x00000000 (IA32_LBR_INFO_30)
 MSR 0x00000DDF = 0x00000000:0x00000000 (IA32_LBR_INFO_31)

====================== UNIQUE MSRs  (core 2) ======================
 MSR 0x00000000 = 0x00000000:0x00000FFF (IA32_P5_MC_ADDR)
 MSR 0x00000001 = 0x00000000:0x00000000 (IA32_P5_MC_TYPE)
 MSR 0x00000006 = 0x00000000:0x00000040 (IA32_MONITOR_FILTER_SIZE)
 MSR 0x00000010 = 0x00000285:0x54A6A372 (IA32_TIME_STAMP_COUNTER)
 MSR 0x0000001B = 0x00000000:0xFEE00C00 (IA32_APIC_BASE)
 MSR 0x00000034 = 0x00000000:0x0000066C (MSR_SMI_COUNT)
 MSR 0x0000003A = 0x00000000:0x00020005 (IA32_FEATURE_CONTROL)
 MSR 0x0000008B = 0x000000DE:0x00000000 (IA32_BIOS_SIGN_ID)
 MSR 0x000000C1 = 0x00000000:0x00000000 (IA32_PMC0)
 MSR 0x000000C2 = 0x00000000:0x00000000 (IA32_PMC1)
 MSR 0x000000C3 = 0x00000000:0x00000000 (IA32_PMC2)
 MSR 0x000000C4 = 0x00000000:0x00000000 (IA32_PMC3)
 MSR 0x000000E2 = 0x00000000:0x1C008007 (MSR_PKG_CST_CONFIG_CONTROL)
 MSR 0x000000E4 = 0x00000000:0x00051814 (MSR_PMG_IO_CAPTURE_BASE)
 MSR 0x000000E7 = 0x0000005F:0x5C2914E2 (IA32_MPERF)
 MSR 0x000000E8 = 0x00000065:0x9C764331 (IA32_APERF)
 MSR 0x000000FE = 0x00000000:0x00001D0A (IA32_MTRRCAP)
 MSR 0x0000013C = 0x00000000:0x00000001 (MSR_FEATURE_CONFIG)
 MSR 0x00000174 = 0x00000000:0x00000010 (IA32_SYSENTER_CS)
 MSR 0x00000175 = 0xFFFFFE00:0x0006D000 (IA32_SYSENTER_ESP)
 MSR 0x00000176 = 0xFFFFFFFF:0x8B201580 (IA32_SYSENTER_EIP)
 MSR 0x00000179 = 0x00000000:0x00000C0C (IA32_MCG_CAP)
 MSR 0x0000017A = 0x00000000:0x00000000 (IA32_MCG_STATUS)
 MSR 0x00000186 = 0x00000000:0x00000000 (IA32_PERFEVTSEL0)
 MSR 0x00000187 = 0x00000000:0x00000000 (IA32_PERFEVTSEL1)
 MSR 0x00000188 = 0x00000000:0x00000000 (IA32_PERFEVTSEL2)
 MSR 0x00000189 = 0x00000000:0x00000000 (IA32_PERFEVTSEL3)
 MSR 0x00000199 = 0x00000000:0x00000800 (IA32_PERF_CTL)
 MSR 0x0000019A = 0x00000000:0x00000000 (IA32_CLOCK_MODULATION)
 MSR 0x0000019B = 0x00000000:0x00000013 (IA32_THERM_INTERRUPT)
 MSR 0x0000019C = 0x00000000:0x88120802 (IA32_THERM_STATUS)
 MSR 0x000001A0 = 0x00000000:0x00850089 (IA32_MISC_ENABLE)
 MSR 0x000001A4 = 0x00000000:0x00000000 (IA32_MISC_FEATURE_CONTROL)
 MSR 0x000001A6 = 0x00000000:0x00000000 (MSR_OFFCORE_RSP_0)
 MSR 0x000001A7 = 0x00000000:0x00000000 (MSR_OFFCORE_RSP_1)
 MSR 0x000001C8 = 0x00000000:0x00000000 (MSR_LBR_SELECT)
 MSR 0x000001C9 = 0x00000000:0x00000000 (MSR_LASTBRANCH_TOS)
 MSR 0x000001D9 = 0x00000000:0x00000000 (IA32_DEBUGCTL)
 MSR 0x000001DD = 0x00000000:0x00000000 (MSR_LER_FROM_LIP)
 MSR 0x000001DE = 0x00000000:0x00000000 (MSR_LER_TO_LIP)
 MSR 0x000001F2 = 0x00000000:0x9A000006 (IA32_SMRR_PHYSBASE)
 MSR 0x000001F3 = 0x00000000:0xFF000800 (IA32_SMRR_PHYSMASK)
 MSR 0x000001F4 = 0x00000000:0x99F00006 (MSR_PRMRR_PHYS_BASE)
 MSR 0x000001F5 = 0x0000007F:0xFFF00C00 (MSR_PRMRR_PHYS_MASK)
 MSR 0x000001FB = 0x00000000:0x000000E1 (MSR_PRMRR_VALID_CONFIG)
 MSR 0x000001FC = 0x00000000:0x002C005D (MSR_POWER_CTL)
 MSR 0x00000200 = 0x00000000:0xC0000000 (IA32_MTRR_PHYSBASE0)
 MSR 0x00000201 = 0x0000007F:0xC0000800 (IA32_MTRR_PHYSBASE0)
 MSR 0x00000202 = 0x00000000:0xA0000000 (IA32_MTRR_PHYSBASE1)
 MSR 0x00000203 = 0x0000007F:0xE0000800 (IA32_MTRR_PHYSBASE1)
 MSR 0x00000204 = 0x00000000:0x9C000000 (IA32_MTRR_PHYSBASE2)
 MSR 0x00000205 = 0x0000007F:0xFC000800 (IA32_MTRR_PHYSBASE2)
 MSR 0x00000206 = 0x00000000:0x9B000000 (IA32_MTRR_PHYSBASE3)
 MSR 0x00000207 = 0x0000007F:0xFF000800 (IA32_MTRR_PHYSBASE3)
 MSR 0x00000208 = 0x00000020:0x00000000 (IA32_MTRR_PHYSBASE4)
 MSR 0x00000209 = 0x00000060:0x00000800 (IA32_MTRR_PHYSBASE4)
 MSR 0x0000020A = 0x00000010:0x00000000 (IA32_MTRR_PHYSBASE5)
 MSR 0x0000020B = 0x00000070:0x00000800 (IA32_MTRR_PHYSBASE5)
 MSR 0x0000020C = 0x00000040:0x00000000 (IA32_MTRR_PHYSBASE6)
 MSR 0x0000020D = 0x00000040:0x00000800 (IA32_MTRR_PHYSBASE6)
 MSR 0x0000020E = 0x00000004:0x00000006 (IA32_MTRR_PHYSBASE7)
 MSR 0x0000020F = 0x00000000:0x00000000 (IA32_MTRR_PHYSBASE7)
 MSR 0x00000210 = 0x00000008:0x00000006 (IA32_MTRR_PHYSBASE8)
 MSR 0x00000211 = 0x00000000:0x00000000 (IA32_MTRR_PHYSBASE8)
 MSR 0x00000212 = 0x00000000:0x00000000 (IA32_MTRR_PHYSBASE9)
 MSR 0x00000213 = 0x00000000:0x00000000 (IA32_MTRR_PHYSBASE9)
 MSR 0x00000250 = 0x06060606:0x06060606 (IA32_MTRR_FIX64K_00000)
 MSR 0x00000258 = 0x06060606:0x06060606 (IA32_MTRR_FIX16K_80000)
 MSR 0x00000259 = 0x00000000:0x00000000 (IA32_MTRR_FIX16K_A0000)
 MSR 0x00000268 = 0x05050505:0x05050505 (IA32_MTRR_FIX4K_C0000)
 MSR 0x00000269 = 0x05050505:0x05050505 (IA32_MTRR_FIX4K_C8000)
 MSR 0x0000026A = 0x05050505:0x05050505 (IA32_MTRR_FIX4K_D0000)
 MSR 0x0000026B = 0x05050505:0x05050505 (IA32_MTRR_FIX4K_D8000)
 MSR 0x0000026C = 0x05050505:0x05050505 (IA32_MTRR_FIX4K_E0000)
 MSR 0x0000026D = 0x05050505:0x05050505 (IA32_MTRR_FIX4K_E8000)
 MSR 0x0000026E = 0x05050505:0x05050505 (IA32_MTRR_FIX4K_F0000)
 MSR 0x0000026F = 0x05050505:0x05050505 (IA32_MTRR_FIX4K_F8000)
 MSR 0x00000277 = 0x04070506:0x00070106 (IA32_PAT)
 MSR 0x00000280 = 0x00000000:0x40000001 (IA32_MC0_CTL2)
 MSR 0x00000281 = 0x00000000:0x40000001 (IA32_MC1_CTL2)
 MSR 0x00000282 = 0x00000000:0x40000001 (IA32_MC2_CTL2)
 MSR 0x00000283 = 0x00000000:0x40000001 (IA32_MC3_CTL2)
 MSR 0x000002FF = 0x00000000:0x00000C06 (IA32_MTRR_DEF_TYPE)
 MSR 0x00000309 = 0x00000000:0x00000000 (IA32_FIXED_CTR0)
 MSR 0x0000030A = 0x0000FFFF:0xD7BFBD94 (IA32_FIXED_CTR1)
 MSR 0x0000030B = 0x00000000:0x00000000 (IA32_FIXED_CTR2)
 MSR 0x00000345 = 0x00000000:0x000033C5 (IA32_PERF_CAPABILITIES)
 MSR 0x0000038D = 0x00000000:0x000000B0 (IA32_FIXED_CTR_CTRL)
 MSR 0x0000038E = 0x00000000:0x00000000 (IA32_PERF_GLOBAL_STATUS)
 MSR 0x0000038F = 0x00000007:0x0000000F (IA32_PERF_GLOBAL_CTRL)
 MSR 0x00000390 = 0x00000000:0x00000000 (IA32_PERF_GLOBAL_STATUS_RESET)
 MSR 0x00000391 = 0x00000000:0x00000000 (IA32_PERF_GLOBAL_STATUS_SET)
 MSR 0x000003F1 = 0x00000000:0x00000000 (MSR_PEBS_ENABLE)
 MSR 0x000003F6 = 0x00000000:0x0000FFFF (MSR_PEBS_LD_LAT)
 MSR 0x000003F7 = 0x00000000:0x00000800 (MSR_PEBS_FRONTEND)
 MSR 0x000003FC = 0x00000005:0xB07C405C (MSR_CORE_C3_RESIDENCY)
 MSR 0x000003FD = 0x00000027:0x1DA7E88A (MSR_CORE_C6_RESIDENCY)
 MSR 0x000003FE = 0x00000163:0xDB5749DA (MSR_CORE_C7_RESIDENCY)
 MSR 0x00000400 = 0x00000000:0x00000FFF (IA32_MC0_CTL)
 MSR 0x00000401 = 0x00000000:0x00000000 (IA32_MC0_STATUS)
 MSR 0x00000402 = 0x00000000:0x00000000 (IA32_MC0_ADDR)
 MSR 0x00000403 = 0x00000000:0x00000000 (IA32_MC0_MISC)
 MSR 0x00000404 = 0x00000000:0x0000000F (IA32_MC1_CTL)
 MSR 0x00000405 = 0x00000000:0x00000000 (IA32_MC1_STATUS)
 MSR 0x00000406 = 0x00000000:0x00000000 (IA32_MC1_ADDR)
 MSR 0x00000407 = 0x00000000:0x00000000 (IA32_MC1_MISC)
 MSR 0x00000408 = 0x00000000:0x0000000F (IA32_MC2_CTL)
 MSR 0x00000409 = 0x00000000:0x00000000 (IA32_MC2_STATUS)
 MSR 0x0000040A = 0x00000000:0x00000000 (IA32_MC2_ADDR)
 MSR 0x0000040C = 0x00000000:0x0000001F (IA32_MC3_CTL)
 MSR 0x0000040D = 0x00000000:0x00000000 (IA32_MC3_STATUS)
 MSR 0x0000040E = 0x00000000:0x00000000 (IA32_MC3_ADDR)
 MSR 0x00000410 = 0x00000000:0x0000003F (IA32_MC4_CTL)
 MSR 0x00000411 = 0x00000000:0x00000000 (IA32_MC4_STATUS)
 MSR 0x00000480 = 0x00DA0400:0x00000004 (IA32_VMX_BASIC)
 MSR 0x00000481 = 0x0000007F:0x00000016 (IA32_VMX_PINBASED_CTLS)
 MSR 0x00000482 = 0xFFF9FFFE:0x0401E172 (IA32_VMX_PROCBASED_CTLS)
 MSR 0x00000483 = 0x01FFFFFF:0x00036DFF (IA32_VMX_EXIT_CTLS)
 MSR 0x00000484 = 0x0003FFFF:0x000011FF (IA32_VMX_ENTRY_CTLS)
 MSR 0x00000485 = 0x00000000:0x7004C1E7 (IA32_VMX_MISC)
 MSR 0x00000486 = 0x00000000:0x80000021 (IA32_VMX_CR0_FIXED0)
 MSR 0x00000487 = 0x00000000:0xFFFFFFFF (IA32_VMX_CR0_FIXED1)
 MSR 0x00000488 = 0x00000000:0x00002000 (IA32_VMX_CR4_FIXED0)
 MSR 0x00000489 = 0x00000000:0x003727FF (IA32_VMX_CR4_FIXED1)
 MSR 0x0000048A = 0x00000000:0x0000002E (IA32_VMX_VMCS_ENUM)
 MSR 0x0000048B = 0x005FBCFF:0x00000000 (IA32_VMX_PROCBASED_CTLS2)
 MSR 0x0000048C = 0x00000F01:0x06734141 (IA32_VMX_EPT_VPID_ENUM)
 MSR 0x0000048D = 0x0000007F:0x00000016 (IA32_VMX_TRUE_PINBASED_CTLS)
 MSR 0x0000048E = 0xFFF9FFFE:0x04006172 (IA32_VMX_TRUE_PROCBASED_CTLS)
 MSR 0x0000048F = 0x01FFFFFF:0x00036DFB (IA32_VMX_TRUE_EXIT_CTLS)
 MSR 0x00000490 = 0x0003FFFF:0x000011FB (IA32_VMX_TRUE_ENTRY_CTLS)
 MSR 0x000004C1 = 0x00000000:0x00000000 (IA32_A_PMC0)
 MSR 0x000004C2 = 0x00000000:0x00000000 (IA32_A_PMC1)
 MSR 0x000004C3 = 0x00000000:0x00000000 (IA32_A_PMC2)
 MSR 0x000004C4 = 0x00000000:0x00000000 (IA32_A_PMC3)
 MSR 0x00000500 = 0x0000000E:0x00000000 (IA32_SGX_SVN_STATUS)
 MSR 0x00000560 = 0x00000000:0x00000000 (IA32_RTIT_OUTPUT_BASE)
 MSR 0x00000561 = 0x00000000:0x0000007F (IA32_RTIT_OUTPUT_MASK_PTRS)
 MSR 0x00000570 = 0x00000000:0x00000000 (IA32_RTIT_CTL)
 MSR 0x00000571 = 0x00000000:0x00000000 (IA32_RTIT_STATUS)
 MSR 0x00000572 = 0x00000000:0x00000000 (IA32_RTIT_CR3_MATCH)
 MSR 0x00000580 = 0x00000000:0x00000000 (IA32_RTIT_ADDR0_A)
 MSR 0x00000581 = 0x00000000:0x00000000 (IA32_RTIT_ADDR0_B)
 MSR 0x00000582 = 0x00000000:0x00000000 (IA32_RTIT_ADDR1_A)
 MSR 0x00000583 = 0x00000000:0x00000000 (IA32_RTIT_ADDR1_B)
 MSR 0x00000600 = 0xFFFFFE00:0x0007F000 (IA32_DS_AREA)
 MSR 0x0000064E = 0x00000060:0x2E56EC77 (MSR_PPERF)
 MSR 0x00000653 = 0x00000000:0x00000000 (MSR_CORE_HDC_RESIDENCY)
 MSR 0x00000690 = 0x00000000:0x00000000 (MSR_LASTBRANCH_16_FROM_IP)
 MSR 0x00000691 = 0x00000000:0x00000000 (MSR_LASTBRANCH_17_FROM_IP)
 MSR 0x00000692 = 0x00000000:0x00000000 (MSR_LASTBRANCH_18_FROM_IP)
 MSR 0x00000693 = 0x00000000:0x00000000 (MSR_LASTBRANCH_19_FROM_IP)
 MSR 0x00000694 = 0x00000000:0x00000000 (MSR_LASTBRANCH_20_FROM_IP)
 MSR 0x00000695 = 0x00000000:0x00000000 (MSR_LASTBRANCH_21_FROM_IP)
 MSR 0x00000696 = 0x00000000:0x00000000 (MSR_LASTBRANCH_22_FROM_IP)
 MSR 0x00000697 = 0x00000000:0x00000000 (MSR_LASTBRANCH_23_FROM_IP)
 MSR 0x00000698 = 0x00000000:0x00000000 (MSR_LASTBRANCH_24_FROM_IP)
 MSR 0x00000699 = 0x00000000:0x00000000 (MSR_LASTBRANCH_25_FROM_IP)
 MSR 0x0000069A = 0x00000000:0x00000000 (MSR_LASTBRANCH_26_FROM_IP)
 MSR 0x0000069B = 0x00000000:0x00000000 (MSR_LASTBRANCH_27_FROM_IP)
 MSR 0x0000069C = 0x00000000:0x00000000 (MSR_LASTBRANCH_28_FROM_IP)
 MSR 0x0000069D = 0x00000000:0x00000000 (MSR_LASTBRANCH_29_FROM_IP)
 MSR 0x0000069E = 0x00000000:0x00000000 (MSR_LASTBRANCH_30_FROM_IP)
 MSR 0x0000069F = 0x00000000:0x00000000 (MSR_LASTBRANCH_31_FROM_IP)
 MSR 0x000006D0 = 0x00000000:0x00000000 (MSR_LASTBRANCH_16_TO_IP)
 MSR 0x000006D1 = 0x00000000:0x00000000 (MSR_LASTBRANCH_17_TO_IP)
 MSR 0x000006D2 = 0x00000000:0x00000000 (MSR_LASTBRANCH_18_TO_IP)
 MSR 0x000006D3 = 0x00000000:0x00000000 (MSR_LASTBRANCH_19_TO_IP)
 MSR 0x000006D4 = 0x00000000:0x00000000 (MSR_LASTBRANCH_20_TO_IP)
 MSR 0x000006D5 = 0x00000000:0x00000000 (MSR_LASTBRANCH_21_TO_IP)
 MSR 0x000006D6 = 0x00000000:0x00000000 (MSR_LASTBRANCH_22_TO_IP)
 MSR 0x000006D7 = 0x00000000:0x00000000 (MSR_LASTBRANCH_23_TO_IP)
 MSR 0x000006D8 = 0x00000000:0x00000000 (MSR_LASTBRANCH_24_TO_IP)
 MSR 0x000006D9 = 0x00000000:0x00000000 (MSR_LASTBRANCH_25_TO_IP)
 MSR 0x000006DA = 0x00000000:0x00000000 (MSR_LASTBRANCH_26_TO_IP)
 MSR 0x000006DB = 0x00000000:0x00000000 (MSR_LASTBRANCH_27_TO_IP)
 MSR 0x000006DC = 0x00000000:0x00000000 (MSR_LASTBRANCH_28_TO_IP)
 MSR 0x000006DD = 0x00000000:0x00000000 (MSR_LASTBRANCH_29_TO_IP)
 MSR 0x000006DE = 0x00000000:0x00000000 (MSR_LASTBRANCH_30_TO_IP)
 MSR 0x000006DF = 0x00000000:0x00000000 (MSR_LASTBRANCH_31_TO_IP)
 MSR 0x000006E0 = 0x00000285:0x55111AFC (IA32_TSC_DEADLINE)
 MSR 0x00000771 = 0x00000000:0x010B1A2D (IA32_HWP_CAPABILITIES)
 MSR 0x00000773 = 0x00000000:0x00000000 (IA32_HWP_INTERRUPT)
 MSR 0x00000774 = 0x00000000:0x80002D08 (IA32_HWP_REQUEST)
 MSR 0x00000777 = 0x00000000:0x00000000 (IA32_HWP_STATUS)
 MSR 0x00000D90 = 0x00000000:0x00000000 (IA32_BNDCFGS)
 MSR 0x00000DA0 = 0x00000000:0x00000000 (IA32_XSS)
 MSR 0x00000DB1 = 0x00000000:0x00000001 (IA32_PM_CTL1)
 MSR 0x00000DB2 = 0x00000000:0x00000000 (IA32_THREAD_STALL)
 MSR 0x00000DC0 = 0x00000000:0x00000000 (IA32_LBR_INFO_0)
 MSR 0x00000DC1 = 0x00000000:0x00000000 (IA32_LBR_INFO_1)
 MSR 0x00000DC2 = 0x00000000:0x00000000 (IA32_LBR_INFO_2)
 MSR 0x00000DC3 = 0x00000000:0x00000000 (IA32_LBR_INFO_3)
 MSR 0x00000DC4 = 0x00000000:0x00000000 (IA32_LBR_INFO_4)
 MSR 0x00000DC5 = 0x00000000:0x00000000 (IA32_LBR_INFO_5)
 MSR 0x00000DC6 = 0x00000000:0x00000000 (IA32_LBR_INFO_6)
 MSR 0x00000DC7 = 0x00000000:0x00000000 (IA32_LBR_INFO_7)
 MSR 0x00000DC8 = 0x00000000:0x00000000 (IA32_LBR_INFO_8)
 MSR 0x00000DC9 = 0x00000000:0x00000000 (IA32_LBR_INFO_9)
 MSR 0x00000DCA = 0x00000000:0x00000000 (IA32_LBR_INFO_10)
 MSR 0x00000DCB = 0x00000000:0x00000000 (IA32_LBR_INFO_11)
 MSR 0x00000DCC = 0x00000000:0x00000000 (IA32_LBR_INFO_12)
 MSR 0x00000DCD = 0x00000000:0x00000000 (IA32_LBR_INFO_13)
 MSR 0x00000DCE = 0x00000000:0x00000000 (IA32_LBR_INFO_14)
 MSR 0x00000DCF = 0x00000000:0x00000000 (IA32_LBR_INFO_15)
 MSR 0x00000DD0 = 0x00000000:0x00000000 (IA32_LBR_INFO_16)
 MSR 0x00000DD1 = 0x00000000:0x00000000 (IA32_LBR_INFO_17)
 MSR 0x00000DD2 = 0x00000000:0x00000000 (IA32_LBR_INFO_18)
 MSR 0x00000DD3 = 0x00000000:0x00000000 (IA32_LBR_INFO_19)
 MSR 0x00000DD4 = 0x00000000:0x00000000 (IA32_LBR_INFO_20)
 MSR 0x00000DD5 = 0x00000000:0x00000000 (IA32_LBR_INFO_21)
 MSR 0x00000DD6 = 0x00000000:0x00000000 (IA32_LBR_INFO_22)
 MSR 0x00000DD7 = 0x00000000:0x00000000 (IA32_LBR_INFO_23)
 MSR 0x00000DD8 = 0x00000000:0x00000000 (IA32_LBR_INFO_24)
 MSR 0x00000DD9 = 0x00000000:0x00000000 (IA32_LBR_INFO_25)
 MSR 0x00000DDA = 0x00000000:0x00000000 (IA32_LBR_INFO_26)
 MSR 0x00000DDB = 0x00000000:0x00000000 (IA32_LBR_INFO_27)
 MSR 0x00000DDC = 0x00000000:0x00000000 (IA32_LBR_INFO_28)
 MSR 0x00000DDD = 0x00000000:0x00000000 (IA32_LBR_INFO_29)
 MSR 0x00000DDE = 0x00000000:0x00000000 (IA32_LBR_INFO_30)
 MSR 0x00000DDF = 0x00000000:0x00000000 (IA32_LBR_INFO_31)

====================== UNIQUE MSRs  (core 3) ======================
 MSR 0x00000000 = 0x00000000:0x00000FFF (IA32_P5_MC_ADDR)
 MSR 0x00000001 = 0x00000000:0x00000000 (IA32_P5_MC_TYPE)
 MSR 0x00000006 = 0x00000000:0x00000040 (IA32_MONITOR_FILTER_SIZE)
 MSR 0x00000010 = 0x00000285:0x54C6D8DE (IA32_TIME_STAMP_COUNTER)
 MSR 0x0000001B = 0x00000000:0xFEE00C00 (IA32_APIC_BASE)
 MSR 0x00000034 = 0x00000000:0x0000066C (MSR_SMI_COUNT)
 MSR 0x0000003A = 0x00000000:0x00020005 (IA32_FEATURE_CONTROL)
 MSR 0x0000008B = 0x000000DE:0x00000000 (IA32_BIOS_SIGN_ID)
 MSR 0x000000C1 = 0x00000000:0x00000000 (IA32_PMC0)
 MSR 0x000000C2 = 0x00000000:0x00000000 (IA32_PMC1)
 MSR 0x000000C3 = 0x00000000:0x00000000 (IA32_PMC2)
 MSR 0x000000C4 = 0x00000000:0x00000000 (IA32_PMC3)
 MSR 0x000000E2 = 0x00000000:0x1C008007 (MSR_PKG_CST_CONFIG_CONTROL)
 MSR 0x000000E4 = 0x00000000:0x00051814 (MSR_PMG_IO_CAPTURE_BASE)
 MSR 0x000000E7 = 0x0000004A:0xD9FA6B05 (IA32_MPERF)
 MSR 0x000000E8 = 0x00000058:0xB12BD2D8 (IA32_APERF)
 MSR 0x000000FE = 0x00000000:0x00001D0A (IA32_MTRRCAP)
 MSR 0x0000013C = 0x00000000:0x00000001 (MSR_FEATURE_CONFIG)
 MSR 0x00000174 = 0x00000000:0x00000010 (IA32_SYSENTER_CS)
 MSR 0x00000175 = 0xFFFFFE00:0x000A2000 (IA32_SYSENTER_ESP)
 MSR 0x00000176 = 0xFFFFFFFF:0x8B201580 (IA32_SYSENTER_EIP)
 MSR 0x00000179 = 0x00000000:0x00000C0C (IA32_MCG_CAP)
 MSR 0x0000017A = 0x00000000:0x00000000 (IA32_MCG_STATUS)
 MSR 0x00000186 = 0x00000000:0x00000000 (IA32_PERFEVTSEL0)
 MSR 0x00000187 = 0x00000000:0x00000000 (IA32_PERFEVTSEL1)
 MSR 0x00000188 = 0x00000000:0x00000000 (IA32_PERFEVTSEL2)
 MSR 0x00000189 = 0x00000000:0x00000000 (IA32_PERFEVTSEL3)
 MSR 0x00000199 = 0x00000000:0x00000800 (IA32_PERF_CTL)
 MSR 0x0000019A = 0x00000000:0x00000000 (IA32_CLOCK_MODULATION)
 MSR 0x0000019B = 0x00000000:0x00000013 (IA32_THERM_INTERRUPT)
 MSR 0x0000019C = 0x00000000:0x88180802 (IA32_THERM_STATUS)
 MSR 0x000001A0 = 0x00000000:0x00850089 (IA32_MISC_ENABLE)
 MSR 0x000001A4 = 0x00000000:0x00000000 (IA32_MISC_FEATURE_CONTROL)
 MSR 0x000001A6 = 0x00000000:0x00000000 (MSR_OFFCORE_RSP_0)
 MSR 0x000001A7 = 0x00000000:0x00000000 (MSR_OFFCORE_RSP_1)
 MSR 0x000001C8 = 0x00000000:0x00000000 (MSR_LBR_SELECT)
 MSR 0x000001C9 = 0x00000000:0x00000000 (MSR_LASTBRANCH_TOS)
 MSR 0x000001D9 = 0x00000000:0x00000000 (IA32_DEBUGCTL)
 MSR 0x000001DD = 0x00000000:0x00000000 (MSR_LER_FROM_LIP)
 MSR 0x000001DE = 0x00000000:0x00000000 (MSR_LER_TO_LIP)
 MSR 0x000001F2 = 0x00000000:0x9A000006 (IA32_SMRR_PHYSBASE)
 MSR 0x000001F3 = 0x00000000:0xFF000800 (IA32_SMRR_PHYSMASK)
 MSR 0x000001F4 = 0x00000000:0x99F00006 (MSR_PRMRR_PHYS_BASE)
 MSR 0x000001F5 = 0x0000007F:0xFFF00C00 (MSR_PRMRR_PHYS_MASK)
 MSR 0x000001FB = 0x00000000:0x000000E1 (MSR_PRMRR_VALID_CONFIG)
 MSR 0x000001FC = 0x00000000:0x002C005D (MSR_POWER_CTL)
 MSR 0x00000200 = 0x00000000:0xC0000000 (IA32_MTRR_PHYSBASE0)
 MSR 0x00000201 = 0x0000007F:0xC0000800 (IA32_MTRR_PHYSBASE0)
 MSR 0x00000202 = 0x00000000:0xA0000000 (IA32_MTRR_PHYSBASE1)
 MSR 0x00000203 = 0x0000007F:0xE0000800 (IA32_MTRR_PHYSBASE1)
 MSR 0x00000204 = 0x00000000:0x9C000000 (IA32_MTRR_PHYSBASE2)
 MSR 0x00000205 = 0x0000007F:0xFC000800 (IA32_MTRR_PHYSBASE2)
 MSR 0x00000206 = 0x00000000:0x9B000000 (IA32_MTRR_PHYSBASE3)
 MSR 0x00000207 = 0x0000007F:0xFF000800 (IA32_MTRR_PHYSBASE3)
 MSR 0x00000208 = 0x00000020:0x00000000 (IA32_MTRR_PHYSBASE4)
 MSR 0x00000209 = 0x00000060:0x00000800 (IA32_MTRR_PHYSBASE4)
 MSR 0x0000020A = 0x00000010:0x00000000 (IA32_MTRR_PHYSBASE5)
 MSR 0x0000020B = 0x00000070:0x00000800 (IA32_MTRR_PHYSBASE5)
 MSR 0x0000020C = 0x00000040:0x00000000 (IA32_MTRR_PHYSBASE6)
 MSR 0x0000020D = 0x00000040:0x00000800 (IA32_MTRR_PHYSBASE6)
 MSR 0x0000020E = 0x00000004:0x00000006 (IA32_MTRR_PHYSBASE7)
 MSR 0x0000020F = 0x00000000:0x00000000 (IA32_MTRR_PHYSBASE7)
 MSR 0x00000210 = 0x00000008:0x00000006 (IA32_MTRR_PHYSBASE8)
 MSR 0x00000211 = 0x00000000:0x00000000 (IA32_MTRR_PHYSBASE8)
 MSR 0x00000212 = 0x00000000:0x00000000 (IA32_MTRR_PHYSBASE9)
 MSR 0x00000213 = 0x00000000:0x00000000 (IA32_MTRR_PHYSBASE9)
 MSR 0x00000250 = 0x06060606:0x06060606 (IA32_MTRR_FIX64K_00000)
 MSR 0x00000258 = 0x06060606:0x06060606 (IA32_MTRR_FIX16K_80000)
 MSR 0x00000259 = 0x00000000:0x00000000 (IA32_MTRR_FIX16K_A0000)
 MSR 0x00000268 = 0x05050505:0x05050505 (IA32_MTRR_FIX4K_C0000)
 MSR 0x00000269 = 0x05050505:0x05050505 (IA32_MTRR_FIX4K_C8000)
 MSR 0x0000026A = 0x05050505:0x05050505 (IA32_MTRR_FIX4K_D0000)
 MSR 0x0000026B = 0x05050505:0x05050505 (IA32_MTRR_FIX4K_D8000)
 MSR 0x0000026C = 0x05050505:0x05050505 (IA32_MTRR_FIX4K_E0000)
 MSR 0x0000026D = 0x05050505:0x05050505 (IA32_MTRR_FIX4K_E8000)
 MSR 0x0000026E = 0x05050505:0x05050505 (IA32_MTRR_FIX4K_F0000)
 MSR 0x0000026F = 0x05050505:0x05050505 (IA32_MTRR_FIX4K_F8000)
 MSR 0x00000277 = 0x04070506:0x00070106 (IA32_PAT)
 MSR 0x00000280 = 0x00000000:0x40000001 (IA32_MC0_CTL2)
 MSR 0x00000281 = 0x00000000:0x40000001 (IA32_MC1_CTL2)
 MSR 0x00000282 = 0x00000000:0x40000001 (IA32_MC2_CTL2)
 MSR 0x00000283 = 0x00000000:0x40000001 (IA32_MC3_CTL2)
 MSR 0x000002FF = 0x00000000:0x00000C06 (IA32_MTRR_DEF_TYPE)
 MSR 0x00000309 = 0x00000000:0x00000000 (IA32_FIXED_CTR0)
 MSR 0x0000030A = 0x0000FFFE:0x76634842 (IA32_FIXED_CTR1)
 MSR 0x0000030B = 0x00000000:0x00000000 (IA32_FIXED_CTR2)
 MSR 0x00000345 = 0x00000000:0x000033C5 (IA32_PERF_CAPABILITIES)
 MSR 0x0000038D = 0x00000000:0x000000B0 (IA32_FIXED_CTR_CTRL)
 MSR 0x0000038E = 0x00000000:0x00000000 (IA32_PERF_GLOBAL_STATUS)
 MSR 0x0000038F = 0x00000007:0x0000000F (IA32_PERF_GLOBAL_CTRL)
 MSR 0x00000390 = 0x00000000:0x00000000 (IA32_PERF_GLOBAL_STATUS_RESET)
 MSR 0x00000391 = 0x00000000:0x00000000 (IA32_PERF_GLOBAL_STATUS_SET)
 MSR 0x000003F1 = 0x00000000:0x00000000 (MSR_PEBS_ENABLE)
 MSR 0x000003F6 = 0x00000000:0x0000FFFF (MSR_PEBS_LD_LAT)
 MSR 0x000003F7 = 0x00000000:0x00000800 (MSR_PEBS_FRONTEND)
 MSR 0x000003FC = 0x00000002:0x3E20E9D2 (MSR_CORE_C3_RESIDENCY)
 MSR 0x000003FD = 0x00000016:0x274CDBA4 (MSR_CORE_C6_RESIDENCY)
 MSR 0x000003FE = 0x000001A7:0xD2B93300 (MSR_CORE_C7_RESIDENCY)
 MSR 0x00000400 = 0x00000000:0x00000FFF (IA32_MC0_CTL)
 MSR 0x00000401 = 0x00000000:0x00000000 (IA32_MC0_STATUS)
 MSR 0x00000402 = 0x00000000:0x00000000 (IA32_MC0_ADDR)
 MSR 0x00000403 = 0x00000000:0x00000000 (IA32_MC0_MISC)
 MSR 0x00000404 = 0x00000000:0x0000000F (IA32_MC1_CTL)
 MSR 0x00000405 = 0x00000000:0x00000000 (IA32_MC1_STATUS)
 MSR 0x00000406 = 0x00000000:0x00000000 (IA32_MC1_ADDR)
 MSR 0x00000407 = 0x00000000:0x00000000 (IA32_MC1_MISC)
 MSR 0x00000408 = 0x00000000:0x0000000F (IA32_MC2_CTL)
 MSR 0x00000409 = 0x00000000:0x00000000 (IA32_MC2_STATUS)
 MSR 0x0000040A = 0x00000000:0x00000000 (IA32_MC2_ADDR)
 MSR 0x0000040C = 0x00000000:0x0000001F (IA32_MC3_CTL)
 MSR 0x0000040D = 0x00000000:0x00000000 (IA32_MC3_STATUS)
 MSR 0x0000040E = 0x00000000:0x00000000 (IA32_MC3_ADDR)
 MSR 0x00000410 = 0x00000000:0x0000003F (IA32_MC4_CTL)
 MSR 0x00000411 = 0x00000000:0x00000000 (IA32_MC4_STATUS)
 MSR 0x00000480 = 0x00DA0400:0x00000004 (IA32_VMX_BASIC)
 MSR 0x00000481 = 0x0000007F:0x00000016 (IA32_VMX_PINBASED_CTLS)
 MSR 0x00000482 = 0xFFF9FFFE:0x0401E172 (IA32_VMX_PROCBASED_CTLS)
 MSR 0x00000483 = 0x01FFFFFF:0x00036DFF (IA32_VMX_EXIT_CTLS)
 MSR 0x00000484 = 0x0003FFFF:0x000011FF (IA32_VMX_ENTRY_CTLS)
 MSR 0x00000485 = 0x00000000:0x7004C1E7 (IA32_VMX_MISC)
 MSR 0x00000486 = 0x00000000:0x80000021 (IA32_VMX_CR0_FIXED0)
 MSR 0x00000487 = 0x00000000:0xFFFFFFFF (IA32_VMX_CR0_FIXED1)
 MSR 0x00000488 = 0x00000000:0x00002000 (IA32_VMX_CR4_FIXED0)
 MSR 0x00000489 = 0x00000000:0x003727FF (IA32_VMX_CR4_FIXED1)
 MSR 0x0000048A = 0x00000000:0x0000002E (IA32_VMX_VMCS_ENUM)
 MSR 0x0000048B = 0x005FBCFF:0x00000000 (IA32_VMX_PROCBASED_CTLS2)
 MSR 0x0000048C = 0x00000F01:0x06734141 (IA32_VMX_EPT_VPID_ENUM)
 MSR 0x0000048D = 0x0000007F:0x00000016 (IA32_VMX_TRUE_PINBASED_CTLS)
 MSR 0x0000048E = 0xFFF9FFFE:0x04006172 (IA32_VMX_TRUE_PROCBASED_CTLS)
 MSR 0x0000048F = 0x01FFFFFF:0x00036DFB (IA32_VMX_TRUE_EXIT_CTLS)
 MSR 0x00000490 = 0x0003FFFF:0x000011FB (IA32_VMX_TRUE_ENTRY_CTLS)
 MSR 0x000004C1 = 0x00000000:0x00000000 (IA32_A_PMC0)
 MSR 0x000004C2 = 0x00000000:0x00000000 (IA32_A_PMC1)
 MSR 0x000004C3 = 0x00000000:0x00000000 (IA32_A_PMC2)
 MSR 0x000004C4 = 0x00000000:0x00000000 (IA32_A_PMC3)
 MSR 0x00000500 = 0x0000000E:0x00000000 (IA32_SGX_SVN_STATUS)
 MSR 0x00000560 = 0x00000000:0x00000000 (IA32_RTIT_OUTPUT_BASE)
 MSR 0x00000561 = 0x00000000:0x0000007F (IA32_RTIT_OUTPUT_MASK_PTRS)
 MSR 0x00000570 = 0x00000000:0x00000000 (IA32_RTIT_CTL)
 MSR 0x00000571 = 0x00000000:0x00000000 (IA32_RTIT_STATUS)
 MSR 0x00000572 = 0x00000000:0x00000000 (IA32_RTIT_CR3_MATCH)
 MSR 0x00000580 = 0x00000000:0x00000000 (IA32_RTIT_ADDR0_A)
 MSR 0x00000581 = 0x00000000:0x00000000 (IA32_RTIT_ADDR0_B)
 MSR 0x00000582 = 0x00000000:0x00000000 (IA32_RTIT_ADDR1_A)
 MSR 0x00000583 = 0x00000000:0x00000000 (IA32_RTIT_ADDR1_B)
 MSR 0x00000600 = 0xFFFFFE00:0x000B4000 (IA32_DS_AREA)
 MSR 0x0000064E = 0x00000054:0x57FF00E2 (MSR_PPERF)
 MSR 0x00000653 = 0x00000000:0x00000000 (MSR_CORE_HDC_RESIDENCY)
 MSR 0x00000690 = 0x00000000:0x00000000 (MSR_LASTBRANCH_16_FROM_IP)
 MSR 0x00000691 = 0x00000000:0x00000000 (MSR_LASTBRANCH_17_FROM_IP)
 MSR 0x00000692 = 0x00000000:0x00000000 (MSR_LASTBRANCH_18_FROM_IP)
 MSR 0x00000693 = 0x00000000:0x00000000 (MSR_LASTBRANCH_19_FROM_IP)
 MSR 0x00000694 = 0x00000000:0x00000000 (MSR_LASTBRANCH_20_FROM_IP)
 MSR 0x00000695 = 0x00000000:0x00000000 (MSR_LASTBRANCH_21_FROM_IP)
 MSR 0x00000696 = 0x00000000:0x00000000 (MSR_LASTBRANCH_22_FROM_IP)
 MSR 0x00000697 = 0x00000000:0x00000000 (MSR_LASTBRANCH_23_FROM_IP)
 MSR 0x00000698 = 0x00000000:0x00000000 (MSR_LASTBRANCH_24_FROM_IP)
 MSR 0x00000699 = 0x00000000:0x00000000 (MSR_LASTBRANCH_25_FROM_IP)
 MSR 0x0000069A = 0x00000000:0x00000000 (MSR_LASTBRANCH_26_FROM_IP)
 MSR 0x0000069B = 0x00000000:0x00000000 (MSR_LASTBRANCH_27_FROM_IP)
 MSR 0x0000069C = 0x00000000:0x00000000 (MSR_LASTBRANCH_28_FROM_IP)
 MSR 0x0000069D = 0x00000000:0x00000000 (MSR_LASTBRANCH_29_FROM_IP)
 MSR 0x0000069E = 0x00000000:0x00000000 (MSR_LASTBRANCH_30_FROM_IP)
 MSR 0x0000069F = 0x00000000:0x00000000 (MSR_LASTBRANCH_31_FROM_IP)
 MSR 0x000006D0 = 0x00000000:0x00000000 (MSR_LASTBRANCH_16_TO_IP)
 MSR 0x000006D1 = 0x00000000:0x00000000 (MSR_LASTBRANCH_17_TO_IP)
 MSR 0x000006D2 = 0x00000000:0x00000000 (MSR_LASTBRANCH_18_TO_IP)
 MSR 0x000006D3 = 0x00000000:0x00000000 (MSR_LASTBRANCH_19_TO_IP)
 MSR 0x000006D4 = 0x00000000:0x00000000 (MSR_LASTBRANCH_20_TO_IP)
 MSR 0x000006D5 = 0x00000000:0x00000000 (MSR_LASTBRANCH_21_TO_IP)
 MSR 0x000006D6 = 0x00000000:0x00000000 (MSR_LASTBRANCH_22_TO_IP)
 MSR 0x000006D7 = 0x00000000:0x00000000 (MSR_LASTBRANCH_23_TO_IP)
 MSR 0x000006D8 = 0x00000000:0x00000000 (MSR_LASTBRANCH_24_TO_IP)
 MSR 0x000006D9 = 0x00000000:0x00000000 (MSR_LASTBRANCH_25_TO_IP)
 MSR 0x000006DA = 0x00000000:0x00000000 (MSR_LASTBRANCH_26_TO_IP)
 MSR 0x000006DB = 0x00000000:0x00000000 (MSR_LASTBRANCH_27_TO_IP)
 MSR 0x000006DC = 0x00000000:0x00000000 (MSR_LASTBRANCH_28_TO_IP)
 MSR 0x000006DD = 0x00000000:0x00000000 (MSR_LASTBRANCH_29_TO_IP)
 MSR 0x000006DE = 0x00000000:0x00000000 (MSR_LASTBRANCH_30_TO_IP)
 MSR 0x000006DF = 0x00000000:0x00000000 (MSR_LASTBRANCH_31_TO_IP)
 MSR 0x000006E0 = 0x00000285:0x55111B0A (IA32_TSC_DEADLINE)
 MSR 0x00000771 = 0x00000000:0x010A1A2D (IA32_HWP_CAPABILITIES)
 MSR 0x00000773 = 0x00000000:0x00000000 (IA32_HWP_INTERRUPT)
 MSR 0x00000774 = 0x00000000:0x80002D08 (IA32_HWP_REQUEST)
 MSR 0x00000777 = 0x00000000:0x00000000 (IA32_HWP_STATUS)
 MSR 0x00000D90 = 0x00000000:0x00000000 (IA32_BNDCFGS)
 MSR 0x00000DA0 = 0x00000000:0x00000000 (IA32_XSS)
 MSR 0x00000DB1 = 0x00000000:0x00000001 (IA32_PM_CTL1)
 MSR 0x00000DB2 = 0x00000000:0x00000000 (IA32_THREAD_STALL)
 MSR 0x00000DC0 = 0x00000000:0x00000000 (IA32_LBR_INFO_0)
 MSR 0x00000DC1 = 0x00000000:0x00000000 (IA32_LBR_INFO_1)
 MSR 0x00000DC2 = 0x00000000:0x00000000 (IA32_LBR_INFO_2)
 MSR 0x00000DC3 = 0x00000000:0x00000000 (IA32_LBR_INFO_3)
 MSR 0x00000DC4 = 0x00000000:0x00000000 (IA32_LBR_INFO_4)
 MSR 0x00000DC5 = 0x00000000:0x00000000 (IA32_LBR_INFO_5)
 MSR 0x00000DC6 = 0x00000000:0x00000000 (IA32_LBR_INFO_6)
 MSR 0x00000DC7 = 0x00000000:0x00000000 (IA32_LBR_INFO_7)
 MSR 0x00000DC8 = 0x00000000:0x00000000 (IA32_LBR_INFO_8)
 MSR 0x00000DC9 = 0x00000000:0x00000000 (IA32_LBR_INFO_9)
 MSR 0x00000DCA = 0x00000000:0x00000000 (IA32_LBR_INFO_10)
 MSR 0x00000DCB = 0x00000000:0x00000000 (IA32_LBR_INFO_11)
 MSR 0x00000DCC = 0x00000000:0x00000000 (IA32_LBR_INFO_12)
 MSR 0x00000DCD = 0x00000000:0x00000000 (IA32_LBR_INFO_13)
 MSR 0x00000DCE = 0x00000000:0x00000000 (IA32_LBR_INFO_14)
 MSR 0x00000DCF = 0x00000000:0x00000000 (IA32_LBR_INFO_15)
 MSR 0x00000DD0 = 0x00000000:0x00000000 (IA32_LBR_INFO_16)
 MSR 0x00000DD1 = 0x00000000:0x00000000 (IA32_LBR_INFO_17)
 MSR 0x00000DD2 = 0x00000000:0x00000000 (IA32_LBR_INFO_18)
 MSR 0x00000DD3 = 0x00000000:0x00000000 (IA32_LBR_INFO_19)
 MSR 0x00000DD4 = 0x00000000:0x00000000 (IA32_LBR_INFO_20)
 MSR 0x00000DD5 = 0x00000000:0x00000000 (IA32_LBR_INFO_21)
 MSR 0x00000DD6 = 0x00000000:0x00000000 (IA32_LBR_INFO_22)
 MSR 0x00000DD7 = 0x00000000:0x00000000 (IA32_LBR_INFO_23)
 MSR 0x00000DD8 = 0x00000000:0x00000000 (IA32_LBR_INFO_24)
 MSR 0x00000DD9 = 0x00000000:0x00000000 (IA32_LBR_INFO_25)
 MSR 0x00000DDA = 0x00000000:0x00000000 (IA32_LBR_INFO_26)
 MSR 0x00000DDB = 0x00000000:0x00000000 (IA32_LBR_INFO_27)
 MSR 0x00000DDC = 0x00000000:0x00000000 (IA32_LBR_INFO_28)
 MSR 0x00000DDD = 0x00000000:0x00000000 (IA32_LBR_INFO_29)
 MSR 0x00000DDE = 0x00000000:0x00000000 (IA32_LBR_INFO_30)
 MSR 0x00000DDF = 0x00000000:0x00000000 (IA32_LBR_INFO_31)

====================== UNIQUE MSRs  (core 4) ======================
 MSR 0x00000000 = 0x00000000:0x00000FFF (IA32_P5_MC_ADDR)
 MSR 0x00000001 = 0x00000000:0x00000000 (IA32_P5_MC_TYPE)
 MSR 0x00000006 = 0x00000000:0x00000040 (IA32_MONITOR_FILTER_SIZE)
 MSR 0x00000010 = 0x00000285:0x54D31DC4 (IA32_TIME_STAMP_COUNTER)
 MSR 0x0000001B = 0x00000000:0xFEE00C00 (IA32_APIC_BASE)
 MSR 0x00000034 = 0x00000000:0x0000066C (MSR_SMI_COUNT)
 MSR 0x0000003A = 0x00000000:0x00020005 (IA32_FEATURE_CONTROL)
 MSR 0x0000008B = 0x000000DE:0x00000000 (IA32_BIOS_SIGN_ID)
 MSR 0x000000C1 = 0x00000000:0x00000000 (IA32_PMC0)
 MSR 0x000000C2 = 0x00000000:0x00000000 (IA32_PMC1)
 MSR 0x000000C3 = 0x00000000:0x00000000 (IA32_PMC2)
 MSR 0x000000C4 = 0x00000000:0x00000000 (IA32_PMC3)
 MSR 0x000000E2 = 0x00000000:0x1C008007 (MSR_PKG_CST_CONFIG_CONTROL)
 MSR 0x000000E4 = 0x00000000:0x00051814 (MSR_PMG_IO_CAPTURE_BASE)
 MSR 0x000000E7 = 0x00000053:0xF8C61470 (IA32_MPERF)
 MSR 0x000000E8 = 0x00000064:0xD89AE5CF (IA32_APERF)
 MSR 0x000000FE = 0x00000000:0x00001D0A (IA32_MTRRCAP)
 MSR 0x0000013C = 0x00000000:0x00000001 (MSR_FEATURE_CONFIG)
 MSR 0x00000174 = 0x00000000:0x00000010 (IA32_SYSENTER_CS)
 MSR 0x00000175 = 0xFFFFFE00:0x000D7000 (IA32_SYSENTER_ESP)
 MSR 0x00000176 = 0xFFFFFFFF:0x8B201580 (IA32_SYSENTER_EIP)
 MSR 0x00000179 = 0x00000000:0x00000C0C (IA32_MCG_CAP)
 MSR 0x0000017A = 0x00000000:0x00000000 (IA32_MCG_STATUS)
 MSR 0x00000186 = 0x00000000:0x00000000 (IA32_PERFEVTSEL0)
 MSR 0x00000187 = 0x00000000:0x00000000 (IA32_PERFEVTSEL1)
 MSR 0x00000188 = 0x00000000:0x00000000 (IA32_PERFEVTSEL2)
 MSR 0x00000189 = 0x00000000:0x00000000 (IA32_PERFEVTSEL3)
 MSR 0x00000199 = 0x00000000:0x00000800 (IA32_PERF_CTL)
 MSR 0x0000019A = 0x00000000:0x00000000 (IA32_CLOCK_MODULATION)
 MSR 0x0000019B = 0x00000000:0x00000013 (IA32_THERM_INTERRUPT)
 MSR 0x0000019C = 0x00000000:0x88150802 (IA32_THERM_STATUS)
 MSR 0x000001A0 = 0x00000000:0x00850089 (IA32_MISC_ENABLE)
 MSR 0x000001A4 = 0x00000000:0x00000000 (IA32_MISC_FEATURE_CONTROL)
 MSR 0x000001A6 = 0x00000000:0x00000000 (MSR_OFFCORE_RSP_0)
 MSR 0x000001A7 = 0x00000000:0x00000000 (MSR_OFFCORE_RSP_1)
 MSR 0x000001C8 = 0x00000000:0x00000000 (MSR_LBR_SELECT)
 MSR 0x000001C9 = 0x00000000:0x00000000 (MSR_LASTBRANCH_TOS)
 MSR 0x000001D9 = 0x00000000:0x00000000 (IA32_DEBUGCTL)
 MSR 0x000001DD = 0x00000000:0x00000000 (MSR_LER_FROM_LIP)
 MSR 0x000001DE = 0x00000000:0x00000000 (MSR_LER_TO_LIP)
 MSR 0x000001F2 = 0x00000000:0x9A000006 (IA32_SMRR_PHYSBASE)
 MSR 0x000001F3 = 0x00000000:0xFF000800 (IA32_SMRR_PHYSMASK)
 MSR 0x000001F4 = 0x00000000:0x99F00006 (MSR_PRMRR_PHYS_BASE)
 MSR 0x000001F5 = 0x0000007F:0xFFF00C00 (MSR_PRMRR_PHYS_MASK)
 MSR 0x000001FB = 0x00000000:0x000000E1 (MSR_PRMRR_VALID_CONFIG)
 MSR 0x000001FC = 0x00000000:0x002C005D (MSR_POWER_CTL)
 MSR 0x00000200 = 0x00000000:0xC0000000 (IA32_MTRR_PHYSBASE0)
 MSR 0x00000201 = 0x0000007F:0xC0000800 (IA32_MTRR_PHYSBASE0)
 MSR 0x00000202 = 0x00000000:0xA0000000 (IA32_MTRR_PHYSBASE1)
 MSR 0x00000203 = 0x0000007F:0xE0000800 (IA32_MTRR_PHYSBASE1)
 MSR 0x00000204 = 0x00000000:0x9C000000 (IA32_MTRR_PHYSBASE2)
 MSR 0x00000205 = 0x0000007F:0xFC000800 (IA32_MTRR_PHYSBASE2)
 MSR 0x00000206 = 0x00000000:0x9B000000 (IA32_MTRR_PHYSBASE3)
 MSR 0x00000207 = 0x0000007F:0xFF000800 (IA32_MTRR_PHYSBASE3)
 MSR 0x00000208 = 0x00000020:0x00000000 (IA32_MTRR_PHYSBASE4)
 MSR 0x00000209 = 0x00000060:0x00000800 (IA32_MTRR_PHYSBASE4)
 MSR 0x0000020A = 0x00000010:0x00000000 (IA32_MTRR_PHYSBASE5)
 MSR 0x0000020B = 0x00000070:0x00000800 (IA32_MTRR_PHYSBASE5)
 MSR 0x0000020C = 0x00000040:0x00000000 (IA32_MTRR_PHYSBASE6)
 MSR 0x0000020D = 0x00000040:0x00000800 (IA32_MTRR_PHYSBASE6)
 MSR 0x0000020E = 0x00000004:0x00000006 (IA32_MTRR_PHYSBASE7)
 MSR 0x0000020F = 0x00000000:0x00000000 (IA32_MTRR_PHYSBASE7)
 MSR 0x00000210 = 0x00000008:0x00000006 (IA32_MTRR_PHYSBASE8)
 MSR 0x00000211 = 0x00000000:0x00000000 (IA32_MTRR_PHYSBASE8)
 MSR 0x00000212 = 0x00000000:0x00000000 (IA32_MTRR_PHYSBASE9)
 MSR 0x00000213 = 0x00000000:0x00000000 (IA32_MTRR_PHYSBASE9)
 MSR 0x00000250 = 0x06060606:0x06060606 (IA32_MTRR_FIX64K_00000)
 MSR 0x00000258 = 0x06060606:0x06060606 (IA32_MTRR_FIX16K_80000)
 MSR 0x00000259 = 0x00000000:0x00000000 (IA32_MTRR_FIX16K_A0000)
 MSR 0x00000268 = 0x05050505:0x05050505 (IA32_MTRR_FIX4K_C0000)
 MSR 0x00000269 = 0x05050505:0x05050505 (IA32_MTRR_FIX4K_C8000)
 MSR 0x0000026A = 0x05050505:0x05050505 (IA32_MTRR_FIX4K_D0000)
 MSR 0x0000026B = 0x05050505:0x05050505 (IA32_MTRR_FIX4K_D8000)
 MSR 0x0000026C = 0x05050505:0x05050505 (IA32_MTRR_FIX4K_E0000)
 MSR 0x0000026D = 0x05050505:0x05050505 (IA32_MTRR_FIX4K_E8000)
 MSR 0x0000026E = 0x05050505:0x05050505 (IA32_MTRR_FIX4K_F0000)
 MSR 0x0000026F = 0x05050505:0x05050505 (IA32_MTRR_FIX4K_F8000)
 MSR 0x00000277 = 0x04070506:0x00070106 (IA32_PAT)
 MSR 0x00000280 = 0x00000000:0x40000001 (IA32_MC0_CTL2)
 MSR 0x00000281 = 0x00000000:0x40000001 (IA32_MC1_CTL2)
 MSR 0x00000282 = 0x00000000:0x40000001 (IA32_MC2_CTL2)
 MSR 0x00000283 = 0x00000000:0x40000001 (IA32_MC3_CTL2)
 MSR 0x000002FF = 0x00000000:0x00000C06 (IA32_MTRR_DEF_TYPE)
 MSR 0x00000309 = 0x00000000:0x00000000 (IA32_FIXED_CTR0)
 MSR 0x0000030A = 0x0000FFFE:0x81334292 (IA32_FIXED_CTR1)
 MSR 0x0000030B = 0x00000000:0x00000000 (IA32_FIXED_CTR2)
 MSR 0x00000345 = 0x00000000:0x000033C5 (IA32_PERF_CAPABILITIES)
 MSR 0x0000038D = 0x00000000:0x000000B0 (IA32_FIXED_CTR_CTRL)
 MSR 0x0000038E = 0x00000000:0x00000000 (IA32_PERF_GLOBAL_STATUS)
 MSR 0x0000038F = 0x00000007:0x0000000F (IA32_PERF_GLOBAL_CTRL)
 MSR 0x00000390 = 0x00000000:0x00000000 (IA32_PERF_GLOBAL_STATUS_RESET)
 MSR 0x00000391 = 0x00000000:0x00000000 (IA32_PERF_GLOBAL_STATUS_SET)
 MSR 0x000003F1 = 0x00000000:0x00000000 (MSR_PEBS_ENABLE)
 MSR 0x000003F6 = 0x00000000:0x0000FFFF (MSR_PEBS_LD_LAT)
 MSR 0x000003F7 = 0x00000000:0x00000800 (MSR_PEBS_FRONTEND)
 MSR 0x000003FC = 0x00000002:0x29CF361E (MSR_CORE_C3_RESIDENCY)
 MSR 0x000003FD = 0x00000014:0xC29C4894 (MSR_CORE_C6_RESIDENCY)
 MSR 0x000003FE = 0x0000019D:0xDED2CF10 (MSR_CORE_C7_RESIDENCY)
 MSR 0x00000400 = 0x00000000:0x00000FFF (IA32_MC0_CTL)
 MSR 0x00000401 = 0x00000000:0x00000000 (IA32_MC0_STATUS)
 MSR 0x00000402 = 0x00000000:0x00000000 (IA32_MC0_ADDR)
 MSR 0x00000403 = 0x00000000:0x00000000 (IA32_MC0_MISC)
 MSR 0x00000404 = 0x00000000:0x0000000F (IA32_MC1_CTL)
 MSR 0x00000405 = 0x00000000:0x00000000 (IA32_MC1_STATUS)
 MSR 0x00000406 = 0x00000000:0x00000000 (IA32_MC1_ADDR)
 MSR 0x00000407 = 0x00000000:0x00000000 (IA32_MC1_MISC)
 MSR 0x00000408 = 0x00000000:0x0000000F (IA32_MC2_CTL)
 MSR 0x00000409 = 0x00000000:0x00000000 (IA32_MC2_STATUS)
 MSR 0x0000040A = 0x00000000:0x00000000 (IA32_MC2_ADDR)
 MSR 0x0000040C = 0x00000000:0x0000001F (IA32_MC3_CTL)
 MSR 0x0000040D = 0x00000000:0x00000000 (IA32_MC3_STATUS)
 MSR 0x0000040E = 0x00000000:0x00000000 (IA32_MC3_ADDR)
 MSR 0x00000410 = 0x00000000:0x0000003F (IA32_MC4_CTL)
 MSR 0x00000411 = 0x00000000:0x00000000 (IA32_MC4_STATUS)
 MSR 0x00000480 = 0x00DA0400:0x00000004 (IA32_VMX_BASIC)
 MSR 0x00000481 = 0x0000007F:0x00000016 (IA32_VMX_PINBASED_CTLS)
 MSR 0x00000482 = 0xFFF9FFFE:0x0401E172 (IA32_VMX_PROCBASED_CTLS)
 MSR 0x00000483 = 0x01FFFFFF:0x00036DFF (IA32_VMX_EXIT_CTLS)
 MSR 0x00000484 = 0x0003FFFF:0x000011FF (IA32_VMX_ENTRY_CTLS)
 MSR 0x00000485 = 0x00000000:0x7004C1E7 (IA32_VMX_MISC)
 MSR 0x00000486 = 0x00000000:0x80000021 (IA32_VMX_CR0_FIXED0)
 MSR 0x00000487 = 0x00000000:0xFFFFFFFF (IA32_VMX_CR0_FIXED1)
 MSR 0x00000488 = 0x00000000:0x00002000 (IA32_VMX_CR4_FIXED0)
 MSR 0x00000489 = 0x00000000:0x003727FF (IA32_VMX_CR4_FIXED1)
 MSR 0x0000048A = 0x00000000:0x0000002E (IA32_VMX_VMCS_ENUM)
 MSR 0x0000048B = 0x005FBCFF:0x00000000 (IA32_VMX_PROCBASED_CTLS2)
 MSR 0x0000048C = 0x00000F01:0x06734141 (IA32_VMX_EPT_VPID_ENUM)
 MSR 0x0000048D = 0x0000007F:0x00000016 (IA32_VMX_TRUE_PINBASED_CTLS)
 MSR 0x0000048E = 0xFFF9FFFE:0x04006172 (IA32_VMX_TRUE_PROCBASED_CTLS)
 MSR 0x0000048F = 0x01FFFFFF:0x00036DFB (IA32_VMX_TRUE_EXIT_CTLS)
 MSR 0x00000490 = 0x0003FFFF:0x000011FB (IA32_VMX_TRUE_ENTRY_CTLS)
 MSR 0x000004C1 = 0x00000000:0x00000000 (IA32_A_PMC0)
 MSR 0x000004C2 = 0x00000000:0x00000000 (IA32_A_PMC1)
 MSR 0x000004C3 = 0x00000000:0x00000000 (IA32_A_PMC2)
 MSR 0x000004C4 = 0x00000000:0x00000000 (IA32_A_PMC3)
 MSR 0x00000500 = 0x0000000E:0x00000000 (IA32_SGX_SVN_STATUS)
 MSR 0x00000560 = 0x00000000:0x00000000 (IA32_RTIT_OUTPUT_BASE)
 MSR 0x00000561 = 0x00000000:0x0000007F (IA32_RTIT_OUTPUT_MASK_PTRS)
 MSR 0x00000570 = 0x00000000:0x00000000 (IA32_RTIT_CTL)
 MSR 0x00000571 = 0x00000000:0x00000000 (IA32_RTIT_STATUS)
 MSR 0x00000572 = 0x00000000:0x00000000 (IA32_RTIT_CR3_MATCH)
 MSR 0x00000580 = 0x00000000:0x00000000 (IA32_RTIT_ADDR0_A)
 MSR 0x00000581 = 0x00000000:0x00000000 (IA32_RTIT_ADDR0_B)
 MSR 0x00000582 = 0x00000000:0x00000000 (IA32_RTIT_ADDR1_A)
 MSR 0x00000583 = 0x00000000:0x00000000 (IA32_RTIT_ADDR1_B)
 MSR 0x00000600 = 0xFFFFFE00:0x000E9000 (IA32_DS_AREA)
 MSR 0x0000064E = 0x0000005E:0xF8FF41D0 (MSR_PPERF)
 MSR 0x00000653 = 0x00000000:0x00000000 (MSR_CORE_HDC_RESIDENCY)
 MSR 0x00000690 = 0x00000000:0x00000000 (MSR_LASTBRANCH_16_FROM_IP)
 MSR 0x00000691 = 0x00000000:0x00000000 (MSR_LASTBRANCH_17_FROM_IP)
 MSR 0x00000692 = 0x00000000:0x00000000 (MSR_LASTBRANCH_18_FROM_IP)
 MSR 0x00000693 = 0x00000000:0x00000000 (MSR_LASTBRANCH_19_FROM_IP)
 MSR 0x00000694 = 0x00000000:0x00000000 (MSR_LASTBRANCH_20_FROM_IP)
 MSR 0x00000695 = 0x00000000:0x00000000 (MSR_LASTBRANCH_21_FROM_IP)
 MSR 0x00000696 = 0x00000000:0x00000000 (MSR_LASTBRANCH_22_FROM_IP)
 MSR 0x00000697 = 0x00000000:0x00000000 (MSR_LASTBRANCH_23_FROM_IP)
 MSR 0x00000698 = 0x00000000:0x00000000 (MSR_LASTBRANCH_24_FROM_IP)
 MSR 0x00000699 = 0x00000000:0x00000000 (MSR_LASTBRANCH_25_FROM_IP)
 MSR 0x0000069A = 0x00000000:0x00000000 (MSR_LASTBRANCH_26_FROM_IP)
 MSR 0x0000069B = 0x00000000:0x00000000 (MSR_LASTBRANCH_27_FROM_IP)
 MSR 0x0000069C = 0x00000000:0x00000000 (MSR_LASTBRANCH_28_FROM_IP)
 MSR 0x0000069D = 0x00000000:0x00000000 (MSR_LASTBRANCH_29_FROM_IP)
 MSR 0x0000069E = 0x00000000:0x00000000 (MSR_LASTBRANCH_30_FROM_IP)
 MSR 0x0000069F = 0x00000000:0x00000000 (MSR_LASTBRANCH_31_FROM_IP)
 MSR 0x000006D0 = 0x00000000:0x00000000 (MSR_LASTBRANCH_16_TO_IP)
 MSR 0x000006D1 = 0x00000000:0x00000000 (MSR_LASTBRANCH_17_TO_IP)
 MSR 0x000006D2 = 0x00000000:0x00000000 (MSR_LASTBRANCH_18_TO_IP)
 MSR 0x000006D3 = 0x00000000:0x00000000 (MSR_LASTBRANCH_19_TO_IP)
 MSR 0x000006D4 = 0x00000000:0x00000000 (MSR_LASTBRANCH_20_TO_IP)
 MSR 0x000006D5 = 0x00000000:0x00000000 (MSR_LASTBRANCH_21_TO_IP)
 MSR 0x000006D6 = 0x00000000:0x00000000 (MSR_LASTBRANCH_22_TO_IP)
 MSR 0x000006D7 = 0x00000000:0x00000000 (MSR_LASTBRANCH_23_TO_IP)
 MSR 0x000006D8 = 0x00000000:0x00000000 (MSR_LASTBRANCH_24_TO_IP)
 MSR 0x000006D9 = 0x00000000:0x00000000 (MSR_LASTBRANCH_25_TO_IP)
 MSR 0x000006DA = 0x00000000:0x00000000 (MSR_LASTBRANCH_26_TO_IP)
 MSR 0x000006DB = 0x00000000:0x00000000 (MSR_LASTBRANCH_27_TO_IP)
 MSR 0x000006DC = 0x00000000:0x00000000 (MSR_LASTBRANCH_28_TO_IP)
 MSR 0x000006DD = 0x00000000:0x00000000 (MSR_LASTBRANCH_29_TO_IP)
 MSR 0x000006DE = 0x00000000:0x00000000 (MSR_LASTBRANCH_30_TO_IP)
 MSR 0x000006DF = 0x00000000:0x00000000 (MSR_LASTBRANCH_31_TO_IP)
 MSR 0x000006E0 = 0x00000285:0x55111A96 (IA32_TSC_DEADLINE)
 MSR 0x00000771 = 0x00000000:0x010A1A2D (IA32_HWP_CAPABILITIES)
 MSR 0x00000773 = 0x00000000:0x00000000 (IA32_HWP_INTERRUPT)
 MSR 0x00000774 = 0x00000000:0x80002D08 (IA32_HWP_REQUEST)
 MSR 0x00000777 = 0x00000000:0x00000000 (IA32_HWP_STATUS)
 MSR 0x00000D90 = 0x00000000:0x00000000 (IA32_BNDCFGS)
 MSR 0x00000DA0 = 0x00000000:0x00000000 (IA32_XSS)
 MSR 0x00000DB1 = 0x00000000:0x00000001 (IA32_PM_CTL1)
 MSR 0x00000DB2 = 0x00000000:0x00000000 (IA32_THREAD_STALL)
 MSR 0x00000DC0 = 0x00000000:0x00000000 (IA32_LBR_INFO_0)
 MSR 0x00000DC1 = 0x00000000:0x00000000 (IA32_LBR_INFO_1)
 MSR 0x00000DC2 = 0x00000000:0x00000000 (IA32_LBR_INFO_2)
 MSR 0x00000DC3 = 0x00000000:0x00000000 (IA32_LBR_INFO_3)
 MSR 0x00000DC4 = 0x00000000:0x00000000 (IA32_LBR_INFO_4)
 MSR 0x00000DC5 = 0x00000000:0x00000000 (IA32_LBR_INFO_5)
 MSR 0x00000DC6 = 0x00000000:0x00000000 (IA32_LBR_INFO_6)
 MSR 0x00000DC7 = 0x00000000:0x00000000 (IA32_LBR_INFO_7)
 MSR 0x00000DC8 = 0x00000000:0x00000000 (IA32_LBR_INFO_8)
 MSR 0x00000DC9 = 0x00000000:0x00000000 (IA32_LBR_INFO_9)
 MSR 0x00000DCA = 0x00000000:0x00000000 (IA32_LBR_INFO_10)
 MSR 0x00000DCB = 0x00000000:0x00000000 (IA32_LBR_INFO_11)
 MSR 0x00000DCC = 0x00000000:0x00000000 (IA32_LBR_INFO_12)
 MSR 0x00000DCD = 0x00000000:0x00000000 (IA32_LBR_INFO_13)
 MSR 0x00000DCE = 0x00000000:0x00000000 (IA32_LBR_INFO_14)
 MSR 0x00000DCF = 0x00000000:0x00000000 (IA32_LBR_INFO_15)
 MSR 0x00000DD0 = 0x00000000:0x00000000 (IA32_LBR_INFO_16)
 MSR 0x00000DD1 = 0x00000000:0x00000000 (IA32_LBR_INFO_17)
 MSR 0x00000DD2 = 0x00000000:0x00000000 (IA32_LBR_INFO_18)
 MSR 0x00000DD3 = 0x00000000:0x00000000 (IA32_LBR_INFO_19)
 MSR 0x00000DD4 = 0x00000000:0x00000000 (IA32_LBR_INFO_20)
 MSR 0x00000DD5 = 0x00000000:0x00000000 (IA32_LBR_INFO_21)
 MSR 0x00000DD6 = 0x00000000:0x00000000 (IA32_LBR_INFO_22)
 MSR 0x00000DD7 = 0x00000000:0x00000000 (IA32_LBR_INFO_23)
 MSR 0x00000DD8 = 0x00000000:0x00000000 (IA32_LBR_INFO_24)
 MSR 0x00000DD9 = 0x00000000:0x00000000 (IA32_LBR_INFO_25)
 MSR 0x00000DDA = 0x00000000:0x00000000 (IA32_LBR_INFO_26)
 MSR 0x00000DDB = 0x00000000:0x00000000 (IA32_LBR_INFO_27)
 MSR 0x00000DDC = 0x00000000:0x00000000 (IA32_LBR_INFO_28)
 MSR 0x00000DDD = 0x00000000:0x00000000 (IA32_LBR_INFO_29)
 MSR 0x00000DDE = 0x00000000:0x00000000 (IA32_LBR_INFO_30)
 MSR 0x00000DDF = 0x00000000:0x00000000 (IA32_LBR_INFO_31)

====================== UNIQUE MSRs  (core 5) ======================
 MSR 0x00000000 = 0x00000000:0x00000FFF (IA32_P5_MC_ADDR)
 MSR 0x00000001 = 0x00000000:0x00000000 (IA32_P5_MC_TYPE)
 MSR 0x00000006 = 0x00000000:0x00000040 (IA32_MONITOR_FILTER_SIZE)
 MSR 0x00000010 = 0x00000285:0x54F2D8F2 (IA32_TIME_STAMP_COUNTER)
 MSR 0x0000001B = 0x00000000:0xFEE00C00 (IA32_APIC_BASE)
 MSR 0x00000034 = 0x00000000:0x0000066C (MSR_SMI_COUNT)
 MSR 0x0000003A = 0x00000000:0x00020005 (IA32_FEATURE_CONTROL)
 MSR 0x0000008B = 0x000000DE:0x00000000 (IA32_BIOS_SIGN_ID)
 MSR 0x000000C1 = 0x00000000:0x00000000 (IA32_PMC0)
 MSR 0x000000C2 = 0x00000000:0x00000000 (IA32_PMC1)
 MSR 0x000000C3 = 0x00000000:0x00000000 (IA32_PMC2)
 MSR 0x000000C4 = 0x00000000:0x00000000 (IA32_PMC3)
 MSR 0x000000E2 = 0x00000000:0x1C008007 (MSR_PKG_CST_CONFIG_CONTROL)
 MSR 0x000000E4 = 0x00000000:0x00051814 (MSR_PMG_IO_CAPTURE_BASE)
 MSR 0x000000E7 = 0x00000051:0x20EA8E1A (IA32_MPERF)
 MSR 0x000000E8 = 0x00000062:0x75AA22FE (IA32_APERF)
 MSR 0x000000FE = 0x00000000:0x00001D0A (IA32_MTRRCAP)
 MSR 0x0000013C = 0x00000000:0x00000001 (MSR_FEATURE_CONFIG)
 MSR 0x00000174 = 0x00000000:0x00000010 (IA32_SYSENTER_CS)
 MSR 0x00000175 = 0xFFFFFE00:0x0010C000 (IA32_SYSENTER_ESP)
 MSR 0x00000176 = 0xFFFFFFFF:0x8B201580 (IA32_SYSENTER_EIP)
 MSR 0x00000179 = 0x00000000:0x00000C0C (IA32_MCG_CAP)
 MSR 0x0000017A = 0x00000000:0x00000000 (IA32_MCG_STATUS)
 MSR 0x00000186 = 0x00000000:0x00000000 (IA32_PERFEVTSEL0)
 MSR 0x00000187 = 0x00000000:0x00000000 (IA32_PERFEVTSEL1)
 MSR 0x00000188 = 0x00000000:0x00000000 (IA32_PERFEVTSEL2)
 MSR 0x00000189 = 0x00000000:0x00000000 (IA32_PERFEVTSEL3)
 MSR 0x00000199 = 0x00000000:0x00000800 (IA32_PERF_CTL)
 MSR 0x0000019A = 0x00000000:0x00000000 (IA32_CLOCK_MODULATION)
 MSR 0x0000019B = 0x00000000:0x00000013 (IA32_THERM_INTERRUPT)
 MSR 0x0000019C = 0x00000000:0x88140802 (IA32_THERM_STATUS)
 MSR 0x000001A0 = 0x00000000:0x00850089 (IA32_MISC_ENABLE)
 MSR 0x000001A4 = 0x00000000:0x00000000 (IA32_MISC_FEATURE_CONTROL)
 MSR 0x000001A6 = 0x00000000:0x00000000 (MSR_OFFCORE_RSP_0)
 MSR 0x000001A7 = 0x00000000:0x00000000 (MSR_OFFCORE_RSP_1)
 MSR 0x000001C8 = 0x00000000:0x00000000 (MSR_LBR_SELECT)
 MSR 0x000001C9 = 0x00000000:0x00000000 (MSR_LASTBRANCH_TOS)
 MSR 0x000001D9 = 0x00000000:0x00000000 (IA32_DEBUGCTL)
 MSR 0x000001DD = 0x00000000:0x00000000 (MSR_LER_FROM_LIP)
 MSR 0x000001DE = 0x00000000:0x00000000 (MSR_LER_TO_LIP)
 MSR 0x000001F2 = 0x00000000:0x9A000006 (IA32_SMRR_PHYSBASE)
 MSR 0x000001F3 = 0x00000000:0xFF000800 (IA32_SMRR_PHYSMASK)
 MSR 0x000001F4 = 0x00000000:0x99F00006 (MSR_PRMRR_PHYS_BASE)
 MSR 0x000001F5 = 0x0000007F:0xFFF00C00 (MSR_PRMRR_PHYS_MASK)
 MSR 0x000001FB = 0x00000000:0x000000E1 (MSR_PRMRR_VALID_CONFIG)
 MSR 0x000001FC = 0x00000000:0x002C005D (MSR_POWER_CTL)
 MSR 0x00000200 = 0x00000000:0xC0000000 (IA32_MTRR_PHYSBASE0)
 MSR 0x00000201 = 0x0000007F:0xC0000800 (IA32_MTRR_PHYSBASE0)
 MSR 0x00000202 = 0x00000000:0xA0000000 (IA32_MTRR_PHYSBASE1)
 MSR 0x00000203 = 0x0000007F:0xE0000800 (IA32_MTRR_PHYSBASE1)
 MSR 0x00000204 = 0x00000000:0x9C000000 (IA32_MTRR_PHYSBASE2)
 MSR 0x00000205 = 0x0000007F:0xFC000800 (IA32_MTRR_PHYSBASE2)
 MSR 0x00000206 = 0x00000000:0x9B000000 (IA32_MTRR_PHYSBASE3)
 MSR 0x00000207 = 0x0000007F:0xFF000800 (IA32_MTRR_PHYSBASE3)
 MSR 0x00000208 = 0x00000020:0x00000000 (IA32_MTRR_PHYSBASE4)
 MSR 0x00000209 = 0x00000060:0x00000800 (IA32_MTRR_PHYSBASE4)
 MSR 0x0000020A = 0x00000010:0x00000000 (IA32_MTRR_PHYSBASE5)
 MSR 0x0000020B = 0x00000070:0x00000800 (IA32_MTRR_PHYSBASE5)
 MSR 0x0000020C = 0x00000040:0x00000000 (IA32_MTRR_PHYSBASE6)
 MSR 0x0000020D = 0x00000040:0x00000800 (IA32_MTRR_PHYSBASE6)
 MSR 0x0000020E = 0x00000004:0x00000006 (IA32_MTRR_PHYSBASE7)
 MSR 0x0000020F = 0x00000000:0x00000000 (IA32_MTRR_PHYSBASE7)
 MSR 0x00000210 = 0x00000008:0x00000006 (IA32_MTRR_PHYSBASE8)
 MSR 0x00000211 = 0x00000000:0x00000000 (IA32_MTRR_PHYSBASE8)
 MSR 0x00000212 = 0x00000000:0x00000000 (IA32_MTRR_PHYSBASE9)
 MSR 0x00000213 = 0x00000000:0x00000000 (IA32_MTRR_PHYSBASE9)
 MSR 0x00000250 = 0x06060606:0x06060606 (IA32_MTRR_FIX64K_00000)
 MSR 0x00000258 = 0x06060606:0x06060606 (IA32_MTRR_FIX16K_80000)
 MSR 0x00000259 = 0x00000000:0x00000000 (IA32_MTRR_FIX16K_A0000)
 MSR 0x00000268 = 0x05050505:0x05050505 (IA32_MTRR_FIX4K_C0000)
 MSR 0x00000269 = 0x05050505:0x05050505 (IA32_MTRR_FIX4K_C8000)
 MSR 0x0000026A = 0x05050505:0x05050505 (IA32_MTRR_FIX4K_D0000)
 MSR 0x0000026B = 0x05050505:0x05050505 (IA32_MTRR_FIX4K_D8000)
 MSR 0x0000026C = 0x05050505:0x05050505 (IA32_MTRR_FIX4K_E0000)
 MSR 0x0000026D = 0x05050505:0x05050505 (IA32_MTRR_FIX4K_E8000)
 MSR 0x0000026E = 0x05050505:0x05050505 (IA32_MTRR_FIX4K_F0000)
 MSR 0x0000026F = 0x05050505:0x05050505 (IA32_MTRR_FIX4K_F8000)
 MSR 0x00000277 = 0x04070506:0x00070106 (IA32_PAT)
 MSR 0x00000280 = 0x00000000:0x40000001 (IA32_MC0_CTL2)
 MSR 0x00000281 = 0x00000000:0x40000001 (IA32_MC1_CTL2)
 MSR 0x00000282 = 0x00000000:0x40000001 (IA32_MC2_CTL2)
 MSR 0x00000283 = 0x00000000:0x40000001 (IA32_MC3_CTL2)
 MSR 0x000002FF = 0x00000000:0x00000C06 (IA32_MTRR_DEF_TYPE)
 MSR 0x00000309 = 0x00000000:0x00000000 (IA32_FIXED_CTR0)
 MSR 0x0000030A = 0x0000FFFC:0x121DCA91 (IA32_FIXED_CTR1)
 MSR 0x0000030B = 0x00000000:0x00000000 (IA32_FIXED_CTR2)
 MSR 0x00000345 = 0x00000000:0x000033C5 (IA32_PERF_CAPABILITIES)
 MSR 0x0000038D = 0x00000000:0x000000B0 (IA32_FIXED_CTR_CTRL)
 MSR 0x0000038E = 0x00000000:0x00000000 (IA32_PERF_GLOBAL_STATUS)
 MSR 0x0000038F = 0x00000007:0x0000000F (IA32_PERF_GLOBAL_CTRL)
 MSR 0x00000390 = 0x00000000:0x00000000 (IA32_PERF_GLOBAL_STATUS_RESET)
 MSR 0x00000391 = 0x00000000:0x00000000 (IA32_PERF_GLOBAL_STATUS_SET)
 MSR 0x000003F1 = 0x00000000:0x00000000 (MSR_PEBS_ENABLE)
 MSR 0x000003F6 = 0x00000000:0x0000FFFF (MSR_PEBS_LD_LAT)
 MSR 0x000003F7 = 0x00000000:0x00000800 (MSR_PEBS_FRONTEND)
 MSR 0x000003FC = 0x00000002:0x09EECCA6 (MSR_CORE_C3_RESIDENCY)
 MSR 0x000003FD = 0x00000013:0x8932C838 (MSR_CORE_C6_RESIDENCY)
 MSR 0x000003FE = 0x000001A0:0x3F98A156 (MSR_CORE_C7_RESIDENCY)
 MSR 0x00000400 = 0x00000000:0x00000FFF (IA32_MC0_CTL)
 MSR 0x00000401 = 0x00000000:0x00000000 (IA32_MC0_STATUS)
 MSR 0x00000402 = 0x00000000:0x00000000 (IA32_MC0_ADDR)
 MSR 0x00000403 = 0x00000000:0x00000000 (IA32_MC0_MISC)
 MSR 0x00000404 = 0x00000000:0x0000000F (IA32_MC1_CTL)
 MSR 0x00000405 = 0x00000000:0x00000000 (IA32_MC1_STATUS)
 MSR 0x00000406 = 0x00000000:0x00000000 (IA32_MC1_ADDR)
 MSR 0x00000407 = 0x00000000:0x00000000 (IA32_MC1_MISC)
 MSR 0x00000408 = 0x00000000:0x0000000F (IA32_MC2_CTL)
 MSR 0x00000409 = 0x00000000:0x00000000 (IA32_MC2_STATUS)
 MSR 0x0000040A = 0x00000000:0x00000000 (IA32_MC2_ADDR)
 MSR 0x0000040C = 0x00000000:0x0000001F (IA32_MC3_CTL)
 MSR 0x0000040D = 0x00000000:0x00000000 (IA32_MC3_STATUS)
 MSR 0x0000040E = 0x00000000:0x00000000 (IA32_MC3_ADDR)
 MSR 0x00000410 = 0x00000000:0x0000003F (IA32_MC4_CTL)
 MSR 0x00000411 = 0x00000000:0x00000000 (IA32_MC4_STATUS)
 MSR 0x00000480 = 0x00DA0400:0x00000004 (IA32_VMX_BASIC)
 MSR 0x00000481 = 0x0000007F:0x00000016 (IA32_VMX_PINBASED_CTLS)
 MSR 0x00000482 = 0xFFF9FFFE:0x0401E172 (IA32_VMX_PROCBASED_CTLS)
 MSR 0x00000483 = 0x01FFFFFF:0x00036DFF (IA32_VMX_EXIT_CTLS)
 MSR 0x00000484 = 0x0003FFFF:0x000011FF (IA32_VMX_ENTRY_CTLS)
 MSR 0x00000485 = 0x00000000:0x7004C1E7 (IA32_VMX_MISC)
 MSR 0x00000486 = 0x00000000:0x80000021 (IA32_VMX_CR0_FIXED0)
 MSR 0x00000487 = 0x00000000:0xFFFFFFFF (IA32_VMX_CR0_FIXED1)
 MSR 0x00000488 = 0x00000000:0x00002000 (IA32_VMX_CR4_FIXED0)
 MSR 0x00000489 = 0x00000000:0x003727FF (IA32_VMX_CR4_FIXED1)
 MSR 0x0000048A = 0x00000000:0x0000002E (IA32_VMX_VMCS_ENUM)
 MSR 0x0000048B = 0x005FBCFF:0x00000000 (IA32_VMX_PROCBASED_CTLS2)
 MSR 0x0000048C = 0x00000F01:0x06734141 (IA32_VMX_EPT_VPID_ENUM)
 MSR 0x0000048D = 0x0000007F:0x00000016 (IA32_VMX_TRUE_PINBASED_CTLS)
 MSR 0x0000048E = 0xFFF9FFFE:0x04006172 (IA32_VMX_TRUE_PROCBASED_CTLS)
 MSR 0x0000048F = 0x01FFFFFF:0x00036DFB (IA32_VMX_TRUE_EXIT_CTLS)
 MSR 0x00000490 = 0x0003FFFF:0x000011FB (IA32_VMX_TRUE_ENTRY_CTLS)
 MSR 0x000004C1 = 0x00000000:0x00000000 (IA32_A_PMC0)
 MSR 0x000004C2 = 0x00000000:0x00000000 (IA32_A_PMC1)
 MSR 0x000004C3 = 0x00000000:0x00000000 (IA32_A_PMC2)
 MSR 0x000004C4 = 0x00000000:0x00000000 (IA32_A_PMC3)
 MSR 0x00000500 = 0x0000000E:0x00000000 (IA32_SGX_SVN_STATUS)
 MSR 0x00000560 = 0x00000000:0x00000000 (IA32_RTIT_OUTPUT_BASE)
 MSR 0x00000561 = 0x00000000:0x0000007F (IA32_RTIT_OUTPUT_MASK_PTRS)
 MSR 0x00000570 = 0x00000000:0x00000000 (IA32_RTIT_CTL)
 MSR 0x00000571 = 0x00000000:0x00000000 (IA32_RTIT_STATUS)
 MSR 0x00000572 = 0x00000000:0x00000000 (IA32_RTIT_CR3_MATCH)
 MSR 0x00000580 = 0x00000000:0x00000000 (IA32_RTIT_ADDR0_A)
 MSR 0x00000581 = 0x00000000:0x00000000 (IA32_RTIT_ADDR0_B)
 MSR 0x00000582 = 0x00000000:0x00000000 (IA32_RTIT_ADDR1_A)
 MSR 0x00000583 = 0x00000000:0x00000000 (IA32_RTIT_ADDR1_B)
 MSR 0x00000600 = 0xFFFFFE00:0x0011E000 (IA32_DS_AREA)
 MSR 0x0000064E = 0x0000005D:0xB87C351A (MSR_PPERF)
 MSR 0x00000653 = 0x00000000:0x00000000 (MSR_CORE_HDC_RESIDENCY)
 MSR 0x00000690 = 0x00000000:0x00000000 (MSR_LASTBRANCH_16_FROM_IP)
 MSR 0x00000691 = 0x00000000:0x00000000 (MSR_LASTBRANCH_17_FROM_IP)
 MSR 0x00000692 = 0x00000000:0x00000000 (MSR_LASTBRANCH_18_FROM_IP)
 MSR 0x00000693 = 0x00000000:0x00000000 (MSR_LASTBRANCH_19_FROM_IP)
 MSR 0x00000694 = 0x00000000:0x00000000 (MSR_LASTBRANCH_20_FROM_IP)
 MSR 0x00000695 = 0x00000000:0x00000000 (MSR_LASTBRANCH_21_FROM_IP)
 MSR 0x00000696 = 0x00000000:0x00000000 (MSR_LASTBRANCH_22_FROM_IP)
 MSR 0x00000697 = 0x00000000:0x00000000 (MSR_LASTBRANCH_23_FROM_IP)
 MSR 0x00000698 = 0x00000000:0x00000000 (MSR_LASTBRANCH_24_FROM_IP)
 MSR 0x00000699 = 0x00000000:0x00000000 (MSR_LASTBRANCH_25_FROM_IP)
 MSR 0x0000069A = 0x00000000:0x00000000 (MSR_LASTBRANCH_26_FROM_IP)
 MSR 0x0000069B = 0x00000000:0x00000000 (MSR_LASTBRANCH_27_FROM_IP)
 MSR 0x0000069C = 0x00000000:0x00000000 (MSR_LASTBRANCH_28_FROM_IP)
 MSR 0x0000069D = 0x00000000:0x00000000 (MSR_LASTBRANCH_29_FROM_IP)
 MSR 0x0000069E = 0x00000000:0x00000000 (MSR_LASTBRANCH_30_FROM_IP)
 MSR 0x0000069F = 0x00000000:0x00000000 (MSR_LASTBRANCH_31_FROM_IP)
 MSR 0x000006D0 = 0x00000000:0x00000000 (MSR_LASTBRANCH_16_TO_IP)
 MSR 0x000006D1 = 0x00000000:0x00000000 (MSR_LASTBRANCH_17_TO_IP)
 MSR 0x000006D2 = 0x00000000:0x00000000 (MSR_LASTBRANCH_18_TO_IP)
 MSR 0x000006D3 = 0x00000000:0x00000000 (MSR_LASTBRANCH_19_TO_IP)
 MSR 0x000006D4 = 0x00000000:0x00000000 (MSR_LASTBRANCH_20_TO_IP)
 MSR 0x000006D5 = 0x00000000:0x00000000 (MSR_LASTBRANCH_21_TO_IP)
 MSR 0x000006D6 = 0x00000000:0x00000000 (MSR_LASTBRANCH_22_TO_IP)
 MSR 0x000006D7 = 0x00000000:0x00000000 (MSR_LASTBRANCH_23_TO_IP)
 MSR 0x000006D8 = 0x00000000:0x00000000 (MSR_LASTBRANCH_24_TO_IP)
 MSR 0x000006D9 = 0x00000000:0x00000000 (MSR_LASTBRANCH_25_TO_IP)
 MSR 0x000006DA = 0x00000000:0x00000000 (MSR_LASTBRANCH_26_TO_IP)
 MSR 0x000006DB = 0x00000000:0x00000000 (MSR_LASTBRANCH_27_TO_IP)
 MSR 0x000006DC = 0x00000000:0x00000000 (MSR_LASTBRANCH_28_TO_IP)
 MSR 0x000006DD = 0x00000000:0x00000000 (MSR_LASTBRANCH_29_TO_IP)
 MSR 0x000006DE = 0x00000000:0x00000000 (MSR_LASTBRANCH_30_TO_IP)
 MSR 0x000006DF = 0x00000000:0x00000000 (MSR_LASTBRANCH_31_TO_IP)
 MSR 0x000006E0 = 0x00000285:0x55111B14 (IA32_TSC_DEADLINE)
 MSR 0x00000771 = 0x00000000:0x010B1A2D (IA32_HWP_CAPABILITIES)
 MSR 0x00000773 = 0x00000000:0x00000000 (IA32_HWP_INTERRUPT)
 MSR 0x00000774 = 0x00000000:0x80002D08 (IA32_HWP_REQUEST)
 MSR 0x00000777 = 0x00000000:0x00000000 (IA32_HWP_STATUS)
 MSR 0x00000D90 = 0x00000000:0x00000000 (IA32_BNDCFGS)
 MSR 0x00000DA0 = 0x00000000:0x00000000 (IA32_XSS)
 MSR 0x00000DB1 = 0x00000000:0x00000001 (IA32_PM_CTL1)
 MSR 0x00000DB2 = 0x00000000:0x00000000 (IA32_THREAD_STALL)
 MSR 0x00000DC0 = 0x00000000:0x00000000 (IA32_LBR_INFO_0)
 MSR 0x00000DC1 = 0x00000000:0x00000000 (IA32_LBR_INFO_1)
 MSR 0x00000DC2 = 0x00000000:0x00000000 (IA32_LBR_INFO_2)
 MSR 0x00000DC3 = 0x00000000:0x00000000 (IA32_LBR_INFO_3)
 MSR 0x00000DC4 = 0x00000000:0x00000000 (IA32_LBR_INFO_4)
 MSR 0x00000DC5 = 0x00000000:0x00000000 (IA32_LBR_INFO_5)
 MSR 0x00000DC6 = 0x00000000:0x00000000 (IA32_LBR_INFO_6)
 MSR 0x00000DC7 = 0x00000000:0x00000000 (IA32_LBR_INFO_7)
 MSR 0x00000DC8 = 0x00000000:0x00000000 (IA32_LBR_INFO_8)
 MSR 0x00000DC9 = 0x00000000:0x00000000 (IA32_LBR_INFO_9)
 MSR 0x00000DCA = 0x00000000:0x00000000 (IA32_LBR_INFO_10)
 MSR 0x00000DCB = 0x00000000:0x00000000 (IA32_LBR_INFO_11)
 MSR 0x00000DCC = 0x00000000:0x00000000 (IA32_LBR_INFO_12)
 MSR 0x00000DCD = 0x00000000:0x00000000 (IA32_LBR_INFO_13)
 MSR 0x00000DCE = 0x00000000:0x00000000 (IA32_LBR_INFO_14)
 MSR 0x00000DCF = 0x00000000:0x00000000 (IA32_LBR_INFO_15)
 MSR 0x00000DD0 = 0x00000000:0x00000000 (IA32_LBR_INFO_16)
 MSR 0x00000DD1 = 0x00000000:0x00000000 (IA32_LBR_INFO_17)
 MSR 0x00000DD2 = 0x00000000:0x00000000 (IA32_LBR_INFO_18)
 MSR 0x00000DD3 = 0x00000000:0x00000000 (IA32_LBR_INFO_19)
 MSR 0x00000DD4 = 0x00000000:0x00000000 (IA32_LBR_INFO_20)
 MSR 0x00000DD5 = 0x00000000:0x00000000 (IA32_LBR_INFO_21)
 MSR 0x00000DD6 = 0x00000000:0x00000000 (IA32_LBR_INFO_22)
 MSR 0x00000DD7 = 0x00000000:0x00000000 (IA32_LBR_INFO_23)
 MSR 0x00000DD8 = 0x00000000:0x00000000 (IA32_LBR_INFO_24)
 MSR 0x00000DD9 = 0x00000000:0x00000000 (IA32_LBR_INFO_25)
 MSR 0x00000DDA = 0x00000000:0x00000000 (IA32_LBR_INFO_26)
 MSR 0x00000DDB = 0x00000000:0x00000000 (IA32_LBR_INFO_27)
 MSR 0x00000DDC = 0x00000000:0x00000000 (IA32_LBR_INFO_28)
 MSR 0x00000DDD = 0x00000000:0x00000000 (IA32_LBR_INFO_29)
 MSR 0x00000DDE = 0x00000000:0x00000000 (IA32_LBR_INFO_30)
 MSR 0x00000DDF = 0x00000000:0x00000000 (IA32_LBR_INFO_31)

====================== UNIQUE MSRs  (core 6) ======================
 MSR 0x00000000 = 0x00000000:0x00000FFF (IA32_P5_MC_ADDR)
 MSR 0x00000001 = 0x00000000:0x00000000 (IA32_P5_MC_TYPE)
 MSR 0x00000006 = 0x00000000:0x00000040 (IA32_MONITOR_FILTER_SIZE)
 MSR 0x00000010 = 0x00000285:0x5514BCA4 (IA32_TIME_STAMP_COUNTER)
 MSR 0x0000001B = 0x00000000:0xFEE00C00 (IA32_APIC_BASE)
 MSR 0x00000034 = 0x00000000:0x0000066C (MSR_SMI_COUNT)
 MSR 0x0000003A = 0x00000000:0x00020005 (IA32_FEATURE_CONTROL)
 MSR 0x0000008B = 0x000000DE:0x00000000 (IA32_BIOS_SIGN_ID)
 MSR 0x000000C1 = 0x00000000:0x00000000 (IA32_PMC0)
 MSR 0x000000C2 = 0x00000000:0x00000000 (IA32_PMC1)
 MSR 0x000000C3 = 0x00000000:0x00000000 (IA32_PMC2)
 MSR 0x000000C4 = 0x00000000:0x00000000 (IA32_PMC3)
 MSR 0x000000E2 = 0x00000000:0x1C008007 (MSR_PKG_CST_CONFIG_CONTROL)
 MSR 0x000000E4 = 0x00000000:0x00051814 (MSR_PMG_IO_CAPTURE_BASE)
 MSR 0x000000E7 = 0x00000035:0xAE2D65C0 (IA32_MPERF)
 MSR 0x000000E8 = 0x0000003C:0x58958E9F (IA32_APERF)
 MSR 0x000000FE = 0x00000000:0x00001D0A (IA32_MTRRCAP)
 MSR 0x0000013C = 0x00000000:0x00000001 (MSR_FEATURE_CONFIG)
 MSR 0x00000174 = 0x00000000:0x00000010 (IA32_SYSENTER_CS)
 MSR 0x00000175 = 0xFFFFFE00:0x00141000 (IA32_SYSENTER_ESP)
 MSR 0x00000176 = 0xFFFFFFFF:0x8B201580 (IA32_SYSENTER_EIP)
 MSR 0x00000179 = 0x00000000:0x00000C0C (IA32_MCG_CAP)
 MSR 0x0000017A = 0x00000000:0x00000000 (IA32_MCG_STATUS)
 MSR 0x00000186 = 0x00000000:0x00000000 (IA32_PERFEVTSEL0)
 MSR 0x00000187 = 0x00000000:0x00000000 (IA32_PERFEVTSEL1)
 MSR 0x00000188 = 0x00000000:0x00000000 (IA32_PERFEVTSEL2)
 MSR 0x00000189 = 0x00000000:0x00000000 (IA32_PERFEVTSEL3)
 MSR 0x00000199 = 0x00000000:0x00000800 (IA32_PERF_CTL)
 MSR 0x0000019A = 0x00000000:0x00000000 (IA32_CLOCK_MODULATION)
 MSR 0x0000019B = 0x00000000:0x00000013 (IA32_THERM_INTERRUPT)
 MSR 0x0000019C = 0x00000000:0x881E0802 (IA32_THERM_STATUS)
 MSR 0x000001A0 = 0x00000000:0x00850089 (IA32_MISC_ENABLE)
 MSR 0x000001A4 = 0x00000000:0x00000000 (IA32_MISC_FEATURE_CONTROL)
 MSR 0x000001A6 = 0x00000000:0x00000000 (MSR_OFFCORE_RSP_0)
 MSR 0x000001A7 = 0x00000000:0x00000000 (MSR_OFFCORE_RSP_1)
 MSR 0x000001C8 = 0x00000000:0x00000000 (MSR_LBR_SELECT)
 MSR 0x000001C9 = 0x00000000:0x00000000 (MSR_LASTBRANCH_TOS)
 MSR 0x000001D9 = 0x00000000:0x00000000 (IA32_DEBUGCTL)
 MSR 0x000001DD = 0x00000000:0x00000000 (MSR_LER_FROM_LIP)
 MSR 0x000001DE = 0x00000000:0x00000000 (MSR_LER_TO_LIP)
 MSR 0x000001F2 = 0x00000000:0x9A000006 (IA32_SMRR_PHYSBASE)
 MSR 0x000001F3 = 0x00000000:0xFF000800 (IA32_SMRR_PHYSMASK)
 MSR 0x000001F4 = 0x00000000:0x99F00006 (MSR_PRMRR_PHYS_BASE)
 MSR 0x000001F5 = 0x0000007F:0xFFF00C00 (MSR_PRMRR_PHYS_MASK)
 MSR 0x000001FB = 0x00000000:0x000000E1 (MSR_PRMRR_VALID_CONFIG)
 MSR 0x000001FC = 0x00000000:0x002C005D (MSR_POWER_CTL)
 MSR 0x00000200 = 0x00000000:0xC0000000 (IA32_MTRR_PHYSBASE0)
 MSR 0x00000201 = 0x0000007F:0xC0000800 (IA32_MTRR_PHYSBASE0)
 MSR 0x00000202 = 0x00000000:0xA0000000 (IA32_MTRR_PHYSBASE1)
 MSR 0x00000203 = 0x0000007F:0xE0000800 (IA32_MTRR_PHYSBASE1)
 MSR 0x00000204 = 0x00000000:0x9C000000 (IA32_MTRR_PHYSBASE2)
 MSR 0x00000205 = 0x0000007F:0xFC000800 (IA32_MTRR_PHYSBASE2)
 MSR 0x00000206 = 0x00000000:0x9B000000 (IA32_MTRR_PHYSBASE3)
 MSR 0x00000207 = 0x0000007F:0xFF000800 (IA32_MTRR_PHYSBASE3)
 MSR 0x00000208 = 0x00000020:0x00000000 (IA32_MTRR_PHYSBASE4)
 MSR 0x00000209 = 0x00000060:0x00000800 (IA32_MTRR_PHYSBASE4)
 MSR 0x0000020A = 0x00000010:0x00000000 (IA32_MTRR_PHYSBASE5)
 MSR 0x0000020B = 0x00000070:0x00000800 (IA32_MTRR_PHYSBASE5)
 MSR 0x0000020C = 0x00000040:0x00000000 (IA32_MTRR_PHYSBASE6)
 MSR 0x0000020D = 0x00000040:0x00000800 (IA32_MTRR_PHYSBASE6)
 MSR 0x0000020E = 0x00000004:0x00000006 (IA32_MTRR_PHYSBASE7)
 MSR 0x0000020F = 0x00000000:0x00000000 (IA32_MTRR_PHYSBASE7)
 MSR 0x00000210 = 0x00000008:0x00000006 (IA32_MTRR_PHYSBASE8)
 MSR 0x00000211 = 0x00000000:0x00000000 (IA32_MTRR_PHYSBASE8)
 MSR 0x00000212 = 0x00000000:0x00000000 (IA32_MTRR_PHYSBASE9)
 MSR 0x00000213 = 0x00000000:0x00000000 (IA32_MTRR_PHYSBASE9)
 MSR 0x00000250 = 0x06060606:0x06060606 (IA32_MTRR_FIX64K_00000)
 MSR 0x00000258 = 0x06060606:0x06060606 (IA32_MTRR_FIX16K_80000)
 MSR 0x00000259 = 0x00000000:0x00000000 (IA32_MTRR_FIX16K_A0000)
 MSR 0x00000268 = 0x05050505:0x05050505 (IA32_MTRR_FIX4K_C0000)
 MSR 0x00000269 = 0x05050505:0x05050505 (IA32_MTRR_FIX4K_C8000)
 MSR 0x0000026A = 0x05050505:0x05050505 (IA32_MTRR_FIX4K_D0000)
 MSR 0x0000026B = 0x05050505:0x05050505 (IA32_MTRR_FIX4K_D8000)
 MSR 0x0000026C = 0x05050505:0x05050505 (IA32_MTRR_FIX4K_E0000)
 MSR 0x0000026D = 0x05050505:0x05050505 (IA32_MTRR_FIX4K_E8000)
 MSR 0x0000026E = 0x05050505:0x05050505 (IA32_MTRR_FIX4K_F0000)
 MSR 0x0000026F = 0x05050505:0x05050505 (IA32_MTRR_FIX4K_F8000)
 MSR 0x00000277 = 0x04070506:0x00070106 (IA32_PAT)
 MSR 0x00000280 = 0x00000000:0x40000001 (IA32_MC0_CTL2)
 MSR 0x00000281 = 0x00000000:0x40000001 (IA32_MC1_CTL2)
 MSR 0x00000282 = 0x00000000:0x40000001 (IA32_MC2_CTL2)
 MSR 0x00000283 = 0x00000000:0x40000001 (IA32_MC3_CTL2)
 MSR 0x000002FF = 0x00000000:0x00000C06 (IA32_MTRR_DEF_TYPE)
 MSR 0x00000309 = 0x00000000:0x00000000 (IA32_FIXED_CTR0)
 MSR 0x0000030A = 0x0000FFFA:0x23A9942F (IA32_FIXED_CTR1)
 MSR 0x0000030B = 0x00000000:0x00000000 (IA32_FIXED_CTR2)
 MSR 0x00000345 = 0x00000000:0x000033C5 (IA32_PERF_CAPABILITIES)
 MSR 0x0000038D = 0x00000000:0x000000B0 (IA32_FIXED_CTR_CTRL)
 MSR 0x0000038E = 0x00000000:0x00000000 (IA32_PERF_GLOBAL_STATUS)
 MSR 0x0000038F = 0x00000007:0x0000000F (IA32_PERF_GLOBAL_CTRL)
 MSR 0x00000390 = 0x00000000:0x00000000 (IA32_PERF_GLOBAL_STATUS_RESET)
 MSR 0x00000391 = 0x00000000:0x00000000 (IA32_PERF_GLOBAL_STATUS_SET)
 MSR 0x000003F1 = 0x00000000:0x00000000 (MSR_PEBS_ENABLE)
 MSR 0x000003F6 = 0x00000000:0x0000FFFF (MSR_PEBS_LD_LAT)
 MSR 0x000003F7 = 0x00000000:0x00000800 (MSR_PEBS_FRONTEND)
 MSR 0x000003FC = 0x00000002:0x406CB894 (MSR_CORE_C3_RESIDENCY)
 MSR 0x000003FD = 0x0000001D:0x6E36FE36 (MSR_CORE_C6_RESIDENCY)
 MSR 0x000003FE = 0x00000196:0x68D1414A (MSR_CORE_C7_RESIDENCY)
 MSR 0x00000400 = 0x00000000:0x00000FFF (IA32_MC0_CTL)
 MSR 0x00000401 = 0x00000000:0x00000000 (IA32_MC0_STATUS)
 MSR 0x00000402 = 0x00000000:0x00000000 (IA32_MC0_ADDR)
 MSR 0x00000403 = 0x00000000:0x00000000 (IA32_MC0_MISC)
 MSR 0x00000404 = 0x00000000:0x0000000F (IA32_MC1_CTL)
 MSR 0x00000405 = 0x00000000:0x00000000 (IA32_MC1_STATUS)
 MSR 0x00000406 = 0x00000000:0x00000000 (IA32_MC1_ADDR)
 MSR 0x00000407 = 0x00000000:0x00000000 (IA32_MC1_MISC)
 MSR 0x00000408 = 0x00000000:0x0000000F (IA32_MC2_CTL)
 MSR 0x00000409 = 0x00000000:0x00000000 (IA32_MC2_STATUS)
 MSR 0x0000040A = 0x00000000:0x00000000 (IA32_MC2_ADDR)
 MSR 0x0000040C = 0x00000000:0x0000001F (IA32_MC3_CTL)
 MSR 0x0000040D = 0x00000000:0x00000000 (IA32_MC3_STATUS)
 MSR 0x0000040E = 0x00000000:0x00000000 (IA32_MC3_ADDR)
 MSR 0x00000410 = 0x00000000:0x0000003F (IA32_MC4_CTL)
 MSR 0x00000411 = 0x00000000:0x00000000 (IA32_MC4_STATUS)
 MSR 0x00000480 = 0x00DA0400:0x00000004 (IA32_VMX_BASIC)
 MSR 0x00000481 = 0x0000007F:0x00000016 (IA32_VMX_PINBASED_CTLS)
 MSR 0x00000482 = 0xFFF9FFFE:0x0401E172 (IA32_VMX_PROCBASED_CTLS)
 MSR 0x00000483 = 0x01FFFFFF:0x00036DFF (IA32_VMX_EXIT_CTLS)
 MSR 0x00000484 = 0x0003FFFF:0x000011FF (IA32_VMX_ENTRY_CTLS)
 MSR 0x00000485 = 0x00000000:0x7004C1E7 (IA32_VMX_MISC)
 MSR 0x00000486 = 0x00000000:0x80000021 (IA32_VMX_CR0_FIXED0)
 MSR 0x00000487 = 0x00000000:0xFFFFFFFF (IA32_VMX_CR0_FIXED1)
 MSR 0x00000488 = 0x00000000:0x00002000 (IA32_VMX_CR4_FIXED0)
 MSR 0x00000489 = 0x00000000:0x003727FF (IA32_VMX_CR4_FIXED1)
 MSR 0x0000048A = 0x00000000:0x0000002E (IA32_VMX_VMCS_ENUM)
 MSR 0x0000048B = 0x005FBCFF:0x00000000 (IA32_VMX_PROCBASED_CTLS2)
 MSR 0x0000048C = 0x00000F01:0x06734141 (IA32_VMX_EPT_VPID_ENUM)
 MSR 0x0000048D = 0x0000007F:0x00000016 (IA32_VMX_TRUE_PINBASED_CTLS)
 MSR 0x0000048E = 0xFFF9FFFE:0x04006172 (IA32_VMX_TRUE_PROCBASED_CTLS)
 MSR 0x0000048F = 0x01FFFFFF:0x00036DFB (IA32_VMX_TRUE_EXIT_CTLS)
 MSR 0x00000490 = 0x0003FFFF:0x000011FB (IA32_VMX_TRUE_ENTRY_CTLS)
 MSR 0x000004C1 = 0x00000000:0x00000000 (IA32_A_PMC0)
 MSR 0x000004C2 = 0x00000000:0x00000000 (IA32_A_PMC1)
 MSR 0x000004C3 = 0x00000000:0x00000000 (IA32_A_PMC2)
 MSR 0x000004C4 = 0x00000000:0x00000000 (IA32_A_PMC3)
 MSR 0x00000500 = 0x0000000E:0x00000000 (IA32_SGX_SVN_STATUS)
 MSR 0x00000560 = 0x00000000:0x00000000 (IA32_RTIT_OUTPUT_BASE)
 MSR 0x00000561 = 0x00000000:0x0000007F (IA32_RTIT_OUTPUT_MASK_PTRS)
 MSR 0x00000570 = 0x00000000:0x00000000 (IA32_RTIT_CTL)
 MSR 0x00000571 = 0x00000000:0x00000000 (IA32_RTIT_STATUS)
 MSR 0x00000572 = 0x00000000:0x00000000 (IA32_RTIT_CR3_MATCH)
 MSR 0x00000580 = 0x00000000:0x00000000 (IA32_RTIT_ADDR0_A)
 MSR 0x00000581 = 0x00000000:0x00000000 (IA32_RTIT_ADDR0_B)
 MSR 0x00000582 = 0x00000000:0x00000000 (IA32_RTIT_ADDR1_A)
 MSR 0x00000583 = 0x00000000:0x00000000 (IA32_RTIT_ADDR1_B)
 MSR 0x00000600 = 0xFFFFFE00:0x00153000 (IA32_DS_AREA)
 MSR 0x0000064E = 0x00000039:0x4AC5B2B8 (MSR_PPERF)
 MSR 0x00000653 = 0x00000000:0x00000000 (MSR_CORE_HDC_RESIDENCY)
 MSR 0x00000690 = 0x00000000:0x00000000 (MSR_LASTBRANCH_16_FROM_IP)
 MSR 0x00000691 = 0x00000000:0x00000000 (MSR_LASTBRANCH_17_FROM_IP)
 MSR 0x00000692 = 0x00000000:0x00000000 (MSR_LASTBRANCH_18_FROM_IP)
 MSR 0x00000693 = 0x00000000:0x00000000 (MSR_LASTBRANCH_19_FROM_IP)
 MSR 0x00000694 = 0x00000000:0x00000000 (MSR_LASTBRANCH_20_FROM_IP)
 MSR 0x00000695 = 0x00000000:0x00000000 (MSR_LASTBRANCH_21_FROM_IP)
 MSR 0x00000696 = 0x00000000:0x00000000 (MSR_LASTBRANCH_22_FROM_IP)
 MSR 0x00000697 = 0x00000000:0x00000000 (MSR_LASTBRANCH_23_FROM_IP)
 MSR 0x00000698 = 0x00000000:0x00000000 (MSR_LASTBRANCH_24_FROM_IP)
 MSR 0x00000699 = 0x00000000:0x00000000 (MSR_LASTBRANCH_25_FROM_IP)
 MSR 0x0000069A = 0x00000000:0x00000000 (MSR_LASTBRANCH_26_FROM_IP)
 MSR 0x0000069B = 0x00000000:0x00000000 (MSR_LASTBRANCH_27_FROM_IP)
 MSR 0x0000069C = 0x00000000:0x00000000 (MSR_LASTBRANCH_28_FROM_IP)
 MSR 0x0000069D = 0x00000000:0x00000000 (MSR_LASTBRANCH_29_FROM_IP)
 MSR 0x0000069E = 0x00000000:0x00000000 (MSR_LASTBRANCH_30_FROM_IP)
 MSR 0x0000069F = 0x00000000:0x00000000 (MSR_LASTBRANCH_31_FROM_IP)
 MSR 0x000006D0 = 0x00000000:0x00000000 (MSR_LASTBRANCH_16_TO_IP)
 MSR 0x000006D1 = 0x00000000:0x00000000 (MSR_LASTBRANCH_17_TO_IP)
 MSR 0x000006D2 = 0x00000000:0x00000000 (MSR_LASTBRANCH_18_TO_IP)
 MSR 0x000006D3 = 0x00000000:0x00000000 (MSR_LASTBRANCH_19_TO_IP)
 MSR 0x000006D4 = 0x00000000:0x00000000 (MSR_LASTBRANCH_20_TO_IP)
 MSR 0x000006D5 = 0x00000000:0x00000000 (MSR_LASTBRANCH_21_TO_IP)
 MSR 0x000006D6 = 0x00000000:0x00000000 (MSR_LASTBRANCH_22_TO_IP)
 MSR 0x000006D7 = 0x00000000:0x00000000 (MSR_LASTBRANCH_23_TO_IP)
 MSR 0x000006D8 = 0x00000000:0x00000000 (MSR_LASTBRANCH_24_TO_IP)
 MSR 0x000006D9 = 0x00000000:0x00000000 (MSR_LASTBRANCH_25_TO_IP)
 MSR 0x000006DA = 0x00000000:0x00000000 (MSR_LASTBRANCH_26_TO_IP)
 MSR 0x000006DB = 0x00000000:0x00000000 (MSR_LASTBRANCH_27_TO_IP)
 MSR 0x000006DC = 0x00000000:0x00000000 (MSR_LASTBRANCH_28_TO_IP)
 MSR 0x000006DD = 0x00000000:0x00000000 (MSR_LASTBRANCH_29_TO_IP)
 MSR 0x000006DE = 0x00000000:0x00000000 (MSR_LASTBRANCH_30_TO_IP)
 MSR 0x000006DF = 0x00000000:0x00000000 (MSR_LASTBRANCH_31_TO_IP)
 MSR 0x000006E0 = 0x00000285:0x55AF4E60 (IA32_TSC_DEADLINE)
 MSR 0x00000771 = 0x00000000:0x010B1A2D (IA32_HWP_CAPABILITIES)
 MSR 0x00000773 = 0x00000000:0x00000000 (IA32_HWP_INTERRUPT)
 MSR 0x00000774 = 0x00000000:0x80002D08 (IA32_HWP_REQUEST)
 MSR 0x00000777 = 0x00000000:0x00000000 (IA32_HWP_STATUS)
 MSR 0x00000D90 = 0x00000000:0x00000000 (IA32_BNDCFGS)
 MSR 0x00000DA0 = 0x00000000:0x00000000 (IA32_XSS)
 MSR 0x00000DB1 = 0x00000000:0x00000001 (IA32_PM_CTL1)
 MSR 0x00000DB2 = 0x00000000:0x00000000 (IA32_THREAD_STALL)
 MSR 0x00000DC0 = 0x00000000:0x00000000 (IA32_LBR_INFO_0)
 MSR 0x00000DC1 = 0x00000000:0x00000000 (IA32_LBR_INFO_1)
 MSR 0x00000DC2 = 0x00000000:0x00000000 (IA32_LBR_INFO_2)
 MSR 0x00000DC3 = 0x00000000:0x00000000 (IA32_LBR_INFO_3)
 MSR 0x00000DC4 = 0x00000000:0x00000000 (IA32_LBR_INFO_4)
 MSR 0x00000DC5 = 0x00000000:0x00000000 (IA32_LBR_INFO_5)
 MSR 0x00000DC6 = 0x00000000:0x00000000 (IA32_LBR_INFO_6)
 MSR 0x00000DC7 = 0x00000000:0x00000000 (IA32_LBR_INFO_7)
 MSR 0x00000DC8 = 0x00000000:0x00000000 (IA32_LBR_INFO_8)
 MSR 0x00000DC9 = 0x00000000:0x00000000 (IA32_LBR_INFO_9)
 MSR 0x00000DCA = 0x00000000:0x00000000 (IA32_LBR_INFO_10)
 MSR 0x00000DCB = 0x00000000:0x00000000 (IA32_LBR_INFO_11)
 MSR 0x00000DCC = 0x00000000:0x00000000 (IA32_LBR_INFO_12)
 MSR 0x00000DCD = 0x00000000:0x00000000 (IA32_LBR_INFO_13)
 MSR 0x00000DCE = 0x00000000:0x00000000 (IA32_LBR_INFO_14)
 MSR 0x00000DCF = 0x00000000:0x00000000 (IA32_LBR_INFO_15)
 MSR 0x00000DD0 = 0x00000000:0x00000000 (IA32_LBR_INFO_16)
 MSR 0x00000DD1 = 0x00000000:0x00000000 (IA32_LBR_INFO_17)
 MSR 0x00000DD2 = 0x00000000:0x00000000 (IA32_LBR_INFO_18)
 MSR 0x00000DD3 = 0x00000000:0x00000000 (IA32_LBR_INFO_19)
 MSR 0x00000DD4 = 0x00000000:0x00000000 (IA32_LBR_INFO_20)
 MSR 0x00000DD5 = 0x00000000:0x00000000 (IA32_LBR_INFO_21)
 MSR 0x00000DD6 = 0x00000000:0x00000000 (IA32_LBR_INFO_22)
 MSR 0x00000DD7 = 0x00000000:0x00000000 (IA32_LBR_INFO_23)
 MSR 0x00000DD8 = 0x00000000:0x00000000 (IA32_LBR_INFO_24)
 MSR 0x00000DD9 = 0x00000000:0x00000000 (IA32_LBR_INFO_25)
 MSR 0x00000DDA = 0x00000000:0x00000000 (IA32_LBR_INFO_26)
 MSR 0x00000DDB = 0x00000000:0x00000000 (IA32_LBR_INFO_27)
 MSR 0x00000DDC = 0x00000000:0x00000000 (IA32_LBR_INFO_28)
 MSR 0x00000DDD = 0x00000000:0x00000000 (IA32_LBR_INFO_29)
 MSR 0x00000DDE = 0x00000000:0x00000000 (IA32_LBR_INFO_30)
 MSR 0x00000DDF = 0x00000000:0x00000000 (IA32_LBR_INFO_31)

====================== UNIQUE MSRs  (core 7) ======================
 MSR 0x00000000 = 0x00000000:0x00000FFF (IA32_P5_MC_ADDR)
 MSR 0x00000001 = 0x00000000:0x00000000 (IA32_P5_MC_TYPE)
 MSR 0x00000006 = 0x00000000:0x00000040 (IA32_MONITOR_FILTER_SIZE)
 MSR 0x00000010 = 0x00000285:0x55324814 (IA32_TIME_STAMP_COUNTER)
 MSR 0x0000001B = 0x00000000:0xFEE00C00 (IA32_APIC_BASE)
 MSR 0x00000034 = 0x00000000:0x0000066C (MSR_SMI_COUNT)
 MSR 0x0000003A = 0x00000000:0x00020005 (IA32_FEATURE_CONTROL)
 MSR 0x0000008B = 0x000000DE:0x00000000 (IA32_BIOS_SIGN_ID)
 MSR 0x000000C1 = 0x00000000:0x00000000 (IA32_PMC0)
 MSR 0x000000C2 = 0x00000000:0x00000000 (IA32_PMC1)
 MSR 0x000000C3 = 0x00000000:0x00000000 (IA32_PMC2)
 MSR 0x000000C4 = 0x00000000:0x00000000 (IA32_PMC3)
 MSR 0x000000E2 = 0x00000000:0x1C008007 (MSR_PKG_CST_CONFIG_CONTROL)
 MSR 0x000000E4 = 0x00000000:0x00051814 (MSR_PMG_IO_CAPTURE_BASE)
 MSR 0x000000E7 = 0x00000052:0xF61596DC (IA32_MPERF)
 MSR 0x000000E8 = 0x00000061:0x62C3F3DB (IA32_APERF)
 MSR 0x000000FE = 0x00000000:0x00001D0A (IA32_MTRRCAP)
 MSR 0x0000013C = 0x00000000:0x00000001 (MSR_FEATURE_CONFIG)
 MSR 0x00000174 = 0x00000000:0x00000010 (IA32_SYSENTER_CS)
 MSR 0x00000175 = 0xFFFFFE00:0x00176000 (IA32_SYSENTER_ESP)
 MSR 0x00000176 = 0xFFFFFFFF:0x8B201580 (IA32_SYSENTER_EIP)
 MSR 0x00000179 = 0x00000000:0x00000C0C (IA32_MCG_CAP)
 MSR 0x0000017A = 0x00000000:0x00000000 (IA32_MCG_STATUS)
 MSR 0x00000186 = 0x00000000:0x00000000 (IA32_PERFEVTSEL0)
 MSR 0x00000187 = 0x00000000:0x00000000 (IA32_PERFEVTSEL1)
 MSR 0x00000188 = 0x00000000:0x00000000 (IA32_PERFEVTSEL2)
 MSR 0x00000189 = 0x00000000:0x00000000 (IA32_PERFEVTSEL3)
 MSR 0x00000199 = 0x00000000:0x00000800 (IA32_PERF_CTL)
 MSR 0x0000019A = 0x00000000:0x00000000 (IA32_CLOCK_MODULATION)
 MSR 0x0000019B = 0x00000000:0x00000013 (IA32_THERM_INTERRUPT)
 MSR 0x0000019C = 0x00000000:0x880C0803 (IA32_THERM_STATUS)
 MSR 0x000001A0 = 0x00000000:0x00850089 (IA32_MISC_ENABLE)
 MSR 0x000001A4 = 0x00000000:0x00000000 (IA32_MISC_FEATURE_CONTROL)
 MSR 0x000001A6 = 0x00000000:0x00000000 (MSR_OFFCORE_RSP_0)
 MSR 0x000001A7 = 0x00000000:0x00000000 (MSR_OFFCORE_RSP_1)
 MSR 0x000001C8 = 0x00000000:0x00000000 (MSR_LBR_SELECT)
 MSR 0x000001C9 = 0x00000000:0x00000000 (MSR_LASTBRANCH_TOS)
 MSR 0x000001D9 = 0x00000000:0x00000000 (IA32_DEBUGCTL)
 MSR 0x000001DD = 0x00000000:0x00000000 (MSR_LER_FROM_LIP)
 MSR 0x000001DE = 0x00000000:0x00000000 (MSR_LER_TO_LIP)
 MSR 0x000001F2 = 0x00000000:0x9A000006 (IA32_SMRR_PHYSBASE)
 MSR 0x000001F3 = 0x00000000:0xFF000800 (IA32_SMRR_PHYSMASK)
 MSR 0x000001F4 = 0x00000000:0x99F00006 (MSR_PRMRR_PHYS_BASE)
 MSR 0x000001F5 = 0x0000007F:0xFFF00C00 (MSR_PRMRR_PHYS_MASK)
 MSR 0x000001FB = 0x00000000:0x000000E1 (MSR_PRMRR_VALID_CONFIG)
 MSR 0x000001FC = 0x00000000:0x002C005D (MSR_POWER_CTL)
 MSR 0x00000200 = 0x00000000:0xC0000000 (IA32_MTRR_PHYSBASE0)
 MSR 0x00000201 = 0x0000007F:0xC0000800 (IA32_MTRR_PHYSBASE0)
 MSR 0x00000202 = 0x00000000:0xA0000000 (IA32_MTRR_PHYSBASE1)
 MSR 0x00000203 = 0x0000007F:0xE0000800 (IA32_MTRR_PHYSBASE1)
 MSR 0x00000204 = 0x00000000:0x9C000000 (IA32_MTRR_PHYSBASE2)
 MSR 0x00000205 = 0x0000007F:0xFC000800 (IA32_MTRR_PHYSBASE2)
 MSR 0x00000206 = 0x00000000:0x9B000000 (IA32_MTRR_PHYSBASE3)
 MSR 0x00000207 = 0x0000007F:0xFF000800 (IA32_MTRR_PHYSBASE3)
 MSR 0x00000208 = 0x00000020:0x00000000 (IA32_MTRR_PHYSBASE4)
 MSR 0x00000209 = 0x00000060:0x00000800 (IA32_MTRR_PHYSBASE4)
 MSR 0x0000020A = 0x00000010:0x00000000 (IA32_MTRR_PHYSBASE5)
 MSR 0x0000020B = 0x00000070:0x00000800 (IA32_MTRR_PHYSBASE5)
 MSR 0x0000020C = 0x00000040:0x00000000 (IA32_MTRR_PHYSBASE6)
 MSR 0x0000020D = 0x00000040:0x00000800 (IA32_MTRR_PHYSBASE6)
 MSR 0x0000020E = 0x00000004:0x00000006 (IA32_MTRR_PHYSBASE7)
 MSR 0x0000020F = 0x00000000:0x00000000 (IA32_MTRR_PHYSBASE7)
 MSR 0x00000210 = 0x00000008:0x00000006 (IA32_MTRR_PHYSBASE8)
 MSR 0x00000211 = 0x00000000:0x00000000 (IA32_MTRR_PHYSBASE8)
 MSR 0x00000212 = 0x00000000:0x00000000 (IA32_MTRR_PHYSBASE9)
 MSR 0x00000213 = 0x00000000:0x00000000 (IA32_MTRR_PHYSBASE9)
 MSR 0x00000250 = 0x06060606:0x06060606 (IA32_MTRR_FIX64K_00000)
 MSR 0x00000258 = 0x06060606:0x06060606 (IA32_MTRR_FIX16K_80000)
 MSR 0x00000259 = 0x00000000:0x00000000 (IA32_MTRR_FIX16K_A0000)
 MSR 0x00000268 = 0x05050505:0x05050505 (IA32_MTRR_FIX4K_C0000)
 MSR 0x00000269 = 0x05050505:0x05050505 (IA32_MTRR_FIX4K_C8000)
 MSR 0x0000026A = 0x05050505:0x05050505 (IA32_MTRR_FIX4K_D0000)
 MSR 0x0000026B = 0x05050505:0x05050505 (IA32_MTRR_FIX4K_D8000)
 MSR 0x0000026C = 0x05050505:0x05050505 (IA32_MTRR_FIX4K_E0000)
 MSR 0x0000026D = 0x05050505:0x05050505 (IA32_MTRR_FIX4K_E8000)
 MSR 0x0000026E = 0x05050505:0x05050505 (IA32_MTRR_FIX4K_F0000)
 MSR 0x0000026F = 0x05050505:0x05050505 (IA32_MTRR_FIX4K_F8000)
 MSR 0x00000277 = 0x04070506:0x00070106 (IA32_PAT)
 MSR 0x00000280 = 0x00000000:0x40000001 (IA32_MC0_CTL2)
 MSR 0x00000281 = 0x00000000:0x40000001 (IA32_MC1_CTL2)
 MSR 0x00000282 = 0x00000000:0x40000001 (IA32_MC2_CTL2)
 MSR 0x00000283 = 0x00000000:0x40000001 (IA32_MC3_CTL2)
 MSR 0x000002FF = 0x00000000:0x00000C06 (IA32_MTRR_DEF_TYPE)
 MSR 0x00000309 = 0x00000000:0x00000000 (IA32_FIXED_CTR0)
 MSR 0x0000030A = 0x0000FFFA:0xBEC7D2B7 (IA32_FIXED_CTR1)
 MSR 0x0000030B = 0x00000000:0x00000000 (IA32_FIXED_CTR2)
 MSR 0x00000345 = 0x00000000:0x000033C5 (IA32_PERF_CAPABILITIES)
 MSR 0x0000038D = 0x00000000:0x000000B0 (IA32_FIXED_CTR_CTRL)
 MSR 0x0000038E = 0x00000000:0x00000000 (IA32_PERF_GLOBAL_STATUS)
 MSR 0x0000038F = 0x00000007:0x0000000F (IA32_PERF_GLOBAL_CTRL)
 MSR 0x00000390 = 0x00000000:0x00000000 (IA32_PERF_GLOBAL_STATUS_RESET)
 MSR 0x00000391 = 0x00000000:0x00000000 (IA32_PERF_GLOBAL_STATUS_SET)
 MSR 0x000003F1 = 0x00000000:0x00000000 (MSR_PEBS_ENABLE)
 MSR 0x000003F6 = 0x00000000:0x0000FFFF (MSR_PEBS_LD_LAT)
 MSR 0x000003F7 = 0x00000000:0x00000800 (MSR_PEBS_FRONTEND)
 MSR 0x000003FC = 0x00000002:0x09C72AF6 (MSR_CORE_C3_RESIDENCY)
 MSR 0x000003FD = 0x00000014:0x4C646364 (MSR_CORE_C6_RESIDENCY)
 MSR 0x000003FE = 0x000001A3:0x1F12376C (MSR_CORE_C7_RESIDENCY)
 MSR 0x00000400 = 0x00000000:0x00000FFF (IA32_MC0_CTL)
 MSR 0x00000401 = 0x00000000:0x00000000 (IA32_MC0_STATUS)
 MSR 0x00000402 = 0x00000000:0x00000000 (IA32_MC0_ADDR)
 MSR 0x00000403 = 0x00000000:0x00000000 (IA32_MC0_MISC)
 MSR 0x00000404 = 0x00000000:0x0000000F (IA32_MC1_CTL)
 MSR 0x00000405 = 0x00000000:0x00000000 (IA32_MC1_STATUS)
 MSR 0x00000406 = 0x00000000:0x00000000 (IA32_MC1_ADDR)
 MSR 0x00000407 = 0x00000000:0x00000000 (IA32_MC1_MISC)
 MSR 0x00000408 = 0x00000000:0x0000000F (IA32_MC2_CTL)
 MSR 0x00000409 = 0x00000000:0x00000000 (IA32_MC2_STATUS)
 MSR 0x0000040A = 0x00000000:0x00000000 (IA32_MC2_ADDR)
 MSR 0x0000040C = 0x00000000:0x0000001F (IA32_MC3_CTL)
 MSR 0x0000040D = 0x00000000:0x00000000 (IA32_MC3_STATUS)
 MSR 0x0000040E = 0x00000000:0x00000000 (IA32_MC3_ADDR)
 MSR 0x00000410 = 0x00000000:0x0000003F (IA32_MC4_CTL)
 MSR 0x00000411 = 0x00000000:0x00000000 (IA32_MC4_STATUS)
 MSR 0x00000480 = 0x00DA0400:0x00000004 (IA32_VMX_BASIC)
 MSR 0x00000481 = 0x0000007F:0x00000016 (IA32_VMX_PINBASED_CTLS)
 MSR 0x00000482 = 0xFFF9FFFE:0x0401E172 (IA32_VMX_PROCBASED_CTLS)
 MSR 0x00000483 = 0x01FFFFFF:0x00036DFF (IA32_VMX_EXIT_CTLS)
 MSR 0x00000484 = 0x0003FFFF:0x000011FF (IA32_VMX_ENTRY_CTLS)
 MSR 0x00000485 = 0x00000000:0x7004C1E7 (IA32_VMX_MISC)
 MSR 0x00000486 = 0x00000000:0x80000021 (IA32_VMX_CR0_FIXED0)
 MSR 0x00000487 = 0x00000000:0xFFFFFFFF (IA32_VMX_CR0_FIXED1)
 MSR 0x00000488 = 0x00000000:0x00002000 (IA32_VMX_CR4_FIXED0)
 MSR 0x00000489 = 0x00000000:0x003727FF (IA32_VMX_CR4_FIXED1)
 MSR 0x0000048A = 0x00000000:0x0000002E (IA32_VMX_VMCS_ENUM)
 MSR 0x0000048B = 0x005FBCFF:0x00000000 (IA32_VMX_PROCBASED_CTLS2)
 MSR 0x0000048C = 0x00000F01:0x06734141 (IA32_VMX_EPT_VPID_ENUM)
 MSR 0x0000048D = 0x0000007F:0x00000016 (IA32_VMX_TRUE_PINBASED_CTLS)
 MSR 0x0000048E = 0xFFF9FFFE:0x04006172 (IA32_VMX_TRUE_PROCBASED_CTLS)
 MSR 0x0000048F = 0x01FFFFFF:0x00036DFB (IA32_VMX_TRUE_EXIT_CTLS)
 MSR 0x00000490 = 0x0003FFFF:0x000011FB (IA32_VMX_TRUE_ENTRY_CTLS)
 MSR 0x000004C1 = 0x00000000:0x00000000 (IA32_A_PMC0)
 MSR 0x000004C2 = 0x00000000:0x00000000 (IA32_A_PMC1)
 MSR 0x000004C3 = 0x00000000:0x00000000 (IA32_A_PMC2)
 MSR 0x000004C4 = 0x00000000:0x00000000 (IA32_A_PMC3)
 MSR 0x00000500 = 0x0000000E:0x00000000 (IA32_SGX_SVN_STATUS)
 MSR 0x00000560 = 0x00000000:0x00000000 (IA32_RTIT_OUTPUT_BASE)
 MSR 0x00000561 = 0x00000000:0x0000007F (IA32_RTIT_OUTPUT_MASK_PTRS)
 MSR 0x00000570 = 0x00000000:0x00000000 (IA32_RTIT_CTL)
 MSR 0x00000571 = 0x00000000:0x00000000 (IA32_RTIT_STATUS)
 MSR 0x00000572 = 0x00000000:0x00000000 (IA32_RTIT_CR3_MATCH)
 MSR 0x00000580 = 0x00000000:0x00000000 (IA32_RTIT_ADDR0_A)
 MSR 0x00000581 = 0x00000000:0x00000000 (IA32_RTIT_ADDR0_B)
 MSR 0x00000582 = 0x00000000:0x00000000 (IA32_RTIT_ADDR1_A)
 MSR 0x00000583 = 0x00000000:0x00000000 (IA32_RTIT_ADDR1_B)
 MSR 0x00000600 = 0xFFFFFE00:0x00188000 (IA32_DS_AREA)
 MSR 0x0000064E = 0x0000005C:0x29478443 (MSR_PPERF)
 MSR 0x00000653 = 0x00000000:0x00000000 (MSR_CORE_HDC_RESIDENCY)
 MSR 0x00000690 = 0x00000000:0x00000000 (MSR_LASTBRANCH_16_FROM_IP)
 MSR 0x00000691 = 0x00000000:0x00000000 (MSR_LASTBRANCH_17_FROM_IP)
 MSR 0x00000692 = 0x00000000:0x00000000 (MSR_LASTBRANCH_18_FROM_IP)
 MSR 0x00000693 = 0x00000000:0x00000000 (MSR_LASTBRANCH_19_FROM_IP)
 MSR 0x00000694 = 0x00000000:0x00000000 (MSR_LASTBRANCH_20_FROM_IP)
 MSR 0x00000695 = 0x00000000:0x00000000 (MSR_LASTBRANCH_21_FROM_IP)
 MSR 0x00000696 = 0x00000000:0x00000000 (MSR_LASTBRANCH_22_FROM_IP)
 MSR 0x00000697 = 0x00000000:0x00000000 (MSR_LASTBRANCH_23_FROM_IP)
 MSR 0x00000698 = 0x00000000:0x00000000 (MSR_LASTBRANCH_24_FROM_IP)
 MSR 0x00000699 = 0x00000000:0x00000000 (MSR_LASTBRANCH_25_FROM_IP)
 MSR 0x0000069A = 0x00000000:0x00000000 (MSR_LASTBRANCH_26_FROM_IP)
 MSR 0x0000069B = 0x00000000:0x00000000 (MSR_LASTBRANCH_27_FROM_IP)
 MSR 0x0000069C = 0x00000000:0x00000000 (MSR_LASTBRANCH_28_FROM_IP)
 MSR 0x0000069D = 0x00000000:0x00000000 (MSR_LASTBRANCH_29_FROM_IP)
 MSR 0x0000069E = 0x00000000:0x00000000 (MSR_LASTBRANCH_30_FROM_IP)
 MSR 0x0000069F = 0x00000000:0x00000000 (MSR_LASTBRANCH_31_FROM_IP)
 MSR 0x000006D0 = 0x00000000:0x00000000 (MSR_LASTBRANCH_16_TO_IP)
 MSR 0x000006D1 = 0x00000000:0x00000000 (MSR_LASTBRANCH_17_TO_IP)
 MSR 0x000006D2 = 0x00000000:0x00000000 (MSR_LASTBRANCH_18_TO_IP)
 MSR 0x000006D3 = 0x00000000:0x00000000 (MSR_LASTBRANCH_19_TO_IP)
 MSR 0x000006D4 = 0x00000000:0x00000000 (MSR_LASTBRANCH_20_TO_IP)
 MSR 0x000006D5 = 0x00000000:0x00000000 (MSR_LASTBRANCH_21_TO_IP)
 MSR 0x000006D6 = 0x00000000:0x00000000 (MSR_LASTBRANCH_22_TO_IP)
 MSR 0x000006D7 = 0x00000000:0x00000000 (MSR_LASTBRANCH_23_TO_IP)
 MSR 0x000006D8 = 0x00000000:0x00000000 (MSR_LASTBRANCH_24_TO_IP)
 MSR 0x000006D9 = 0x00000000:0x00000000 (MSR_LASTBRANCH_25_TO_IP)
 MSR 0x000006DA = 0x00000000:0x00000000 (MSR_LASTBRANCH_26_TO_IP)
 MSR 0x000006DB = 0x00000000:0x00000000 (MSR_LASTBRANCH_27_TO_IP)
 MSR 0x000006DC = 0x00000000:0x00000000 (MSR_LASTBRANCH_28_TO_IP)
 MSR 0x000006DD = 0x00000000:0x00000000 (MSR_LASTBRANCH_29_TO_IP)
 MSR 0x000006DE = 0x00000000:0x00000000 (MSR_LASTBRANCH_30_TO_IP)
 MSR 0x000006DF = 0x00000000:0x00000000 (MSR_LASTBRANCH_31_TO_IP)
 MSR 0x000006E0 = 0x00000285:0x55AF4E80 (IA32_TSC_DEADLINE)
 MSR 0x00000771 = 0x00000000:0x010B1A2D (IA32_HWP_CAPABILITIES)
 MSR 0x00000773 = 0x00000000:0x00000000 (IA32_HWP_INTERRUPT)
 MSR 0x00000774 = 0x00000000:0x80002D08 (IA32_HWP_REQUEST)
 MSR 0x00000777 = 0x00000000:0x00000000 (IA32_HWP_STATUS)
 MSR 0x00000D90 = 0x00000000:0x00000000 (IA32_BNDCFGS)
 MSR 0x00000DA0 = 0x00000000:0x00000000 (IA32_XSS)
 MSR 0x00000DB1 = 0x00000000:0x00000001 (IA32_PM_CTL1)
 MSR 0x00000DB2 = 0x00000000:0x00000000 (IA32_THREAD_STALL)
 MSR 0x00000DC0 = 0x00000000:0x00000000 (IA32_LBR_INFO_0)
 MSR 0x00000DC1 = 0x00000000:0x00000000 (IA32_LBR_INFO_1)
 MSR 0x00000DC2 = 0x00000000:0x00000000 (IA32_LBR_INFO_2)
 MSR 0x00000DC3 = 0x00000000:0x00000000 (IA32_LBR_INFO_3)
 MSR 0x00000DC4 = 0x00000000:0x00000000 (IA32_LBR_INFO_4)
 MSR 0x00000DC5 = 0x00000000:0x00000000 (IA32_LBR_INFO_5)
 MSR 0x00000DC6 = 0x00000000:0x00000000 (IA32_LBR_INFO_6)
 MSR 0x00000DC7 = 0x00000000:0x00000000 (IA32_LBR_INFO_7)
 MSR 0x00000DC8 = 0x00000000:0x00000000 (IA32_LBR_INFO_8)
 MSR 0x00000DC9 = 0x00000000:0x00000000 (IA32_LBR_INFO_9)
 MSR 0x00000DCA = 0x00000000:0x00000000 (IA32_LBR_INFO_10)
 MSR 0x00000DCB = 0x00000000:0x00000000 (IA32_LBR_INFO_11)
 MSR 0x00000DCC = 0x00000000:0x00000000 (IA32_LBR_INFO_12)
 MSR 0x00000DCD = 0x00000000:0x00000000 (IA32_LBR_INFO_13)
 MSR 0x00000DCE = 0x00000000:0x00000000 (IA32_LBR_INFO_14)
 MSR 0x00000DCF = 0x00000000:0x00000000 (IA32_LBR_INFO_15)
 MSR 0x00000DD0 = 0x00000000:0x00000000 (IA32_LBR_INFO_16)
 MSR 0x00000DD1 = 0x00000000:0x00000000 (IA32_LBR_INFO_17)
 MSR 0x00000DD2 = 0x00000000:0x00000000 (IA32_LBR_INFO_18)
 MSR 0x00000DD3 = 0x00000000:0x00000000 (IA32_LBR_INFO_19)
 MSR 0x00000DD4 = 0x00000000:0x00000000 (IA32_LBR_INFO_20)
 MSR 0x00000DD5 = 0x00000000:0x00000000 (IA32_LBR_INFO_21)
 MSR 0x00000DD6 = 0x00000000:0x00000000 (IA32_LBR_INFO_22)
 MSR 0x00000DD7 = 0x00000000:0x00000000 (IA32_LBR_INFO_23)
 MSR 0x00000DD8 = 0x00000000:0x00000000 (IA32_LBR_INFO_24)
 MSR 0x00000DD9 = 0x00000000:0x00000000 (IA32_LBR_INFO_25)
 MSR 0x00000DDA = 0x00000000:0x00000000 (IA32_LBR_INFO_26)
 MSR 0x00000DDB = 0x00000000:0x00000000 (IA32_LBR_INFO_27)
 MSR 0x00000DDC = 0x00000000:0x00000000 (IA32_LBR_INFO_28)
 MSR 0x00000DDD = 0x00000000:0x00000000 (IA32_LBR_INFO_29)
 MSR 0x00000DDE = 0x00000000:0x00000000 (IA32_LBR_INFO_30)
 MSR 0x00000DDF = 0x00000000:0x00000000 (IA32_LBR_INFO_31)

====================== UNIQUE MSRs  (core 8) ======================
 MSR 0x00000000 = 0x00000000:0x00000FFF (IA32_P5_MC_ADDR)
 MSR 0x00000001 = 0x00000000:0x00000000 (IA32_P5_MC_TYPE)
 MSR 0x00000006 = 0x00000000:0x00000040 (IA32_MONITOR_FILTER_SIZE)
 MSR 0x00000010 = 0x00000285:0x5551929C (IA32_TIME_STAMP_COUNTER)
 MSR 0x0000001B = 0x00000000:0xFEE00C00 (IA32_APIC_BASE)
 MSR 0x00000034 = 0x00000000:0x0000066C (MSR_SMI_COUNT)
 MSR 0x0000003A = 0x00000000:0x00020005 (IA32_FEATURE_CONTROL)
 MSR 0x0000008B = 0x000000DE:0x00000000 (IA32_BIOS_SIGN_ID)
 MSR 0x000000C1 = 0x00000000:0x00000000 (IA32_PMC0)
 MSR 0x000000C2 = 0x00000000:0x00000000 (IA32_PMC1)
 MSR 0x000000C3 = 0x00000000:0x00000000 (IA32_PMC2)
 MSR 0x000000C4 = 0x00000000:0x00000000 (IA32_PMC3)
 MSR 0x000000E2 = 0x00000000:0x1C008007 (MSR_PKG_CST_CONFIG_CONTROL)
 MSR 0x000000E4 = 0x00000000:0x00051814 (MSR_PMG_IO_CAPTURE_BASE)
 MSR 0x000000E7 = 0x0000003E:0xD987744B (IA32_MPERF)
 MSR 0x000000E8 = 0x00000047:0x9CA9B7A1 (IA32_APERF)
 MSR 0x000000FE = 0x00000000:0x00001D0A (IA32_MTRRCAP)
 MSR 0x0000013C = 0x00000000:0x00000001 (MSR_FEATURE_CONFIG)
 MSR 0x00000174 = 0x00000000:0x00000010 (IA32_SYSENTER_CS)
 MSR 0x00000175 = 0xFFFFFE00:0x001AB000 (IA32_SYSENTER_ESP)
 MSR 0x00000176 = 0xFFFFFFFF:0x8B201580 (IA32_SYSENTER_EIP)
 MSR 0x00000179 = 0x00000000:0x00000C0C (IA32_MCG_CAP)
 MSR 0x0000017A = 0x00000000:0x00000000 (IA32_MCG_STATUS)
 MSR 0x00000186 = 0x00000000:0x00000000 (IA32_PERFEVTSEL0)
 MSR 0x00000187 = 0x00000000:0x00000000 (IA32_PERFEVTSEL1)
 MSR 0x00000188 = 0x00000000:0x00000000 (IA32_PERFEVTSEL2)
 MSR 0x00000189 = 0x00000000:0x00000000 (IA32_PERFEVTSEL3)
 MSR 0x00000199 = 0x00000000:0x00000800 (IA32_PERF_CTL)
 MSR 0x0000019A = 0x00000000:0x00000000 (IA32_CLOCK_MODULATION)
 MSR 0x0000019B = 0x00000000:0x00000013 (IA32_THERM_INTERRUPT)
 MSR 0x0000019C = 0x00000000:0x88130802 (IA32_THERM_STATUS)
 MSR 0x000001A0 = 0x00000000:0x00850089 (IA32_MISC_ENABLE)
 MSR 0x000001A4 = 0x00000000:0x00000000 (IA32_MISC_FEATURE_CONTROL)
 MSR 0x000001A6 = 0x00000000:0x00000000 (MSR_OFFCORE_RSP_0)
 MSR 0x000001A7 = 0x00000000:0x00000000 (MSR_OFFCORE_RSP_1)
 MSR 0x000001C8 = 0x00000000:0x00000000 (MSR_LBR_SELECT)
 MSR 0x000001C9 = 0x00000000:0x00000000 (MSR_LASTBRANCH_TOS)
 MSR 0x000001D9 = 0x00000000:0x00000000 (IA32_DEBUGCTL)
 MSR 0x000001DD = 0x00000000:0x00000000 (MSR_LER_FROM_LIP)
 MSR 0x000001DE = 0x00000000:0x00000000 (MSR_LER_TO_LIP)
 MSR 0x000001F2 = 0x00000000:0x9A000006 (IA32_SMRR_PHYSBASE)
 MSR 0x000001F3 = 0x00000000:0xFF000800 (IA32_SMRR_PHYSMASK)
 MSR 0x000001F4 = 0x00000000:0x99F00006 (MSR_PRMRR_PHYS_BASE)
 MSR 0x000001F5 = 0x0000007F:0xFFF00C00 (MSR_PRMRR_PHYS_MASK)
 MSR 0x000001FB = 0x00000000:0x000000E1 (MSR_PRMRR_VALID_CONFIG)
 MSR 0x000001FC = 0x00000000:0x002C005D (MSR_POWER_CTL)
 MSR 0x00000200 = 0x00000000:0xC0000000 (IA32_MTRR_PHYSBASE0)
 MSR 0x00000201 = 0x0000007F:0xC0000800 (IA32_MTRR_PHYSBASE0)
 MSR 0x00000202 = 0x00000000:0xA0000000 (IA32_MTRR_PHYSBASE1)
 MSR 0x00000203 = 0x0000007F:0xE0000800 (IA32_MTRR_PHYSBASE1)
 MSR 0x00000204 = 0x00000000:0x9C000000 (IA32_MTRR_PHYSBASE2)
 MSR 0x00000205 = 0x0000007F:0xFC000800 (IA32_MTRR_PHYSBASE2)
 MSR 0x00000206 = 0x00000000:0x9B000000 (IA32_MTRR_PHYSBASE3)
 MSR 0x00000207 = 0x0000007F:0xFF000800 (IA32_MTRR_PHYSBASE3)
 MSR 0x00000208 = 0x00000020:0x00000000 (IA32_MTRR_PHYSBASE4)
 MSR 0x00000209 = 0x00000060:0x00000800 (IA32_MTRR_PHYSBASE4)
 MSR 0x0000020A = 0x00000010:0x00000000 (IA32_MTRR_PHYSBASE5)
 MSR 0x0000020B = 0x00000070:0x00000800 (IA32_MTRR_PHYSBASE5)
 MSR 0x0000020C = 0x00000040:0x00000000 (IA32_MTRR_PHYSBASE6)
 MSR 0x0000020D = 0x00000040:0x00000800 (IA32_MTRR_PHYSBASE6)
 MSR 0x0000020E = 0x00000004:0x00000006 (IA32_MTRR_PHYSBASE7)
 MSR 0x0000020F = 0x00000000:0x00000000 (IA32_MTRR_PHYSBASE7)
 MSR 0x00000210 = 0x00000008:0x00000006 (IA32_MTRR_PHYSBASE8)
 MSR 0x00000211 = 0x00000000:0x00000000 (IA32_MTRR_PHYSBASE8)
 MSR 0x00000212 = 0x00000000:0x00000000 (IA32_MTRR_PHYSBASE9)
 MSR 0x00000213 = 0x00000000:0x00000000 (IA32_MTRR_PHYSBASE9)
 MSR 0x00000250 = 0x06060606:0x06060606 (IA32_MTRR_FIX64K_00000)
 MSR 0x00000258 = 0x06060606:0x06060606 (IA32_MTRR_FIX16K_80000)
 MSR 0x00000259 = 0x00000000:0x00000000 (IA32_MTRR_FIX16K_A0000)
 MSR 0x00000268 = 0x05050505:0x05050505 (IA32_MTRR_FIX4K_C0000)
 MSR 0x00000269 = 0x05050505:0x05050505 (IA32_MTRR_FIX4K_C8000)
 MSR 0x0000026A = 0x05050505:0x05050505 (IA32_MTRR_FIX4K_D0000)
 MSR 0x0000026B = 0x05050505:0x05050505 (IA32_MTRR_FIX4K_D8000)
 MSR 0x0000026C = 0x05050505:0x05050505 (IA32_MTRR_FIX4K_E0000)
 MSR 0x0000026D = 0x05050505:0x05050505 (IA32_MTRR_FIX4K_E8000)
 MSR 0x0000026E = 0x05050505:0x05050505 (IA32_MTRR_FIX4K_F0000)
 MSR 0x0000026F = 0x05050505:0x05050505 (IA32_MTRR_FIX4K_F8000)
 MSR 0x00000277 = 0x04070506:0x00070106 (IA32_PAT)
 MSR 0x00000280 = 0x00000000:0x40000001 (IA32_MC0_CTL2)
 MSR 0x00000281 = 0x00000000:0x40000001 (IA32_MC1_CTL2)
 MSR 0x00000282 = 0x00000000:0x40000001 (IA32_MC2_CTL2)
 MSR 0x00000283 = 0x00000000:0x40000001 (IA32_MC3_CTL2)
 MSR 0x000002FF = 0x00000000:0x00000C06 (IA32_MTRR_DEF_TYPE)
 MSR 0x00000309 = 0x00000000:0x00000000 (IA32_FIXED_CTR0)
 MSR 0x0000030A = 0x0000FFFF:0x71874FBB (IA32_FIXED_CTR1)
 MSR 0x0000030B = 0x00000000:0x00000000 (IA32_FIXED_CTR2)
 MSR 0x00000345 = 0x00000000:0x000033C5 (IA32_PERF_CAPABILITIES)
 MSR 0x0000038D = 0x00000000:0x000000B0 (IA32_FIXED_CTR_CTRL)
 MSR 0x0000038E = 0x00000000:0x00000000 (IA32_PERF_GLOBAL_STATUS)
 MSR 0x0000038F = 0x00000007:0x0000000F (IA32_PERF_GLOBAL_CTRL)
 MSR 0x00000390 = 0x00000000:0x00000000 (IA32_PERF_GLOBAL_STATUS_RESET)
 MSR 0x00000391 = 0x00000000:0x00000000 (IA32_PERF_GLOBAL_STATUS_SET)
 MSR 0x000003F1 = 0x00000000:0x00000000 (MSR_PEBS_ENABLE)
 MSR 0x000003F6 = 0x00000000:0x0000FFFF (MSR_PEBS_LD_LAT)
 MSR 0x000003F7 = 0x00000000:0x00000800 (MSR_PEBS_FRONTEND)
 MSR 0x000003FC = 0x00000005:0xB07C405C (MSR_CORE_C3_RESIDENCY)
 MSR 0x000003FD = 0x00000027:0x1DA7E88A (MSR_CORE_C6_RESIDENCY)
 MSR 0x000003FE = 0x00000163:0xDB5749DA (MSR_CORE_C7_RESIDENCY)
 MSR 0x00000400 = 0x00000000:0x00000FFF (IA32_MC0_CTL)
 MSR 0x00000401 = 0x00000000:0x00000000 (IA32_MC0_STATUS)
 MSR 0x00000402 = 0x00000000:0x00000000 (IA32_MC0_ADDR)
 MSR 0x00000403 = 0x00000000:0x00000000 (IA32_MC0_MISC)
 MSR 0x00000404 = 0x00000000:0x0000000F (IA32_MC1_CTL)
 MSR 0x00000405 = 0x00000000:0x00000000 (IA32_MC1_STATUS)
 MSR 0x00000406 = 0x00000000:0x00000000 (IA32_MC1_ADDR)
 MSR 0x00000407 = 0x00000000:0x00000000 (IA32_MC1_MISC)
 MSR 0x00000408 = 0x00000000:0x0000000F (IA32_MC2_CTL)
 MSR 0x00000409 = 0x00000000:0x00000000 (IA32_MC2_STATUS)
 MSR 0x0000040A = 0x00000000:0x00000000 (IA32_MC2_ADDR)
 MSR 0x0000040C = 0x00000000:0x0000001F (IA32_MC3_CTL)
 MSR 0x0000040D = 0x00000000:0x00000000 (IA32_MC3_STATUS)
 MSR 0x0000040E = 0x00000000:0x00000000 (IA32_MC3_ADDR)
 MSR 0x00000410 = 0x00000000:0x0000003F (IA32_MC4_CTL)
 MSR 0x00000411 = 0x00000000:0x00000000 (IA32_MC4_STATUS)
 MSR 0x00000480 = 0x00DA0400:0x00000004 (IA32_VMX_BASIC)
 MSR 0x00000481 = 0x0000007F:0x00000016 (IA32_VMX_PINBASED_CTLS)
 MSR 0x00000482 = 0xFFF9FFFE:0x0401E172 (IA32_VMX_PROCBASED_CTLS)
 MSR 0x00000483 = 0x01FFFFFF:0x00036DFF (IA32_VMX_EXIT_CTLS)
 MSR 0x00000484 = 0x0003FFFF:0x000011FF (IA32_VMX_ENTRY_CTLS)
 MSR 0x00000485 = 0x00000000:0x7004C1E7 (IA32_VMX_MISC)
 MSR 0x00000486 = 0x00000000:0x80000021 (IA32_VMX_CR0_FIXED0)
 MSR 0x00000487 = 0x00000000:0xFFFFFFFF (IA32_VMX_CR0_FIXED1)
 MSR 0x00000488 = 0x00000000:0x00002000 (IA32_VMX_CR4_FIXED0)
 MSR 0x00000489 = 0x00000000:0x003727FF (IA32_VMX_CR4_FIXED1)
 MSR 0x0000048A = 0x00000000:0x0000002E (IA32_VMX_VMCS_ENUM)
 MSR 0x0000048B = 0x005FBCFF:0x00000000 (IA32_VMX_PROCBASED_CTLS2)
 MSR 0x0000048C = 0x00000F01:0x06734141 (IA32_VMX_EPT_VPID_ENUM)
 MSR 0x0000048D = 0x0000007F:0x00000016 (IA32_VMX_TRUE_PINBASED_CTLS)
 MSR 0x0000048E = 0xFFF9FFFE:0x04006172 (IA32_VMX_TRUE_PROCBASED_CTLS)
 MSR 0x0000048F = 0x01FFFFFF:0x00036DFB (IA32_VMX_TRUE_EXIT_CTLS)
 MSR 0x00000490 = 0x0003FFFF:0x000011FB (IA32_VMX_TRUE_ENTRY_CTLS)
 MSR 0x000004C1 = 0x00000000:0x00000000 (IA32_A_PMC0)
 MSR 0x000004C2 = 0x00000000:0x00000000 (IA32_A_PMC1)
 MSR 0x000004C3 = 0x00000000:0x00000000 (IA32_A_PMC2)
 MSR 0x000004C4 = 0x00000000:0x00000000 (IA32_A_PMC3)
 MSR 0x00000500 = 0x0000000E:0x00000000 (IA32_SGX_SVN_STATUS)
 MSR 0x00000560 = 0x00000000:0x00000000 (IA32_RTIT_OUTPUT_BASE)
 MSR 0x00000561 = 0x00000000:0x0000007F (IA32_RTIT_OUTPUT_MASK_PTRS)
 MSR 0x00000570 = 0x00000000:0x00000000 (IA32_RTIT_CTL)
 MSR 0x00000571 = 0x00000000:0x00000000 (IA32_RTIT_STATUS)
 MSR 0x00000572 = 0x00000000:0x00000000 (IA32_RTIT_CR3_MATCH)
 MSR 0x00000580 = 0x00000000:0x00000000 (IA32_RTIT_ADDR0_A)
 MSR 0x00000581 = 0x00000000:0x00000000 (IA32_RTIT_ADDR0_B)
 MSR 0x00000582 = 0x00000000:0x00000000 (IA32_RTIT_ADDR1_A)
 MSR 0x00000583 = 0x00000000:0x00000000 (IA32_RTIT_ADDR1_B)
 MSR 0x00000600 = 0xFFFFFE00:0x001BD000 (IA32_DS_AREA)
 MSR 0x0000064E = 0x00000043:0xC49B618D (MSR_PPERF)
 MSR 0x00000653 = 0x00000000:0x00000000 (MSR_CORE_HDC_RESIDENCY)
 MSR 0x00000690 = 0x00000000:0x00000000 (MSR_LASTBRANCH_16_FROM_IP)
 MSR 0x00000691 = 0x00000000:0x00000000 (MSR_LASTBRANCH_17_FROM_IP)
 MSR 0x00000692 = 0x00000000:0x00000000 (MSR_LASTBRANCH_18_FROM_IP)
 MSR 0x00000693 = 0x00000000:0x00000000 (MSR_LASTBRANCH_19_FROM_IP)
 MSR 0x00000694 = 0x00000000:0x00000000 (MSR_LASTBRANCH_20_FROM_IP)
 MSR 0x00000695 = 0x00000000:0x00000000 (MSR_LASTBRANCH_21_FROM_IP)
 MSR 0x00000696 = 0x00000000:0x00000000 (MSR_LASTBRANCH_22_FROM_IP)
 MSR 0x00000697 = 0x00000000:0x00000000 (MSR_LASTBRANCH_23_FROM_IP)
 MSR 0x00000698 = 0x00000000:0x00000000 (MSR_LASTBRANCH_24_FROM_IP)
 MSR 0x00000699 = 0x00000000:0x00000000 (MSR_LASTBRANCH_25_FROM_IP)
 MSR 0x0000069A = 0x00000000:0x00000000 (MSR_LASTBRANCH_26_FROM_IP)
 MSR 0x0000069B = 0x00000000:0x00000000 (MSR_LASTBRANCH_27_FROM_IP)
 MSR 0x0000069C = 0x00000000:0x00000000 (MSR_LASTBRANCH_28_FROM_IP)
 MSR 0x0000069D = 0x00000000:0x00000000 (MSR_LASTBRANCH_29_FROM_IP)
 MSR 0x0000069E = 0x00000000:0x00000000 (MSR_LASTBRANCH_30_FROM_IP)
 MSR 0x0000069F = 0x00000000:0x00000000 (MSR_LASTBRANCH_31_FROM_IP)
 MSR 0x000006D0 = 0x00000000:0x00000000 (MSR_LASTBRANCH_16_TO_IP)
 MSR 0x000006D1 = 0x00000000:0x00000000 (MSR_LASTBRANCH_17_TO_IP)
 MSR 0x000006D2 = 0x00000000:0x00000000 (MSR_LASTBRANCH_18_TO_IP)
 MSR 0x000006D3 = 0x00000000:0x00000000 (MSR_LASTBRANCH_19_TO_IP)
 MSR 0x000006D4 = 0x00000000:0x00000000 (MSR_LASTBRANCH_20_TO_IP)
 MSR 0x000006D5 = 0x00000000:0x00000000 (MSR_LASTBRANCH_21_TO_IP)
 MSR 0x000006D6 = 0x00000000:0x00000000 (MSR_LASTBRANCH_22_TO_IP)
 MSR 0x000006D7 = 0x00000000:0x00000000 (MSR_LASTBRANCH_23_TO_IP)
 MSR 0x000006D8 = 0x00000000:0x00000000 (MSR_LASTBRANCH_24_TO_IP)
 MSR 0x000006D9 = 0x00000000:0x00000000 (MSR_LASTBRANCH_25_TO_IP)
 MSR 0x000006DA = 0x00000000:0x00000000 (MSR_LASTBRANCH_26_TO_IP)
 MSR 0x000006DB = 0x00000000:0x00000000 (MSR_LASTBRANCH_27_TO_IP)
 MSR 0x000006DC = 0x00000000:0x00000000 (MSR_LASTBRANCH_28_TO_IP)
 MSR 0x000006DD = 0x00000000:0x00000000 (MSR_LASTBRANCH_29_TO_IP)
 MSR 0x000006DE = 0x00000000:0x00000000 (MSR_LASTBRANCH_30_TO_IP)
 MSR 0x000006DF = 0x00000000:0x00000000 (MSR_LASTBRANCH_31_TO_IP)
 MSR 0x000006E0 = 0x00000285:0x55AF4E7C (IA32_TSC_DEADLINE)
 MSR 0x00000771 = 0x00000000:0x010B1A2D (IA32_HWP_CAPABILITIES)
 MSR 0x00000773 = 0x00000000:0x00000000 (IA32_HWP_INTERRUPT)
 MSR 0x00000774 = 0x00000000:0x80002D08 (IA32_HWP_REQUEST)
 MSR 0x00000777 = 0x00000000:0x00000000 (IA32_HWP_STATUS)
 MSR 0x00000D90 = 0x00000000:0x00000000 (IA32_BNDCFGS)
 MSR 0x00000DA0 = 0x00000000:0x00000000 (IA32_XSS)
 MSR 0x00000DB1 = 0x00000000:0x00000001 (IA32_PM_CTL1)
 MSR 0x00000DB2 = 0x00000000:0x00000000 (IA32_THREAD_STALL)
 MSR 0x00000DC0 = 0x00000000:0x00000000 (IA32_LBR_INFO_0)
 MSR 0x00000DC1 = 0x00000000:0x00000000 (IA32_LBR_INFO_1)
 MSR 0x00000DC2 = 0x00000000:0x00000000 (IA32_LBR_INFO_2)
 MSR 0x00000DC3 = 0x00000000:0x00000000 (IA32_LBR_INFO_3)
 MSR 0x00000DC4 = 0x00000000:0x00000000 (IA32_LBR_INFO_4)
 MSR 0x00000DC5 = 0x00000000:0x00000000 (IA32_LBR_INFO_5)
 MSR 0x00000DC6 = 0x00000000:0x00000000 (IA32_LBR_INFO_6)
 MSR 0x00000DC7 = 0x00000000:0x00000000 (IA32_LBR_INFO_7)
 MSR 0x00000DC8 = 0x00000000:0x00000000 (IA32_LBR_INFO_8)
 MSR 0x00000DC9 = 0x00000000:0x00000000 (IA32_LBR_INFO_9)
 MSR 0x00000DCA = 0x00000000:0x00000000 (IA32_LBR_INFO_10)
 MSR 0x00000DCB = 0x00000000:0x00000000 (IA32_LBR_INFO_11)
 MSR 0x00000DCC = 0x00000000:0x00000000 (IA32_LBR_INFO_12)
 MSR 0x00000DCD = 0x00000000:0x00000000 (IA32_LBR_INFO_13)
 MSR 0x00000DCE = 0x00000000:0x00000000 (IA32_LBR_INFO_14)
 MSR 0x00000DCF = 0x00000000:0x00000000 (IA32_LBR_INFO_15)
 MSR 0x00000DD0 = 0x00000000:0x00000000 (IA32_LBR_INFO_16)
 MSR 0x00000DD1 = 0x00000000:0x00000000 (IA32_LBR_INFO_17)
 MSR 0x00000DD2 = 0x00000000:0x00000000 (IA32_LBR_INFO_18)
 MSR 0x00000DD3 = 0x00000000:0x00000000 (IA32_LBR_INFO_19)
 MSR 0x00000DD4 = 0x00000000:0x00000000 (IA32_LBR_INFO_20)
 MSR 0x00000DD5 = 0x00000000:0x00000000 (IA32_LBR_INFO_21)
 MSR 0x00000DD6 = 0x00000000:0x00000000 (IA32_LBR_INFO_22)
 MSR 0x00000DD7 = 0x00000000:0x00000000 (IA32_LBR_INFO_23)
 MSR 0x00000DD8 = 0x00000000:0x00000000 (IA32_LBR_INFO_24)
 MSR 0x00000DD9 = 0x00000000:0x00000000 (IA32_LBR_INFO_25)
 MSR 0x00000DDA = 0x00000000:0x00000000 (IA32_LBR_INFO_26)
 MSR 0x00000DDB = 0x00000000:0x00000000 (IA32_LBR_INFO_27)
 MSR 0x00000DDC = 0x00000000:0x00000000 (IA32_LBR_INFO_28)
 MSR 0x00000DDD = 0x00000000:0x00000000 (IA32_LBR_INFO_29)
 MSR 0x00000DDE = 0x00000000:0x00000000 (IA32_LBR_INFO_30)
 MSR 0x00000DDF = 0x00000000:0x00000000 (IA32_LBR_INFO_31)

====================== UNIQUE MSRs  (core 9) ======================
 MSR 0x00000000 = 0x00000000:0x00000FFF (IA32_P5_MC_ADDR)
 MSR 0x00000001 = 0x00000000:0x00000000 (IA32_P5_MC_TYPE)
 MSR 0x00000006 = 0x00000000:0x00000040 (IA32_MONITOR_FILTER_SIZE)
 MSR 0x00000010 = 0x00000285:0x5570AF86 (IA32_TIME_STAMP_COUNTER)
 MSR 0x0000001B = 0x00000000:0xFEE00C00 (IA32_APIC_BASE)
 MSR 0x00000034 = 0x00000000:0x0000066C (MSR_SMI_COUNT)
 MSR 0x0000003A = 0x00000000:0x00020005 (IA32_FEATURE_CONTROL)
 MSR 0x0000008B = 0x000000DE:0x00000000 (IA32_BIOS_SIGN_ID)
 MSR 0x000000C1 = 0x00000000:0x00000000 (IA32_PMC0)
 MSR 0x000000C2 = 0x00000000:0x00000000 (IA32_PMC1)
 MSR 0x000000C3 = 0x00000000:0x00000000 (IA32_PMC2)
 MSR 0x000000C4 = 0x00000000:0x00000000 (IA32_PMC3)
 MSR 0x000000E2 = 0x00000000:0x1C008007 (MSR_PKG_CST_CONFIG_CONTROL)
 MSR 0x000000E4 = 0x00000000:0x00051814 (MSR_PMG_IO_CAPTURE_BASE)
 MSR 0x000000E7 = 0x0000003B:0x5BCD7F21 (IA32_MPERF)
 MSR 0x000000E8 = 0x00000044:0xB8A7B081 (IA32_APERF)
 MSR 0x000000FE = 0x00000000:0x00001D0A (IA32_MTRRCAP)
 MSR 0x0000013C = 0x00000000:0x00000001 (MSR_FEATURE_CONFIG)
 MSR 0x00000174 = 0x00000000:0x00000010 (IA32_SYSENTER_CS)
 MSR 0x00000175 = 0xFFFFFE00:0x001E0000 (IA32_SYSENTER_ESP)
 MSR 0x00000176 = 0xFFFFFFFF:0x8B201580 (IA32_SYSENTER_EIP)
 MSR 0x00000179 = 0x00000000:0x00000C0C (IA32_MCG_CAP)
 MSR 0x0000017A = 0x00000000:0x00000000 (IA32_MCG_STATUS)
 MSR 0x00000186 = 0x00000000:0x00000000 (IA32_PERFEVTSEL0)
 MSR 0x00000187 = 0x00000000:0x00000000 (IA32_PERFEVTSEL1)
 MSR 0x00000188 = 0x00000000:0x00000000 (IA32_PERFEVTSEL2)
 MSR 0x00000189 = 0x00000000:0x00000000 (IA32_PERFEVTSEL3)
 MSR 0x00000199 = 0x00000000:0x00000800 (IA32_PERF_CTL)
 MSR 0x0000019A = 0x00000000:0x00000000 (IA32_CLOCK_MODULATION)
 MSR 0x0000019B = 0x00000000:0x00000013 (IA32_THERM_INTERRUPT)
 MSR 0x0000019C = 0x00000000:0x88170802 (IA32_THERM_STATUS)
 MSR 0x000001A0 = 0x00000000:0x00850089 (IA32_MISC_ENABLE)
 MSR 0x000001A4 = 0x00000000:0x00000000 (IA32_MISC_FEATURE_CONTROL)
 MSR 0x000001A6 = 0x00000000:0x00000000 (MSR_OFFCORE_RSP_0)
 MSR 0x000001A7 = 0x00000000:0x00000000 (MSR_OFFCORE_RSP_1)
 MSR 0x000001C8 = 0x00000000:0x00000000 (MSR_LBR_SELECT)
 MSR 0x000001C9 = 0x00000000:0x00000000 (MSR_LASTBRANCH_TOS)
 MSR 0x000001D9 = 0x00000000:0x00000000 (IA32_DEBUGCTL)
 MSR 0x000001DD = 0x00000000:0x00000000 (MSR_LER_FROM_LIP)
 MSR 0x000001DE = 0x00000000:0x00000000 (MSR_LER_TO_LIP)
 MSR 0x000001F2 = 0x00000000:0x9A000006 (IA32_SMRR_PHYSBASE)
 MSR 0x000001F3 = 0x00000000:0xFF000800 (IA32_SMRR_PHYSMASK)
 MSR 0x000001F4 = 0x00000000:0x99F00006 (MSR_PRMRR_PHYS_BASE)
 MSR 0x000001F5 = 0x0000007F:0xFFF00C00 (MSR_PRMRR_PHYS_MASK)
 MSR 0x000001FB = 0x00000000:0x000000E1 (MSR_PRMRR_VALID_CONFIG)
 MSR 0x000001FC = 0x00000000:0x002C005D (MSR_POWER_CTL)
 MSR 0x00000200 = 0x00000000:0xC0000000 (IA32_MTRR_PHYSBASE0)
 MSR 0x00000201 = 0x0000007F:0xC0000800 (IA32_MTRR_PHYSBASE0)
 MSR 0x00000202 = 0x00000000:0xA0000000 (IA32_MTRR_PHYSBASE1)
 MSR 0x00000203 = 0x0000007F:0xE0000800 (IA32_MTRR_PHYSBASE1)
 MSR 0x00000204 = 0x00000000:0x9C000000 (IA32_MTRR_PHYSBASE2)
 MSR 0x00000205 = 0x0000007F:0xFC000800 (IA32_MTRR_PHYSBASE2)
 MSR 0x00000206 = 0x00000000:0x9B000000 (IA32_MTRR_PHYSBASE3)
 MSR 0x00000207 = 0x0000007F:0xFF000800 (IA32_MTRR_PHYSBASE3)
 MSR 0x00000208 = 0x00000020:0x00000000 (IA32_MTRR_PHYSBASE4)
 MSR 0x00000209 = 0x00000060:0x00000800 (IA32_MTRR_PHYSBASE4)
 MSR 0x0000020A = 0x00000010:0x00000000 (IA32_MTRR_PHYSBASE5)
 MSR 0x0000020B = 0x00000070:0x00000800 (IA32_MTRR_PHYSBASE5)
 MSR 0x0000020C = 0x00000040:0x00000000 (IA32_MTRR_PHYSBASE6)
 MSR 0x0000020D = 0x00000040:0x00000800 (IA32_MTRR_PHYSBASE6)
 MSR 0x0000020E = 0x00000004:0x00000006 (IA32_MTRR_PHYSBASE7)
 MSR 0x0000020F = 0x00000000:0x00000000 (IA32_MTRR_PHYSBASE7)
 MSR 0x00000210 = 0x00000008:0x00000006 (IA32_MTRR_PHYSBASE8)
 MSR 0x00000211 = 0x00000000:0x00000000 (IA32_MTRR_PHYSBASE8)
 MSR 0x00000212 = 0x00000000:0x00000000 (IA32_MTRR_PHYSBASE9)
 MSR 0x00000213 = 0x00000000:0x00000000 (IA32_MTRR_PHYSBASE9)
 MSR 0x00000250 = 0x06060606:0x06060606 (IA32_MTRR_FIX64K_00000)
 MSR 0x00000258 = 0x06060606:0x06060606 (IA32_MTRR_FIX16K_80000)
 MSR 0x00000259 = 0x00000000:0x00000000 (IA32_MTRR_FIX16K_A0000)
 MSR 0x00000268 = 0x05050505:0x05050505 (IA32_MTRR_FIX4K_C0000)
 MSR 0x00000269 = 0x05050505:0x05050505 (IA32_MTRR_FIX4K_C8000)
 MSR 0x0000026A = 0x05050505:0x05050505 (IA32_MTRR_FIX4K_D0000)
 MSR 0x0000026B = 0x05050505:0x05050505 (IA32_MTRR_FIX4K_D8000)
 MSR 0x0000026C = 0x05050505:0x05050505 (IA32_MTRR_FIX4K_E0000)
 MSR 0x0000026D = 0x05050505:0x05050505 (IA32_MTRR_FIX4K_E8000)
 MSR 0x0000026E = 0x05050505:0x05050505 (IA32_MTRR_FIX4K_F0000)
 MSR 0x0000026F = 0x05050505:0x05050505 (IA32_MTRR_FIX4K_F8000)
 MSR 0x00000277 = 0x04070506:0x00070106 (IA32_PAT)
 MSR 0x00000280 = 0x00000000:0x40000001 (IA32_MC0_CTL2)
 MSR 0x00000281 = 0x00000000:0x40000001 (IA32_MC1_CTL2)
 MSR 0x00000282 = 0x00000000:0x40000001 (IA32_MC2_CTL2)
 MSR 0x00000283 = 0x00000000:0x40000001 (IA32_MC3_CTL2)
 MSR 0x000002FF = 0x00000000:0x00000C06 (IA32_MTRR_DEF_TYPE)
 MSR 0x00000309 = 0x00000000:0x00000000 (IA32_FIXED_CTR0)
 MSR 0x0000030A = 0x0000FFFC:0x660D5F4E (IA32_FIXED_CTR1)
 MSR 0x0000030B = 0x00000000:0x00000000 (IA32_FIXED_CTR2)
 MSR 0x00000345 = 0x00000000:0x000033C5 (IA32_PERF_CAPABILITIES)
 MSR 0x0000038D = 0x00000000:0x000000B0 (IA32_FIXED_CTR_CTRL)
 MSR 0x0000038E = 0x00000000:0x00000000 (IA32_PERF_GLOBAL_STATUS)
 MSR 0x0000038F = 0x00000007:0x0000000F (IA32_PERF_GLOBAL_CTRL)
 MSR 0x00000390 = 0x00000000:0x00000000 (IA32_PERF_GLOBAL_STATUS_RESET)
 MSR 0x00000391 = 0x00000000:0x00000000 (IA32_PERF_GLOBAL_STATUS_SET)
 MSR 0x000003F1 = 0x00000000:0x00000000 (MSR_PEBS_ENABLE)
 MSR 0x000003F6 = 0x00000000:0x0000FFFF (MSR_PEBS_LD_LAT)
 MSR 0x000003F7 = 0x00000000:0x00000800 (MSR_PEBS_FRONTEND)
 MSR 0x000003FC = 0x00000002:0x3E20E9D2 (MSR_CORE_C3_RESIDENCY)
 MSR 0x000003FD = 0x00000016:0x274CDBA4 (MSR_CORE_C6_RESIDENCY)
 MSR 0x000003FE = 0x000001A7:0xD2B93300 (MSR_CORE_C7_RESIDENCY)
 MSR 0x00000400 = 0x00000000:0x00000FFF (IA32_MC0_CTL)
 MSR 0x00000401 = 0x00000000:0x00000000 (IA32_MC0_STATUS)
 MSR 0x00000402 = 0x00000000:0x00000000 (IA32_MC0_ADDR)
 MSR 0x00000403 = 0x00000000:0x00000000 (IA32_MC0_MISC)
 MSR 0x00000404 = 0x00000000:0x0000000F (IA32_MC1_CTL)
 MSR 0x00000405 = 0x00000000:0x00000000 (IA32_MC1_STATUS)
 MSR 0x00000406 = 0x00000000:0x00000000 (IA32_MC1_ADDR)
 MSR 0x00000407 = 0x00000000:0x00000000 (IA32_MC1_MISC)
 MSR 0x00000408 = 0x00000000:0x0000000F (IA32_MC2_CTL)
 MSR 0x00000409 = 0x00000000:0x00000000 (IA32_MC2_STATUS)
 MSR 0x0000040A = 0x00000000:0x00000000 (IA32_MC2_ADDR)
 MSR 0x0000040C = 0x00000000:0x0000001F (IA32_MC3_CTL)
 MSR 0x0000040D = 0x00000000:0x00000000 (IA32_MC3_STATUS)
 MSR 0x0000040E = 0x00000000:0x00000000 (IA32_MC3_ADDR)
 MSR 0x00000410 = 0x00000000:0x0000003F (IA32_MC4_CTL)
 MSR 0x00000411 = 0x00000000:0x00000000 (IA32_MC4_STATUS)
 MSR 0x00000480 = 0x00DA0400:0x00000004 (IA32_VMX_BASIC)
 MSR 0x00000481 = 0x0000007F:0x00000016 (IA32_VMX_PINBASED_CTLS)
 MSR 0x00000482 = 0xFFF9FFFE:0x0401E172 (IA32_VMX_PROCBASED_CTLS)
 MSR 0x00000483 = 0x01FFFFFF:0x00036DFF (IA32_VMX_EXIT_CTLS)
 MSR 0x00000484 = 0x0003FFFF:0x000011FF (IA32_VMX_ENTRY_CTLS)
 MSR 0x00000485 = 0x00000000:0x7004C1E7 (IA32_VMX_MISC)
 MSR 0x00000486 = 0x00000000:0x80000021 (IA32_VMX_CR0_FIXED0)
 MSR 0x00000487 = 0x00000000:0xFFFFFFFF (IA32_VMX_CR0_FIXED1)
 MSR 0x00000488 = 0x00000000:0x00002000 (IA32_VMX_CR4_FIXED0)
 MSR 0x00000489 = 0x00000000:0x003727FF (IA32_VMX_CR4_FIXED1)
 MSR 0x0000048A = 0x00000000:0x0000002E (IA32_VMX_VMCS_ENUM)
 MSR 0x0000048B = 0x005FBCFF:0x00000000 (IA32_VMX_PROCBASED_CTLS2)
 MSR 0x0000048C = 0x00000F01:0x06734141 (IA32_VMX_EPT_VPID_ENUM)
 MSR 0x0000048D = 0x0000007F:0x00000016 (IA32_VMX_TRUE_PINBASED_CTLS)
 MSR 0x0000048E = 0xFFF9FFFE:0x04006172 (IA32_VMX_TRUE_PROCBASED_CTLS)
 MSR 0x0000048F = 0x01FFFFFF:0x00036DFB (IA32_VMX_TRUE_EXIT_CTLS)
 MSR 0x00000490 = 0x0003FFFF:0x000011FB (IA32_VMX_TRUE_ENTRY_CTLS)
 MSR 0x000004C1 = 0x00000000:0x00000000 (IA32_A_PMC0)
 MSR 0x000004C2 = 0x00000000:0x00000000 (IA32_A_PMC1)
 MSR 0x000004C3 = 0x00000000:0x00000000 (IA32_A_PMC2)
 MSR 0x000004C4 = 0x00000000:0x00000000 (IA32_A_PMC3)
 MSR 0x00000500 = 0x0000000E:0x00000000 (IA32_SGX_SVN_STATUS)
 MSR 0x00000560 = 0x00000000:0x00000000 (IA32_RTIT_OUTPUT_BASE)
 MSR 0x00000561 = 0x00000000:0x0000007F (IA32_RTIT_OUTPUT_MASK_PTRS)
 MSR 0x00000570 = 0x00000000:0x00000000 (IA32_RTIT_CTL)
 MSR 0x00000571 = 0x00000000:0x00000000 (IA32_RTIT_STATUS)
 MSR 0x00000572 = 0x00000000:0x00000000 (IA32_RTIT_CR3_MATCH)
 MSR 0x00000580 = 0x00000000:0x00000000 (IA32_RTIT_ADDR0_A)
 MSR 0x00000581 = 0x00000000:0x00000000 (IA32_RTIT_ADDR0_B)
 MSR 0x00000582 = 0x00000000:0x00000000 (IA32_RTIT_ADDR1_A)
 MSR 0x00000583 = 0x00000000:0x00000000 (IA32_RTIT_ADDR1_B)
 MSR 0x00000600 = 0xFFFFFE00:0x001F2000 (IA32_DS_AREA)
 MSR 0x0000064E = 0x00000041:0x16DE5983 (MSR_PPERF)
 MSR 0x00000653 = 0x00000000:0x00000000 (MSR_CORE_HDC_RESIDENCY)
 MSR 0x00000690 = 0x00000000:0x00000000 (MSR_LASTBRANCH_16_FROM_IP)
 MSR 0x00000691 = 0x00000000:0x00000000 (MSR_LASTBRANCH_17_FROM_IP)
 MSR 0x00000692 = 0x00000000:0x00000000 (MSR_LASTBRANCH_18_FROM_IP)
 MSR 0x00000693 = 0x00000000:0x00000000 (MSR_LASTBRANCH_19_FROM_IP)
 MSR 0x00000694 = 0x00000000:0x00000000 (MSR_LASTBRANCH_20_FROM_IP)
 MSR 0x00000695 = 0x00000000:0x00000000 (MSR_LASTBRANCH_21_FROM_IP)
 MSR 0x00000696 = 0x00000000:0x00000000 (MSR_LASTBRANCH_22_FROM_IP)
 MSR 0x00000697 = 0x00000000:0x00000000 (MSR_LASTBRANCH_23_FROM_IP)
 MSR 0x00000698 = 0x00000000:0x00000000 (MSR_LASTBRANCH_24_FROM_IP)
 MSR 0x00000699 = 0x00000000:0x00000000 (MSR_LASTBRANCH_25_FROM_IP)
 MSR 0x0000069A = 0x00000000:0x00000000 (MSR_LASTBRANCH_26_FROM_IP)
 MSR 0x0000069B = 0x00000000:0x00000000 (MSR_LASTBRANCH_27_FROM_IP)
 MSR 0x0000069C = 0x00000000:0x00000000 (MSR_LASTBRANCH_28_FROM_IP)
 MSR 0x0000069D = 0x00000000:0x00000000 (MSR_LASTBRANCH_29_FROM_IP)
 MSR 0x0000069E = 0x00000000:0x00000000 (MSR_LASTBRANCH_30_FROM_IP)
 MSR 0x0000069F = 0x00000000:0x00000000 (MSR_LASTBRANCH_31_FROM_IP)
 MSR 0x000006D0 = 0x00000000:0x00000000 (MSR_LASTBRANCH_16_TO_IP)
 MSR 0x000006D1 = 0x00000000:0x00000000 (MSR_LASTBRANCH_17_TO_IP)
 MSR 0x000006D2 = 0x00000000:0x00000000 (MSR_LASTBRANCH_18_TO_IP)
 MSR 0x000006D3 = 0x00000000:0x00000000 (MSR_LASTBRANCH_19_TO_IP)
 MSR 0x000006D4 = 0x00000000:0x00000000 (MSR_LASTBRANCH_20_TO_IP)
 MSR 0x000006D5 = 0x00000000:0x00000000 (MSR_LASTBRANCH_21_TO_IP)
 MSR 0x000006D6 = 0x00000000:0x00000000 (MSR_LASTBRANCH_22_TO_IP)
 MSR 0x000006D7 = 0x00000000:0x00000000 (MSR_LASTBRANCH_23_TO_IP)
 MSR 0x000006D8 = 0x00000000:0x00000000 (MSR_LASTBRANCH_24_TO_IP)
 MSR 0x000006D9 = 0x00000000:0x00000000 (MSR_LASTBRANCH_25_TO_IP)
 MSR 0x000006DA = 0x00000000:0x00000000 (MSR_LASTBRANCH_26_TO_IP)
 MSR 0x000006DB = 0x00000000:0x00000000 (MSR_LASTBRANCH_27_TO_IP)
 MSR 0x000006DC = 0x00000000:0x00000000 (MSR_LASTBRANCH_28_TO_IP)
 MSR 0x000006DD = 0x00000000:0x00000000 (MSR_LASTBRANCH_29_TO_IP)
 MSR 0x000006DE = 0x00000000:0x00000000 (MSR_LASTBRANCH_30_TO_IP)
 MSR 0x000006DF = 0x00000000:0x00000000 (MSR_LASTBRANCH_31_TO_IP)
 MSR 0x000006E0 = 0x00000285:0x55AF4DF0 (IA32_TSC_DEADLINE)
 MSR 0x00000771 = 0x00000000:0x010B1A2D (IA32_HWP_CAPABILITIES)
 MSR 0x00000773 = 0x00000000:0x00000000 (IA32_HWP_INTERRUPT)
 MSR 0x00000774 = 0x00000000:0x80002D08 (IA32_HWP_REQUEST)
 MSR 0x00000777 = 0x00000000:0x00000000 (IA32_HWP_STATUS)
 MSR 0x00000D90 = 0x00000000:0x00000000 (IA32_BNDCFGS)
 MSR 0x00000DA0 = 0x00000000:0x00000000 (IA32_XSS)
 MSR 0x00000DB1 = 0x00000000:0x00000001 (IA32_PM_CTL1)
 MSR 0x00000DB2 = 0x00000000:0x00000000 (IA32_THREAD_STALL)
 MSR 0x00000DC0 = 0x00000000:0x00000000 (IA32_LBR_INFO_0)
 MSR 0x00000DC1 = 0x00000000:0x00000000 (IA32_LBR_INFO_1)
 MSR 0x00000DC2 = 0x00000000:0x00000000 (IA32_LBR_INFO_2)
 MSR 0x00000DC3 = 0x00000000:0x00000000 (IA32_LBR_INFO_3)
 MSR 0x00000DC4 = 0x00000000:0x00000000 (IA32_LBR_INFO_4)
 MSR 0x00000DC5 = 0x00000000:0x00000000 (IA32_LBR_INFO_5)
 MSR 0x00000DC6 = 0x00000000:0x00000000 (IA32_LBR_INFO_6)
 MSR 0x00000DC7 = 0x00000000:0x00000000 (IA32_LBR_INFO_7)
 MSR 0x00000DC8 = 0x00000000:0x00000000 (IA32_LBR_INFO_8)
 MSR 0x00000DC9 = 0x00000000:0x00000000 (IA32_LBR_INFO_9)
 MSR 0x00000DCA = 0x00000000:0x00000000 (IA32_LBR_INFO_10)
 MSR 0x00000DCB = 0x00000000:0x00000000 (IA32_LBR_INFO_11)
 MSR 0x00000DCC = 0x00000000:0x00000000 (IA32_LBR_INFO_12)
 MSR 0x00000DCD = 0x00000000:0x00000000 (IA32_LBR_INFO_13)
 MSR 0x00000DCE = 0x00000000:0x00000000 (IA32_LBR_INFO_14)
 MSR 0x00000DCF = 0x00000000:0x00000000 (IA32_LBR_INFO_15)
 MSR 0x00000DD0 = 0x00000000:0x00000000 (IA32_LBR_INFO_16)
 MSR 0x00000DD1 = 0x00000000:0x00000000 (IA32_LBR_INFO_17)
 MSR 0x00000DD2 = 0x00000000:0x00000000 (IA32_LBR_INFO_18)
 MSR 0x00000DD3 = 0x00000000:0x00000000 (IA32_LBR_INFO_19)
 MSR 0x00000DD4 = 0x00000000:0x00000000 (IA32_LBR_INFO_20)
 MSR 0x00000DD5 = 0x00000000:0x00000000 (IA32_LBR_INFO_21)
 MSR 0x00000DD6 = 0x00000000:0x00000000 (IA32_LBR_INFO_22)
 MSR 0x00000DD7 = 0x00000000:0x00000000 (IA32_LBR_INFO_23)
 MSR 0x00000DD8 = 0x00000000:0x00000000 (IA32_LBR_INFO_24)
 MSR 0x00000DD9 = 0x00000000:0x00000000 (IA32_LBR_INFO_25)
 MSR 0x00000DDA = 0x00000000:0x00000000 (IA32_LBR_INFO_26)
 MSR 0x00000DDB = 0x00000000:0x00000000 (IA32_LBR_INFO_27)
 MSR 0x00000DDC = 0x00000000:0x00000000 (IA32_LBR_INFO_28)
 MSR 0x00000DDD = 0x00000000:0x00000000 (IA32_LBR_INFO_29)
 MSR 0x00000DDE = 0x00000000:0x00000000 (IA32_LBR_INFO_30)
 MSR 0x00000DDF = 0x00000000:0x00000000 (IA32_LBR_INFO_31)

====================== UNIQUE MSRs  (core 10) ======================
 MSR 0x00000000 = 0x00000000:0x00000FFF (IA32_P5_MC_ADDR)
 MSR 0x00000001 = 0x00000000:0x00000000 (IA32_P5_MC_TYPE)
 MSR 0x00000006 = 0x00000000:0x00000040 (IA32_MONITOR_FILTER_SIZE)
 MSR 0x00000010 = 0x00000285:0x558EFE88 (IA32_TIME_STAMP_COUNTER)
 MSR 0x0000001B = 0x00000000:0xFEE00C00 (IA32_APIC_BASE)
 MSR 0x00000034 = 0x00000000:0x0000066C (MSR_SMI_COUNT)
 MSR 0x0000003A = 0x00000000:0x00020005 (IA32_FEATURE_CONTROL)
 MSR 0x0000008B = 0x000000DE:0x00000000 (IA32_BIOS_SIGN_ID)
 MSR 0x000000C1 = 0x00000000:0x00000000 (IA32_PMC0)
 MSR 0x000000C2 = 0x00000000:0x00000000 (IA32_PMC1)
 MSR 0x000000C3 = 0x00000000:0x00000000 (IA32_PMC2)
 MSR 0x000000C4 = 0x00000000:0x00000000 (IA32_PMC3)
 MSR 0x000000E2 = 0x00000000:0x1C008007 (MSR_PKG_CST_CONFIG_CONTROL)
 MSR 0x000000E4 = 0x00000000:0x00051814 (MSR_PMG_IO_CAPTURE_BASE)
 MSR 0x000000E7 = 0x0000003C:0x883EEB10 (IA32_MPERF)
 MSR 0x000000E8 = 0x00000046:0x01DFE9F2 (IA32_APERF)
 MSR 0x000000FE = 0x00000000:0x00001D0A (IA32_MTRRCAP)
 MSR 0x0000013C = 0x00000000:0x00000001 (MSR_FEATURE_CONFIG)
 MSR 0x00000174 = 0x00000000:0x00000010 (IA32_SYSENTER_CS)
 MSR 0x00000175 = 0xFFFFFE00:0x00215000 (IA32_SYSENTER_ESP)
 MSR 0x00000176 = 0xFFFFFFFF:0x8B201580 (IA32_SYSENTER_EIP)
 MSR 0x00000179 = 0x00000000:0x00000C0C (IA32_MCG_CAP)
 MSR 0x0000017A = 0x00000000:0x00000000 (IA32_MCG_STATUS)
 MSR 0x00000186 = 0x00000000:0x00000000 (IA32_PERFEVTSEL0)
 MSR 0x00000187 = 0x00000000:0x00000000 (IA32_PERFEVTSEL1)
 MSR 0x00000188 = 0x00000000:0x00000000 (IA32_PERFEVTSEL2)
 MSR 0x00000189 = 0x00000000:0x00000000 (IA32_PERFEVTSEL3)
 MSR 0x00000199 = 0x00000000:0x00000800 (IA32_PERF_CTL)
 MSR 0x0000019A = 0x00000000:0x00000000 (IA32_CLOCK_MODULATION)
 MSR 0x0000019B = 0x00000000:0x00000013 (IA32_THERM_INTERRUPT)
 MSR 0x0000019C = 0x00000000:0x88150802 (IA32_THERM_STATUS)
 MSR 0x000001A0 = 0x00000000:0x00850089 (IA32_MISC_ENABLE)
 MSR 0x000001A4 = 0x00000000:0x00000000 (IA32_MISC_FEATURE_CONTROL)
 MSR 0x000001A6 = 0x00000000:0x00000000 (MSR_OFFCORE_RSP_0)
 MSR 0x000001A7 = 0x00000000:0x00000000 (MSR_OFFCORE_RSP_1)
 MSR 0x000001C8 = 0x00000000:0x00000000 (MSR_LBR_SELECT)
 MSR 0x000001C9 = 0x00000000:0x00000000 (MSR_LASTBRANCH_TOS)
 MSR 0x000001D9 = 0x00000000:0x00000000 (IA32_DEBUGCTL)
 MSR 0x000001DD = 0x00000000:0x00000000 (MSR_LER_FROM_LIP)
 MSR 0x000001DE = 0x00000000:0x00000000 (MSR_LER_TO_LIP)
 MSR 0x000001F2 = 0x00000000:0x9A000006 (IA32_SMRR_PHYSBASE)
 MSR 0x000001F3 = 0x00000000:0xFF000800 (IA32_SMRR_PHYSMASK)
 MSR 0x000001F4 = 0x00000000:0x99F00006 (MSR_PRMRR_PHYS_BASE)
 MSR 0x000001F5 = 0x0000007F:0xFFF00C00 (MSR_PRMRR_PHYS_MASK)
 MSR 0x000001FB = 0x00000000:0x000000E1 (MSR_PRMRR_VALID_CONFIG)
 MSR 0x000001FC = 0x00000000:0x002C005D (MSR_POWER_CTL)
 MSR 0x00000200 = 0x00000000:0xC0000000 (IA32_MTRR_PHYSBASE0)
 MSR 0x00000201 = 0x0000007F:0xC0000800 (IA32_MTRR_PHYSBASE0)
 MSR 0x00000202 = 0x00000000:0xA0000000 (IA32_MTRR_PHYSBASE1)
 MSR 0x00000203 = 0x0000007F:0xE0000800 (IA32_MTRR_PHYSBASE1)
 MSR 0x00000204 = 0x00000000:0x9C000000 (IA32_MTRR_PHYSBASE2)
 MSR 0x00000205 = 0x0000007F:0xFC000800 (IA32_MTRR_PHYSBASE2)
 MSR 0x00000206 = 0x00000000:0x9B000000 (IA32_MTRR_PHYSBASE3)
 MSR 0x00000207 = 0x0000007F:0xFF000800 (IA32_MTRR_PHYSBASE3)
 MSR 0x00000208 = 0x00000020:0x00000000 (IA32_MTRR_PHYSBASE4)
 MSR 0x00000209 = 0x00000060:0x00000800 (IA32_MTRR_PHYSBASE4)
 MSR 0x0000020A = 0x00000010:0x00000000 (IA32_MTRR_PHYSBASE5)
 MSR 0x0000020B = 0x00000070:0x00000800 (IA32_MTRR_PHYSBASE5)
 MSR 0x0000020C = 0x00000040:0x00000000 (IA32_MTRR_PHYSBASE6)
 MSR 0x0000020D = 0x00000040:0x00000800 (IA32_MTRR_PHYSBASE6)
 MSR 0x0000020E = 0x00000004:0x00000006 (IA32_MTRR_PHYSBASE7)
 MSR 0x0000020F = 0x00000000:0x00000000 (IA32_MTRR_PHYSBASE7)
 MSR 0x00000210 = 0x00000008:0x00000006 (IA32_MTRR_PHYSBASE8)
 MSR 0x00000211 = 0x00000000:0x00000000 (IA32_MTRR_PHYSBASE8)
 MSR 0x00000212 = 0x00000000:0x00000000 (IA32_MTRR_PHYSBASE9)
 MSR 0x00000213 = 0x00000000:0x00000000 (IA32_MTRR_PHYSBASE9)
 MSR 0x00000250 = 0x06060606:0x06060606 (IA32_MTRR_FIX64K_00000)
 MSR 0x00000258 = 0x06060606:0x06060606 (IA32_MTRR_FIX16K_80000)
 MSR 0x00000259 = 0x00000000:0x00000000 (IA32_MTRR_FIX16K_A0000)
 MSR 0x00000268 = 0x05050505:0x05050505 (IA32_MTRR_FIX4K_C0000)
 MSR 0x00000269 = 0x05050505:0x05050505 (IA32_MTRR_FIX4K_C8000)
 MSR 0x0000026A = 0x05050505:0x05050505 (IA32_MTRR_FIX4K_D0000)
 MSR 0x0000026B = 0x05050505:0x05050505 (IA32_MTRR_FIX4K_D8000)
 MSR 0x0000026C = 0x05050505:0x05050505 (IA32_MTRR_FIX4K_E0000)
 MSR 0x0000026D = 0x05050505:0x05050505 (IA32_MTRR_FIX4K_E8000)
 MSR 0x0000026E = 0x05050505:0x05050505 (IA32_MTRR_FIX4K_F0000)
 MSR 0x0000026F = 0x05050505:0x05050505 (IA32_MTRR_FIX4K_F8000)
 MSR 0x00000277 = 0x04070506:0x00070106 (IA32_PAT)
 MSR 0x00000280 = 0x00000000:0x40000001 (IA32_MC0_CTL2)
 MSR 0x00000281 = 0x00000000:0x40000001 (IA32_MC1_CTL2)
 MSR 0x00000282 = 0x00000000:0x40000001 (IA32_MC2_CTL2)
 MSR 0x00000283 = 0x00000000:0x40000001 (IA32_MC3_CTL2)
 MSR 0x000002FF = 0x00000000:0x00000C06 (IA32_MTRR_DEF_TYPE)
 MSR 0x00000309 = 0x00000000:0x00000000 (IA32_FIXED_CTR0)
 MSR 0x0000030A = 0x0000FFFD:0xAF6ADBC3 (IA32_FIXED_CTR1)
 MSR 0x0000030B = 0x00000000:0x00000000 (IA32_FIXED_CTR2)
 MSR 0x00000345 = 0x00000000:0x000033C5 (IA32_PERF_CAPABILITIES)
 MSR 0x0000038D = 0x00000000:0x000000B0 (IA32_FIXED_CTR_CTRL)
 MSR 0x0000038E = 0x00000000:0x00000000 (IA32_PERF_GLOBAL_STATUS)
 MSR 0x0000038F = 0x00000007:0x0000000F (IA32_PERF_GLOBAL_CTRL)
 MSR 0x00000390 = 0x00000000:0x00000000 (IA32_PERF_GLOBAL_STATUS_RESET)
 MSR 0x00000391 = 0x00000000:0x00000000 (IA32_PERF_GLOBAL_STATUS_SET)
 MSR 0x000003F1 = 0x00000000:0x00000000 (MSR_PEBS_ENABLE)
 MSR 0x000003F6 = 0x00000000:0x0000FFFF (MSR_PEBS_LD_LAT)
 MSR 0x000003F7 = 0x00000000:0x00000800 (MSR_PEBS_FRONTEND)
 MSR 0x000003FC = 0x00000002:0x29CF361E (MSR_CORE_C3_RESIDENCY)
 MSR 0x000003FD = 0x00000014:0xC29C4894 (MSR_CORE_C6_RESIDENCY)
 MSR 0x000003FE = 0x0000019D:0xDED2CF10 (MSR_CORE_C7_RESIDENCY)
 MSR 0x00000400 = 0x00000000:0x00000FFF (IA32_MC0_CTL)
 MSR 0x00000401 = 0x00000000:0x00000000 (IA32_MC0_STATUS)
 MSR 0x00000402 = 0x00000000:0x00000000 (IA32_MC0_ADDR)
 MSR 0x00000403 = 0x00000000:0x00000000 (IA32_MC0_MISC)
 MSR 0x00000404 = 0x00000000:0x0000000F (IA32_MC1_CTL)
 MSR 0x00000405 = 0x00000000:0x00000000 (IA32_MC1_STATUS)
 MSR 0x00000406 = 0x00000000:0x00000000 (IA32_MC1_ADDR)
 MSR 0x00000407 = 0x00000000:0x00000000 (IA32_MC1_MISC)
 MSR 0x00000408 = 0x00000000:0x0000000F (IA32_MC2_CTL)
 MSR 0x00000409 = 0x00000000:0x00000000 (IA32_MC2_STATUS)
 MSR 0x0000040A = 0x00000000:0x00000000 (IA32_MC2_ADDR)
 MSR 0x0000040C = 0x00000000:0x0000001F (IA32_MC3_CTL)
 MSR 0x0000040D = 0x00000000:0x00000000 (IA32_MC3_STATUS)
 MSR 0x0000040E = 0x00000000:0x00000000 (IA32_MC3_ADDR)
 MSR 0x00000410 = 0x00000000:0x0000003F (IA32_MC4_CTL)
 MSR 0x00000411 = 0x00000000:0x00000000 (IA32_MC4_STATUS)
 MSR 0x00000480 = 0x00DA0400:0x00000004 (IA32_VMX_BASIC)
 MSR 0x00000481 = 0x0000007F:0x00000016 (IA32_VMX_PINBASED_CTLS)
 MSR 0x00000482 = 0xFFF9FFFE:0x0401E172 (IA32_VMX_PROCBASED_CTLS)
 MSR 0x00000483 = 0x01FFFFFF:0x00036DFF (IA32_VMX_EXIT_CTLS)
 MSR 0x00000484 = 0x0003FFFF:0x000011FF (IA32_VMX_ENTRY_CTLS)
 MSR 0x00000485 = 0x00000000:0x7004C1E7 (IA32_VMX_MISC)
 MSR 0x00000486 = 0x00000000:0x80000021 (IA32_VMX_CR0_FIXED0)
 MSR 0x00000487 = 0x00000000:0xFFFFFFFF (IA32_VMX_CR0_FIXED1)
 MSR 0x00000488 = 0x00000000:0x00002000 (IA32_VMX_CR4_FIXED0)
 MSR 0x00000489 = 0x00000000:0x003727FF (IA32_VMX_CR4_FIXED1)
 MSR 0x0000048A = 0x00000000:0x0000002E (IA32_VMX_VMCS_ENUM)
 MSR 0x0000048B = 0x005FBCFF:0x00000000 (IA32_VMX_PROCBASED_CTLS2)
 MSR 0x0000048C = 0x00000F01:0x06734141 (IA32_VMX_EPT_VPID_ENUM)
 MSR 0x0000048D = 0x0000007F:0x00000016 (IA32_VMX_TRUE_PINBASED_CTLS)
 MSR 0x0000048E = 0xFFF9FFFE:0x04006172 (IA32_VMX_TRUE_PROCBASED_CTLS)
 MSR 0x0000048F = 0x01FFFFFF:0x00036DFB (IA32_VMX_TRUE_EXIT_CTLS)
 MSR 0x00000490 = 0x0003FFFF:0x000011FB (IA32_VMX_TRUE_ENTRY_CTLS)
 MSR 0x000004C1 = 0x00000000:0x00000000 (IA32_A_PMC0)
 MSR 0x000004C2 = 0x00000000:0x00000000 (IA32_A_PMC1)
 MSR 0x000004C3 = 0x00000000:0x00000000 (IA32_A_PMC2)
 MSR 0x000004C4 = 0x00000000:0x00000000 (IA32_A_PMC3)
 MSR 0x00000500 = 0x0000000E:0x00000000 (IA32_SGX_SVN_STATUS)
 MSR 0x00000560 = 0x00000000:0x00000000 (IA32_RTIT_OUTPUT_BASE)
 MSR 0x00000561 = 0x00000000:0x0000007F (IA32_RTIT_OUTPUT_MASK_PTRS)
 MSR 0x00000570 = 0x00000000:0x00000000 (IA32_RTIT_CTL)
 MSR 0x00000571 = 0x00000000:0x00000000 (IA32_RTIT_STATUS)
 MSR 0x00000572 = 0x00000000:0x00000000 (IA32_RTIT_CR3_MATCH)
 MSR 0x00000580 = 0x00000000:0x00000000 (IA32_RTIT_ADDR0_A)
 MSR 0x00000581 = 0x00000000:0x00000000 (IA32_RTIT_ADDR0_B)
 MSR 0x00000582 = 0x00000000:0x00000000 (IA32_RTIT_ADDR1_A)
 MSR 0x00000583 = 0x00000000:0x00000000 (IA32_RTIT_ADDR1_B)
 MSR 0x00000600 = 0xFFFFFE00:0x00227000 (IA32_DS_AREA)
 MSR 0x0000064E = 0x00000042:0x1ED6B422 (MSR_PPERF)
 MSR 0x00000653 = 0x00000000:0x00000000 (MSR_CORE_HDC_RESIDENCY)
 MSR 0x00000690 = 0x00000000:0x00000000 (MSR_LASTBRANCH_16_FROM_IP)
 MSR 0x00000691 = 0x00000000:0x00000000 (MSR_LASTBRANCH_17_FROM_IP)
 MSR 0x00000692 = 0x00000000:0x00000000 (MSR_LASTBRANCH_18_FROM_IP)
 MSR 0x00000693 = 0x00000000:0x00000000 (MSR_LASTBRANCH_19_FROM_IP)
 MSR 0x00000694 = 0x00000000:0x00000000 (MSR_LASTBRANCH_20_FROM_IP)
 MSR 0x00000695 = 0x00000000:0x00000000 (MSR_LASTBRANCH_21_FROM_IP)
 MSR 0x00000696 = 0x00000000:0x00000000 (MSR_LASTBRANCH_22_FROM_IP)
 MSR 0x00000697 = 0x00000000:0x00000000 (MSR_LASTBRANCH_23_FROM_IP)
 MSR 0x00000698 = 0x00000000:0x00000000 (MSR_LASTBRANCH_24_FROM_IP)
 MSR 0x00000699 = 0x00000000:0x00000000 (MSR_LASTBRANCH_25_FROM_IP)
 MSR 0x0000069A = 0x00000000:0x00000000 (MSR_LASTBRANCH_26_FROM_IP)
 MSR 0x0000069B = 0x00000000:0x00000000 (MSR_LASTBRANCH_27_FROM_IP)
 MSR 0x0000069C = 0x00000000:0x00000000 (MSR_LASTBRANCH_28_FROM_IP)
 MSR 0x0000069D = 0x00000000:0x00000000 (MSR_LASTBRANCH_29_FROM_IP)
 MSR 0x0000069E = 0x00000000:0x00000000 (MSR_LASTBRANCH_30_FROM_IP)
 MSR 0x0000069F = 0x00000000:0x00000000 (MSR_LASTBRANCH_31_FROM_IP)
 MSR 0x000006D0 = 0x00000000:0x00000000 (MSR_LASTBRANCH_16_TO_IP)
 MSR 0x000006D1 = 0x00000000:0x00000000 (MSR_LASTBRANCH_17_TO_IP)
 MSR 0x000006D2 = 0x00000000:0x00000000 (MSR_LASTBRANCH_18_TO_IP)
 MSR 0x000006D3 = 0x00000000:0x00000000 (MSR_LASTBRANCH_19_TO_IP)
 MSR 0x000006D4 = 0x00000000:0x00000000 (MSR_LASTBRANCH_20_TO_IP)
 MSR 0x000006D5 = 0x00000000:0x00000000 (MSR_LASTBRANCH_21_TO_IP)
 MSR 0x000006D6 = 0x00000000:0x00000000 (MSR_LASTBRANCH_22_TO_IP)
 MSR 0x000006D7 = 0x00000000:0x00000000 (MSR_LASTBRANCH_23_TO_IP)
 MSR 0x000006D8 = 0x00000000:0x00000000 (MSR_LASTBRANCH_24_TO_IP)
 MSR 0x000006D9 = 0x00000000:0x00000000 (MSR_LASTBRANCH_25_TO_IP)
 MSR 0x000006DA = 0x00000000:0x00000000 (MSR_LASTBRANCH_26_TO_IP)
 MSR 0x000006DB = 0x00000000:0x00000000 (MSR_LASTBRANCH_27_TO_IP)
 MSR 0x000006DC = 0x00000000:0x00000000 (MSR_LASTBRANCH_28_TO_IP)
 MSR 0x000006DD = 0x00000000:0x00000000 (MSR_LASTBRANCH_29_TO_IP)
 MSR 0x000006DE = 0x00000000:0x00000000 (MSR_LASTBRANCH_30_TO_IP)
 MSR 0x000006DF = 0x00000000:0x00000000 (MSR_LASTBRANCH_31_TO_IP)
 MSR 0x000006E0 = 0x00000285:0x55AF4E76 (IA32_TSC_DEADLINE)
 MSR 0x00000771 = 0x00000000:0x010B1A2D (IA32_HWP_CAPABILITIES)
 MSR 0x00000773 = 0x00000000:0x00000000 (IA32_HWP_INTERRUPT)
 MSR 0x00000774 = 0x00000000:0x80002D08 (IA32_HWP_REQUEST)
 MSR 0x00000777 = 0x00000000:0x00000000 (IA32_HWP_STATUS)
 MSR 0x00000D90 = 0x00000000:0x00000000 (IA32_BNDCFGS)
 MSR 0x00000DA0 = 0x00000000:0x00000000 (IA32_XSS)
 MSR 0x00000DB1 = 0x00000000:0x00000001 (IA32_PM_CTL1)
 MSR 0x00000DB2 = 0x00000000:0x00000000 (IA32_THREAD_STALL)
 MSR 0x00000DC0 = 0x00000000:0x00000000 (IA32_LBR_INFO_0)
 MSR 0x00000DC1 = 0x00000000:0x00000000 (IA32_LBR_INFO_1)
 MSR 0x00000DC2 = 0x00000000:0x00000000 (IA32_LBR_INFO_2)
 MSR 0x00000DC3 = 0x00000000:0x00000000 (IA32_LBR_INFO_3)
 MSR 0x00000DC4 = 0x00000000:0x00000000 (IA32_LBR_INFO_4)
 MSR 0x00000DC5 = 0x00000000:0x00000000 (IA32_LBR_INFO_5)
 MSR 0x00000DC6 = 0x00000000:0x00000000 (IA32_LBR_INFO_6)
 MSR 0x00000DC7 = 0x00000000:0x00000000 (IA32_LBR_INFO_7)
 MSR 0x00000DC8 = 0x00000000:0x00000000 (IA32_LBR_INFO_8)
 MSR 0x00000DC9 = 0x00000000:0x00000000 (IA32_LBR_INFO_9)
 MSR 0x00000DCA = 0x00000000:0x00000000 (IA32_LBR_INFO_10)
 MSR 0x00000DCB = 0x00000000:0x00000000 (IA32_LBR_INFO_11)
 MSR 0x00000DCC = 0x00000000:0x00000000 (IA32_LBR_INFO_12)
 MSR 0x00000DCD = 0x00000000:0x00000000 (IA32_LBR_INFO_13)
 MSR 0x00000DCE = 0x00000000:0x00000000 (IA32_LBR_INFO_14)
 MSR 0x00000DCF = 0x00000000:0x00000000 (IA32_LBR_INFO_15)
 MSR 0x00000DD0 = 0x00000000:0x00000000 (IA32_LBR_INFO_16)
 MSR 0x00000DD1 = 0x00000000:0x00000000 (IA32_LBR_INFO_17)
 MSR 0x00000DD2 = 0x00000000:0x00000000 (IA32_LBR_INFO_18)
 MSR 0x00000DD3 = 0x00000000:0x00000000 (IA32_LBR_INFO_19)
 MSR 0x00000DD4 = 0x00000000:0x00000000 (IA32_LBR_INFO_20)
 MSR 0x00000DD5 = 0x00000000:0x00000000 (IA32_LBR_INFO_21)
 MSR 0x00000DD6 = 0x00000000:0x00000000 (IA32_LBR_INFO_22)
 MSR 0x00000DD7 = 0x00000000:0x00000000 (IA32_LBR_INFO_23)
 MSR 0x00000DD8 = 0x00000000:0x00000000 (IA32_LBR_INFO_24)
 MSR 0x00000DD9 = 0x00000000:0x00000000 (IA32_LBR_INFO_25)
 MSR 0x00000DDA = 0x00000000:0x00000000 (IA32_LBR_INFO_26)
 MSR 0x00000DDB = 0x00000000:0x00000000 (IA32_LBR_INFO_27)
 MSR 0x00000DDC = 0x00000000:0x00000000 (IA32_LBR_INFO_28)
 MSR 0x00000DDD = 0x00000000:0x00000000 (IA32_LBR_INFO_29)
 MSR 0x00000DDE = 0x00000000:0x00000000 (IA32_LBR_INFO_30)
 MSR 0x00000DDF = 0x00000000:0x00000000 (IA32_LBR_INFO_31)

====================== UNIQUE MSRs  (core 11) ======================
 MSR 0x00000000 = 0x00000000:0x00000FFF (IA32_P5_MC_ADDR)
 MSR 0x00000001 = 0x00000000:0x00000000 (IA32_P5_MC_TYPE)
 MSR 0x00000006 = 0x00000000:0x00000040 (IA32_MONITOR_FILTER_SIZE)
 MSR 0x00000010 = 0x00000285:0x55ADDDA0 (IA32_TIME_STAMP_COUNTER)
 MSR 0x0000001B = 0x00000000:0xFEE00C00 (IA32_APIC_BASE)
 MSR 0x00000034 = 0x00000000:0x0000066C (MSR_SMI_COUNT)
 MSR 0x0000003A = 0x00000000:0x00020005 (IA32_FEATURE_CONTROL)
 MSR 0x0000008B = 0x000000DE:0x00000000 (IA32_BIOS_SIGN_ID)
 MSR 0x000000C1 = 0x00000000:0x00000000 (IA32_PMC0)
 MSR 0x000000C2 = 0x00000000:0x00000000 (IA32_PMC1)
 MSR 0x000000C3 = 0x00000000:0x00000000 (IA32_PMC2)
 MSR 0x000000C4 = 0x00000000:0x00000000 (IA32_PMC3)
 MSR 0x000000E2 = 0x00000000:0x1C008007 (MSR_PKG_CST_CONFIG_CONTROL)
 MSR 0x000000E4 = 0x00000000:0x00051814 (MSR_PMG_IO_CAPTURE_BASE)
 MSR 0x000000E7 = 0x00000040:0x4AEFD099 (IA32_MPERF)
 MSR 0x000000E8 = 0x0000004B:0xD0A8D605 (IA32_APERF)
 MSR 0x000000FE = 0x00000000:0x00001D0A (IA32_MTRRCAP)
 MSR 0x0000013C = 0x00000000:0x00000001 (MSR_FEATURE_CONFIG)
 MSR 0x00000174 = 0x00000000:0x00000010 (IA32_SYSENTER_CS)
 MSR 0x00000175 = 0xFFFFFE00:0x0024A000 (IA32_SYSENTER_ESP)
 MSR 0x00000176 = 0xFFFFFFFF:0x8B201580 (IA32_SYSENTER_EIP)
 MSR 0x00000179 = 0x00000000:0x00000C0C (IA32_MCG_CAP)
 MSR 0x0000017A = 0x00000000:0x00000000 (IA32_MCG_STATUS)
 MSR 0x00000186 = 0x00000000:0x00000000 (IA32_PERFEVTSEL0)
 MSR 0x00000187 = 0x00000000:0x00000000 (IA32_PERFEVTSEL1)
 MSR 0x00000188 = 0x00000000:0x00000000 (IA32_PERFEVTSEL2)
 MSR 0x00000189 = 0x00000000:0x00000000 (IA32_PERFEVTSEL3)
 MSR 0x00000199 = 0x00000000:0x00000800 (IA32_PERF_CTL)
 MSR 0x0000019A = 0x00000000:0x00000000 (IA32_CLOCK_MODULATION)
 MSR 0x0000019B = 0x00000000:0x00000013 (IA32_THERM_INTERRUPT)
 MSR 0x0000019C = 0x00000000:0x88140802 (IA32_THERM_STATUS)
 MSR 0x000001A0 = 0x00000000:0x00850089 (IA32_MISC_ENABLE)
 MSR 0x000001A4 = 0x00000000:0x00000000 (IA32_MISC_FEATURE_CONTROL)
 MSR 0x000001A6 = 0x00000000:0x00000000 (MSR_OFFCORE_RSP_0)
 MSR 0x000001A7 = 0x00000000:0x00000000 (MSR_OFFCORE_RSP_1)
 MSR 0x000001C8 = 0x00000000:0x00000000 (MSR_LBR_SELECT)
 MSR 0x000001C9 = 0x00000000:0x00000000 (MSR_LASTBRANCH_TOS)
 MSR 0x000001D9 = 0x00000000:0x00000000 (IA32_DEBUGCTL)
 MSR 0x000001DD = 0x00000000:0x00000000 (MSR_LER_FROM_LIP)
 MSR 0x000001DE = 0x00000000:0x00000000 (MSR_LER_TO_LIP)
 MSR 0x000001F2 = 0x00000000:0x9A000006 (IA32_SMRR_PHYSBASE)
 MSR 0x000001F3 = 0x00000000:0xFF000800 (IA32_SMRR_PHYSMASK)
 MSR 0x000001F4 = 0x00000000:0x99F00006 (MSR_PRMRR_PHYS_BASE)
 MSR 0x000001F5 = 0x0000007F:0xFFF00C00 (MSR_PRMRR_PHYS_MASK)
 MSR 0x000001FB = 0x00000000:0x000000E1 (MSR_PRMRR_VALID_CONFIG)
 MSR 0x000001FC = 0x00000000:0x002C005D (MSR_POWER_CTL)
 MSR 0x00000200 = 0x00000000:0xC0000000 (IA32_MTRR_PHYSBASE0)
 MSR 0x00000201 = 0x0000007F:0xC0000800 (IA32_MTRR_PHYSBASE0)
 MSR 0x00000202 = 0x00000000:0xA0000000 (IA32_MTRR_PHYSBASE1)
 MSR 0x00000203 = 0x0000007F:0xE0000800 (IA32_MTRR_PHYSBASE1)
 MSR 0x00000204 = 0x00000000:0x9C000000 (IA32_MTRR_PHYSBASE2)
 MSR 0x00000205 = 0x0000007F:0xFC000800 (IA32_MTRR_PHYSBASE2)
 MSR 0x00000206 = 0x00000000:0x9B000000 (IA32_MTRR_PHYSBASE3)
 MSR 0x00000207 = 0x0000007F:0xFF000800 (IA32_MTRR_PHYSBASE3)
 MSR 0x00000208 = 0x00000020:0x00000000 (IA32_MTRR_PHYSBASE4)
 MSR 0x00000209 = 0x00000060:0x00000800 (IA32_MTRR_PHYSBASE4)
 MSR 0x0000020A = 0x00000010:0x00000000 (IA32_MTRR_PHYSBASE5)
 MSR 0x0000020B = 0x00000070:0x00000800 (IA32_MTRR_PHYSBASE5)
 MSR 0x0000020C = 0x00000040:0x00000000 (IA32_MTRR_PHYSBASE6)
 MSR 0x0000020D = 0x00000040:0x00000800 (IA32_MTRR_PHYSBASE6)
 MSR 0x0000020E = 0x00000004:0x00000006 (IA32_MTRR_PHYSBASE7)
 MSR 0x0000020F = 0x00000000:0x00000000 (IA32_MTRR_PHYSBASE7)
 MSR 0x00000210 = 0x00000008:0x00000006 (IA32_MTRR_PHYSBASE8)
 MSR 0x00000211 = 0x00000000:0x00000000 (IA32_MTRR_PHYSBASE8)
 MSR 0x00000212 = 0x00000000:0x00000000 (IA32_MTRR_PHYSBASE9)
 MSR 0x00000213 = 0x00000000:0x00000000 (IA32_MTRR_PHYSBASE9)
 MSR 0x00000250 = 0x06060606:0x06060606 (IA32_MTRR_FIX64K_00000)
 MSR 0x00000258 = 0x06060606:0x06060606 (IA32_MTRR_FIX16K_80000)
 MSR 0x00000259 = 0x00000000:0x00000000 (IA32_MTRR_FIX16K_A0000)
 MSR 0x00000268 = 0x05050505:0x05050505 (IA32_MTRR_FIX4K_C0000)
 MSR 0x00000269 = 0x05050505:0x05050505 (IA32_MTRR_FIX4K_C8000)
 MSR 0x0000026A = 0x05050505:0x05050505 (IA32_MTRR_FIX4K_D0000)
 MSR 0x0000026B = 0x05050505:0x05050505 (IA32_MTRR_FIX4K_D8000)
 MSR 0x0000026C = 0x05050505:0x05050505 (IA32_MTRR_FIX4K_E0000)
 MSR 0x0000026D = 0x05050505:0x05050505 (IA32_MTRR_FIX4K_E8000)
 MSR 0x0000026E = 0x05050505:0x05050505 (IA32_MTRR_FIX4K_F0000)
 MSR 0x0000026F = 0x05050505:0x05050505 (IA32_MTRR_FIX4K_F8000)
 MSR 0x00000277 = 0x04070506:0x00070106 (IA32_PAT)
 MSR 0x00000280 = 0x00000000:0x40000001 (IA32_MC0_CTL2)
 MSR 0x00000281 = 0x00000000:0x40000001 (IA32_MC1_CTL2)
 MSR 0x00000282 = 0x00000000:0x40000001 (IA32_MC2_CTL2)
 MSR 0x00000283 = 0x00000000:0x40000001 (IA32_MC3_CTL2)
 MSR 0x000002FF = 0x00000000:0x00000C06 (IA32_MTRR_DEF_TYPE)
 MSR 0x00000309 = 0x00000000:0x00000000 (IA32_FIXED_CTR0)
 MSR 0x0000030A = 0x0000FFFD:0x6476E567 (IA32_FIXED_CTR1)
 MSR 0x0000030B = 0x00000000:0x00000000 (IA32_FIXED_CTR2)
 MSR 0x00000345 = 0x00000000:0x000033C5 (IA32_PERF_CAPABILITIES)
 MSR 0x0000038D = 0x00000000:0x000000B0 (IA32_FIXED_CTR_CTRL)
 MSR 0x0000038E = 0x00000000:0x00000000 (IA32_PERF_GLOBAL_STATUS)
 MSR 0x0000038F = 0x00000007:0x0000000F (IA32_PERF_GLOBAL_CTRL)
 MSR 0x00000390 = 0x00000000:0x00000000 (IA32_PERF_GLOBAL_STATUS_RESET)
 MSR 0x00000391 = 0x00000000:0x00000000 (IA32_PERF_GLOBAL_STATUS_SET)
 MSR 0x000003F1 = 0x00000000:0x00000000 (MSR_PEBS_ENABLE)
 MSR 0x000003F6 = 0x00000000:0x0000FFFF (MSR_PEBS_LD_LAT)
 MSR 0x000003F7 = 0x00000000:0x00000800 (MSR_PEBS_FRONTEND)
 MSR 0x000003FC = 0x00000002:0x09EECCA6 (MSR_CORE_C3_RESIDENCY)
 MSR 0x000003FD = 0x00000013:0x8932C838 (MSR_CORE_C6_RESIDENCY)
 MSR 0x000003FE = 0x000001A0:0x3F98A156 (MSR_CORE_C7_RESIDENCY)
 MSR 0x00000400 = 0x00000000:0x00000FFF (IA32_MC0_CTL)
 MSR 0x00000401 = 0x00000000:0x00000000 (IA32_MC0_STATUS)
 MSR 0x00000402 = 0x00000000:0x00000000 (IA32_MC0_ADDR)
 MSR 0x00000403 = 0x00000000:0x00000000 (IA32_MC0_MISC)
 MSR 0x00000404 = 0x00000000:0x0000000F (IA32_MC1_CTL)
 MSR 0x00000405 = 0x00000000:0x00000000 (IA32_MC1_STATUS)
 MSR 0x00000406 = 0x00000000:0x00000000 (IA32_MC1_ADDR)
 MSR 0x00000407 = 0x00000000:0x00000000 (IA32_MC1_MISC)
 MSR 0x00000408 = 0x00000000:0x0000000F (IA32_MC2_CTL)
 MSR 0x00000409 = 0x00000000:0x00000000 (IA32_MC2_STATUS)
 MSR 0x0000040A = 0x00000000:0x00000000 (IA32_MC2_ADDR)
 MSR 0x0000040C = 0x00000000:0x0000001F (IA32_MC3_CTL)
 MSR 0x0000040D = 0x00000000:0x00000000 (IA32_MC3_STATUS)
 MSR 0x0000040E = 0x00000000:0x00000000 (IA32_MC3_ADDR)
 MSR 0x00000410 = 0x00000000:0x0000003F (IA32_MC4_CTL)
 MSR 0x00000411 = 0x00000000:0x00000000 (IA32_MC4_STATUS)
 MSR 0x00000480 = 0x00DA0400:0x00000004 (IA32_VMX_BASIC)
 MSR 0x00000481 = 0x0000007F:0x00000016 (IA32_VMX_PINBASED_CTLS)
 MSR 0x00000482 = 0xFFF9FFFE:0x0401E172 (IA32_VMX_PROCBASED_CTLS)
 MSR 0x00000483 = 0x01FFFFFF:0x00036DFF (IA32_VMX_EXIT_CTLS)
 MSR 0x00000484 = 0x0003FFFF:0x000011FF (IA32_VMX_ENTRY_CTLS)
 MSR 0x00000485 = 0x00000000:0x7004C1E7 (IA32_VMX_MISC)
 MSR 0x00000486 = 0x00000000:0x80000021 (IA32_VMX_CR0_FIXED0)
 MSR 0x00000487 = 0x00000000:0xFFFFFFFF (IA32_VMX_CR0_FIXED1)
 MSR 0x00000488 = 0x00000000:0x00002000 (IA32_VMX_CR4_FIXED0)
 MSR 0x00000489 = 0x00000000:0x003727FF (IA32_VMX_CR4_FIXED1)
 MSR 0x0000048A = 0x00000000:0x0000002E (IA32_VMX_VMCS_ENUM)
 MSR 0x0000048B = 0x005FBCFF:0x00000000 (IA32_VMX_PROCBASED_CTLS2)
 MSR 0x0000048C = 0x00000F01:0x06734141 (IA32_VMX_EPT_VPID_ENUM)
 MSR 0x0000048D = 0x0000007F:0x00000016 (IA32_VMX_TRUE_PINBASED_CTLS)
 MSR 0x0000048E = 0xFFF9FFFE:0x04006172 (IA32_VMX_TRUE_PROCBASED_CTLS)
 MSR 0x0000048F = 0x01FFFFFF:0x00036DFB (IA32_VMX_TRUE_EXIT_CTLS)
 MSR 0x00000490 = 0x0003FFFF:0x000011FB (IA32_VMX_TRUE_ENTRY_CTLS)
 MSR 0x000004C1 = 0x00000000:0x00000000 (IA32_A_PMC0)
 MSR 0x000004C2 = 0x00000000:0x00000000 (IA32_A_PMC1)
 MSR 0x000004C3 = 0x00000000:0x00000000 (IA32_A_PMC2)
 MSR 0x000004C4 = 0x00000000:0x00000000 (IA32_A_PMC3)
 MSR 0x00000500 = 0x0000000E:0x00000000 (IA32_SGX_SVN_STATUS)
 MSR 0x00000560 = 0x00000000:0x00000000 (IA32_RTIT_OUTPUT_BASE)
 MSR 0x00000561 = 0x00000000:0x0000007F (IA32_RTIT_OUTPUT_MASK_PTRS)
 MSR 0x00000570 = 0x00000000:0x00000000 (IA32_RTIT_CTL)
 MSR 0x00000571 = 0x00000000:0x00000000 (IA32_RTIT_STATUS)
 MSR 0x00000572 = 0x00000000:0x00000000 (IA32_RTIT_CR3_MATCH)
 MSR 0x00000580 = 0x00000000:0x00000000 (IA32_RTIT_ADDR0_A)
 MSR 0x00000581 = 0x00000000:0x00000000 (IA32_RTIT_ADDR0_B)
 MSR 0x00000582 = 0x00000000:0x00000000 (IA32_RTIT_ADDR1_A)
 MSR 0x00000583 = 0x00000000:0x00000000 (IA32_RTIT_ADDR1_B)
 MSR 0x00000600 = 0xFFFFFE00:0x0025C000 (IA32_DS_AREA)
 MSR 0x0000064E = 0x00000047:0xD9BE66DB (MSR_PPERF)
 MSR 0x00000653 = 0x00000000:0x00000000 (MSR_CORE_HDC_RESIDENCY)
 MSR 0x00000690 = 0x00000000:0x00000000 (MSR_LASTBRANCH_16_FROM_IP)
 MSR 0x00000691 = 0x00000000:0x00000000 (MSR_LASTBRANCH_17_FROM_IP)
 MSR 0x00000692 = 0x00000000:0x00000000 (MSR_LASTBRANCH_18_FROM_IP)
 MSR 0x00000693 = 0x00000000:0x00000000 (MSR_LASTBRANCH_19_FROM_IP)
 MSR 0x00000694 = 0x00000000:0x00000000 (MSR_LASTBRANCH_20_FROM_IP)
 MSR 0x00000695 = 0x00000000:0x00000000 (MSR_LASTBRANCH_21_FROM_IP)
 MSR 0x00000696 = 0x00000000:0x00000000 (MSR_LASTBRANCH_22_FROM_IP)
 MSR 0x00000697 = 0x00000000:0x00000000 (MSR_LASTBRANCH_23_FROM_IP)
 MSR 0x00000698 = 0x00000000:0x00000000 (MSR_LASTBRANCH_24_FROM_IP)
 MSR 0x00000699 = 0x00000000:0x00000000 (MSR_LASTBRANCH_25_FROM_IP)
 MSR 0x0000069A = 0x00000000:0x00000000 (MSR_LASTBRANCH_26_FROM_IP)
 MSR 0x0000069B = 0x00000000:0x00000000 (MSR_LASTBRANCH_27_FROM_IP)
 MSR 0x0000069C = 0x00000000:0x00000000 (MSR_LASTBRANCH_28_FROM_IP)
 MSR 0x0000069D = 0x00000000:0x00000000 (MSR_LASTBRANCH_29_FROM_IP)
 MSR 0x0000069E = 0x00000000:0x00000000 (MSR_LASTBRANCH_30_FROM_IP)
 MSR 0x0000069F = 0x00000000:0x00000000 (MSR_LASTBRANCH_31_FROM_IP)
 MSR 0x000006D0 = 0x00000000:0x00000000 (MSR_LASTBRANCH_16_TO_IP)
 MSR 0x000006D1 = 0x00000000:0x00000000 (MSR_LASTBRANCH_17_TO_IP)
 MSR 0x000006D2 = 0x00000000:0x00000000 (MSR_LASTBRANCH_18_TO_IP)
 MSR 0x000006D3 = 0x00000000:0x00000000 (MSR_LASTBRANCH_19_TO_IP)
 MSR 0x000006D4 = 0x00000000:0x00000000 (MSR_LASTBRANCH_20_TO_IP)
 MSR 0x000006D5 = 0x00000000:0x00000000 (MSR_LASTBRANCH_21_TO_IP)
 MSR 0x000006D6 = 0x00000000:0x00000000 (MSR_LASTBRANCH_22_TO_IP)
 MSR 0x000006D7 = 0x00000000:0x00000000 (MSR_LASTBRANCH_23_TO_IP)
 MSR 0x000006D8 = 0x00000000:0x00000000 (MSR_LASTBRANCH_24_TO_IP)
 MSR 0x000006D9 = 0x00000000:0x00000000 (MSR_LASTBRANCH_25_TO_IP)
 MSR 0x000006DA = 0x00000000:0x00000000 (MSR_LASTBRANCH_26_TO_IP)
 MSR 0x000006DB = 0x00000000:0x00000000 (MSR_LASTBRANCH_27_TO_IP)
 MSR 0x000006DC = 0x00000000:0x00000000 (MSR_LASTBRANCH_28_TO_IP)
 MSR 0x000006DD = 0x00000000:0x00000000 (MSR_LASTBRANCH_29_TO_IP)
 MSR 0x000006DE = 0x00000000:0x00000000 (MSR_LASTBRANCH_30_TO_IP)
 MSR 0x000006DF = 0x00000000:0x00000000 (MSR_LASTBRANCH_31_TO_IP)
 MSR 0x000006E0 = 0x00000285:0x564D81D2 (IA32_TSC_DEADLINE)
 MSR 0x00000771 = 0x00000000:0x010B1A2D (IA32_HWP_CAPABILITIES)
 MSR 0x00000773 = 0x00000000:0x00000000 (IA32_HWP_INTERRUPT)
 MSR 0x00000774 = 0x00000000:0x80002D08 (IA32_HWP_REQUEST)
 MSR 0x00000777 = 0x00000000:0x00000000 (IA32_HWP_STATUS)
 MSR 0x00000D90 = 0x00000000:0x00000000 (IA32_BNDCFGS)
 MSR 0x00000DA0 = 0x00000000:0x00000000 (IA32_XSS)
 MSR 0x00000DB1 = 0x00000000:0x00000001 (IA32_PM_CTL1)
 MSR 0x00000DB2 = 0x00000000:0x00000000 (IA32_THREAD_STALL)
 MSR 0x00000DC0 = 0x00000000:0x00000000 (IA32_LBR_INFO_0)
 MSR 0x00000DC1 = 0x00000000:0x00000000 (IA32_LBR_INFO_1)
 MSR 0x00000DC2 = 0x00000000:0x00000000 (IA32_LBR_INFO_2)
 MSR 0x00000DC3 = 0x00000000:0x00000000 (IA32_LBR_INFO_3)
 MSR 0x00000DC4 = 0x00000000:0x00000000 (IA32_LBR_INFO_4)
 MSR 0x00000DC5 = 0x00000000:0x00000000 (IA32_LBR_INFO_5)
 MSR 0x00000DC6 = 0x00000000:0x00000000 (IA32_LBR_INFO_6)
 MSR 0x00000DC7 = 0x00000000:0x00000000 (IA32_LBR_INFO_7)
 MSR 0x00000DC8 = 0x00000000:0x00000000 (IA32_LBR_INFO_8)
 MSR 0x00000DC9 = 0x00000000:0x00000000 (IA32_LBR_INFO_9)
 MSR 0x00000DCA = 0x00000000:0x00000000 (IA32_LBR_INFO_10)
 MSR 0x00000DCB = 0x00000000:0x00000000 (IA32_LBR_INFO_11)
 MSR 0x00000DCC = 0x00000000:0x00000000 (IA32_LBR_INFO_12)
 MSR 0x00000DCD = 0x00000000:0x00000000 (IA32_LBR_INFO_13)
 MSR 0x00000DCE = 0x00000000:0x00000000 (IA32_LBR_INFO_14)
 MSR 0x00000DCF = 0x00000000:0x00000000 (IA32_LBR_INFO_15)
 MSR 0x00000DD0 = 0x00000000:0x00000000 (IA32_LBR_INFO_16)
 MSR 0x00000DD1 = 0x00000000:0x00000000 (IA32_LBR_INFO_17)
 MSR 0x00000DD2 = 0x00000000:0x00000000 (IA32_LBR_INFO_18)
 MSR 0x00000DD3 = 0x00000000:0x00000000 (IA32_LBR_INFO_19)
 MSR 0x00000DD4 = 0x00000000:0x00000000 (IA32_LBR_INFO_20)
 MSR 0x00000DD5 = 0x00000000:0x00000000 (IA32_LBR_INFO_21)
 MSR 0x00000DD6 = 0x00000000:0x00000000 (IA32_LBR_INFO_22)
 MSR 0x00000DD7 = 0x00000000:0x00000000 (IA32_LBR_INFO_23)
 MSR 0x00000DD8 = 0x00000000:0x00000000 (IA32_LBR_INFO_24)
 MSR 0x00000DD9 = 0x00000000:0x00000000 (IA32_LBR_INFO_25)
 MSR 0x00000DDA = 0x00000000:0x00000000 (IA32_LBR_INFO_26)
 MSR 0x00000DDB = 0x00000000:0x00000000 (IA32_LBR_INFO_27)
 MSR 0x00000DDC = 0x00000000:0x00000000 (IA32_LBR_INFO_28)
 MSR 0x00000DDD = 0x00000000:0x00000000 (IA32_LBR_INFO_29)
 MSR 0x00000DDE = 0x00000000:0x00000000 (IA32_LBR_INFO_30)
 MSR 0x00000DDF = 0x00000000:0x00000000 (IA32_LBR_INFO_31)



============= AMBs ============


============= SPI / BIOS CNTL =============

Error: Dumping SPI on this southbridge is not (yet) supported.

============= AHCI Registers ==============


============= AHCI Configuration Registers ==============


============= SATA Initialization Registers ==============


============= ABAR ==============

ABAR = 0xb441e000 (MEM)

Generic Host Control Registers:
0x000: 0xe534ff40 (CAP)
0x004: 0x80000002 (GHC)
0x008: 0x00000000 (IS)
0x00c: 0x00000010 (PI)
0x010: 0x00010301 (VS)
0x014: 0x00000000 (CCC_CTL)
0x018: 0x00000000 (CCC_PORTS)
0x01c: 0x01600002 (EM_LOC)
0x020: 0x07010300 (EM_CTL)
0x024: 0x0000003c (CAP2)
0x028: 0x00000000 (BOHC)
0x0a0: 0x00000078 (Reserved)
0x0a4: 0x000f0000 (Reserved)
0x0c0: 0x0031a353 (Reserved)
0x0c4: 0x0000001f (Reserved)
0x0c8: 0x000000c0 (Reserved)

Port 4 Control Registers:
0x300: 0xfffe0000 (PxCLB)
0x304: 0x00000000 (PxCLBU)
0x308: 0xfffe0400 (PxFB)
0x30c: 0x00000000 (PxFBU)
0x310: 0x00000000 (PxIS)
0x314: 0x7840007f (PxIE)
0x318: 0x00004016 (PxCMD)
0x31c: 0x00000000 (Reserved)
0x320: 0x0000007f (PxTFD)
0x324: 0xffffffff (PxSIG)
0x328: 0x00000004 (PxSSTS)
0x32c: 0x00000300 (PxSCTL)
0x330: 0x00000000 (PxSERR)
0x334: 0x00000000 (PxSACT)
0x338: 0x00000000 (PxCI)
0x33c: 0x00000000 (PxSNTF)
0x340: 0x00000000 (PxFBS)
0x344: 0x00000000 (PxDEVSLP)
0x348: 0x00000000 (Reserved)

Other registers:

============= Dumping INTEL SGX status =============
Number of CPUs = 12
------------- CPU 0 ----------------
SGX supported             : YES
SGX enabled               : NO
Feature Control locked    : YES
------------- CPU 1 ----------------
SGX supported             : YES
SGX enabled               : NO
Feature Control locked    : YES
------------- CPU 2 ----------------
SGX supported             : YES
SGX enabled               : NO
Feature Control locked    : YES
------------- CPU 3 ----------------
SGX supported             : YES
SGX enabled               : NO
Feature Control locked    : YES
------------- CPU 4 ----------------
SGX supported             : YES
SGX enabled               : NO
Feature Control locked    : YES
------------- CPU 5 ----------------
SGX supported             : YES
SGX enabled               : NO
Feature Control locked    : YES
------------- CPU 6 ----------------
SGX supported             : YES
SGX enabled               : NO
Feature Control locked    : YES
------------- CPU 7 ----------------
SGX supported             : YES
SGX enabled               : NO
Feature Control locked    : YES
------------- CPU 8 ----------------
SGX supported             : YES
SGX enabled               : NO
Feature Control locked    : YES
------------- CPU 9 ----------------
SGX supported             : YES
SGX enabled               : NO
Feature Control locked    : YES
------------- CPU 10 ----------------
SGX supported             : YES
SGX enabled               : NO
Feature Control locked    : YES
------------- CPU 11 ----------------
SGX supported             : YES
SGX enabled               : NO
Feature Control locked    : YES
====================================================

============= Dumping INTEL TME status =============
TME supported : NO
====================================================
